Category;Subcategory;Fact;Support;Opposition
Family;Automatic co-parent recognition;"Στην Ελλάδα, τα παιδιά που γεννιούνται από ζευγάρια αναγνωρίζονται αυτομάτως νομικά από τη γέννησή τους ως παιδιά και των δύο γονέων, ανεξαρτήτως του σεξουαλικού προσανατολισμού ή/και της ταυτότητας φύλου των συντρόφων;";"Στην Ελλάδα, θα πρέπει τα παιδιά που γεννιούνται από ζευγάρια να αναγνωρίζονται αυτομάτως από τη γέννησή τους ως παιδιά και των δύο γονέων, ανεξάρτητα από τον σεξουαλικό προσανατολισμό και/ή την ταυτότητα φύλου των συντρόφων;";"Στην Ελλάδα, τα παιδιά που γεννιούνται από ζευγάρια δεν θα πρέπει να αναγνωρίζονται αυτομάτως νομικά από τη γέννησή τους ως παιδιά και των δύο γονέων, ανάλογα με τον σεξουαλικό προσανατολισμό ή/και την ταυτότητα φύλου των συντρόφων;"
Family;Medically assisted insemination (couples);"Στην Ελλάδα, τα ζευγάρια (ανεξάρτητα από τον σεξουαλικό προσανατολισμό ή/και την ταυτότητα φύλου των συντρόφων) δεν αντιμετωπίζουν νομικά εμπόδια στην πρόσβαση σε θεραπεία γονιμότητας;";"Στην Ελλάδα, θα πρέπει τα ζευγάρια (ανεξάρτητα από τον σεξουαλικό προσανατολισμό ή/και την ταυτότητα φύλου των συντρόφων) να μην αντιμετωπίζουν νομικά εμπόδια στην πρόσβαση σε θεραπεία γονιμότητας;";"Στην Ελλάδα, θα πρέπει τα ζευγάρια (ανεξάρτητα από τον σεξουαλικό προσανατολισμό ή/και την ταυτότητα φύλου των συντρόφων) να αντιμετωπίζουν νομικά εμπόδια στην πρόσβαση σε θεραπεία γονιμότητας;"
Family;Medically assisted insemination (singles);"Στην Ελλάδα, είναι νομικά δυνατή η θεραπεία γονιμότητας για άτομα ανεξάρτητα από τον σεξουαλικό προσανατολισμό ή/και την ταυτότητα φύλου των ατόμων;";"Στην Ελλάδα, θα πρέπει να είναι νομικά δυνατή η θεραπεία γονιμότητας για άτομα ανεξάρτητα από τον σεξουαλικό προσανατολισμό και/ή την ταυτότητα φύλου των ατόμων;";"Στην Ελλάδα, θα πρέπει να είναι νομικά δυνατή η θεραπεία γονιμότητας για άτομα με βάση τον σεξουαλικό προσανατολισμό ή/και την ταυτότητα φύλου των ατόμων;"
Family;Recognition of trans parenthood;"Στην Ελλάδα, αναγνωρίζεται πλήρως η νομική ταυτότητα φύλου ενός τρανς γονέα και αντικατοπτρίζεται σωστά στην τεκμηρίωση της συγγένειας του παιδιού, και οι κανονισμοί για τη γονική ιδιότητα ευθυγραμμίζονται με όλες τις διαθέσιμες επιλογές φύλου (όταν υπάρχουν περισσότερα από δύο χαρακτηριστικά φύλου) σύμφωνα με την αναγνωρισμένη ταυτότητα φύλου του γονέα;";"Στην Ελλάδα, θα πρέπει η νομική ταυτότητα φύλου ενός τρανς γονέα να αναγνωρίζεται πλήρως και να αντικατοπτρίζεται στην τεκμηρίωση της συγγένειας του παιδιού, και θα πρέπει οι κανονισμοί σχετικά με τη γονική ιδιότητα να ευθυγραμμίζονται με όλες τις διαθέσιμες επιλογές φύλου (όταν υπάρχουν περισσότερα από δύο χαρακτηριστικά φύλου) σύμφωνα με την αναγνωρισμένη ταυτότητα φύλου του γονέα;";"Στην Ελλάδα, θα πρέπει να μην αναγνωρίζεται η νομική ταυτότητα φύλου των τρανς γονέων και να μην αποτυπώνεται σωστά στην τεκμηρίωση της συγγένειας σύμφωνα με την αναγνωρισμένη ταυτότητα φύλου του γονέα;"
Hate crime & hate speech;Hate crime law (sexual orientation);"Στην Ελλάδα, περιλαμβάνεται ρητά ο σεξουαλικός προσανατολισμός στη νομοθεσία περί εγκλημάτων μίσους ως επιβαρυντικός παράγοντας;";"Στην Ελλάδα, θα πρέπει ο σεξουαλικός προσανατολισμός να συμπεριληφθεί ρητά στη νομοθεσία για τα εγκλήματα μίσους ως επιβαρυντικός παράγοντας;";"Στην Ελλάδα, θα πρέπει να εξαιρεθεί ο σεξουαλικός προσανατολισμός από τη νομοθεσία περί εγκλημάτων μίσους ως επιβαρυντικός παράγοντας;"
Hate crime & hate speech;Hate speech law (sexual orientation);"Στην Ελλάδα, περιλαμβάνεται ρητά ο σεξουαλικός προσανατολισμός στη νομοθεσία περί ρητορικής μίσους ως επιβαρυντικός παράγοντας;";"Στην Ελλάδα, θα πρέπει ο σεξουαλικός προσανατολισμός να συμπεριληφθεί ρητά στη νομοθεσία περί ρητορικής μίσους ως επιβαρυντικός παράγοντας;";"Στην Ελλάδα, θα πρέπει να εξαιρεθεί ο σεξουαλικός προσανατολισμός από τη νομοθεσία περί ρητορικής μίσους ως επιβαρυντικός παράγοντας;"
Hate crime & hate speech;Policy tackling hatred (sexual orientation);"Στην Ελλάδα, περιλαμβάνεται ρητά ο σεξουαλικός προσανατολισμός σε μια εθνική στρατηγική για την αντιμετώπιση των εγκλημάτων μίσους και της ρητορικής μίσους, ως μέρος ενός επαναλαμβανόμενου πλαισίου από τους κρατικούς φορείς;";"Στην Ελλάδα, θα πρέπει ο σεξουαλικός προσανατολισμός να συμπεριληφθεί ρητά σε μια εθνική στρατηγική για την αντιμετώπιση των εγκλημάτων μίσους και της ρητορικής μίσους, ως μέρος ενός επαναλαμβανόμενου πλαισίου από τους κρατικούς φορείς;";"Στην Ελλάδα, θα πρέπει να εξαιρεθεί ο σεξουαλικός προσανατολισμός από μια εθνική στρατηγική για την αντιμετώπιση των εγκλημάτων μίσους και της ρητορικής μίσους;"
Hate crime & hate speech;Hate crime law (gender identity);"Στην Ελλάδα, η ταυτότητα φύλου περιλαμβάνεται ρητά στη νομοθεσία περί εγκλημάτων μίσους ως επιβαρυντικός παράγοντας;";"Στην Ελλάδα, θα πρέπει η ταυτότητα φύλου να συμπεριληφθεί ρητά στη νομοθεσία για τα εγκλήματα μίσους ως επιβαρυντικός παράγοντας;";"Στην Ελλάδα, θα πρέπει να εξαιρεθεί η ταυτότητα φύλου από τη νομοθεσία περί εγκλημάτων μίσους ως επιβαρυντικός παράγοντας;"
Hate crime & hate speech;Hate speech law (gender identity);"Στην Ελλάδα, η ταυτότητα φύλου περιλαμβάνεται ρητά στη νομοθεσία περί ρητορικής μίσους ως επιβαρυντικός παράγοντας;";"Στην Ελλάδα, θα πρέπει η ταυτότητα φύλου να συμπεριληφθεί ρητά στη νομοθεσία περί ρητορικής μίσους ως επιβαρυντικός παράγοντας;";"Στην Ελλάδα, θα πρέπει να εξαιρεθεί η ταυτότητα φύλου από τη νομοθεσία περί ρητορικής μίσους ως επιβαρυντικός παράγοντας;"
Hate crime & hate speech;Policy tackling hatred (gender identity);"Στην Ελλάδα, περιλαμβάνεται η ταυτότητα φύλου σε μια εθνική στρατηγική για την αντιμετώπιση των εγκλημάτων μίσους και της ρητορικής μίσους, ως μέρος ενός συνεχούς, συστηματικού και επίσημα οργανωμένου συνόλου μέτρων από το κράτος;";"Στην Ελλάδα, θα πρέπει η ταυτότητα φύλου να συμπεριληφθεί ρητά σε μια εθνική στρατηγική για την αντιμετώπιση των εγκλημάτων μίσους και της ρητορικής μίσους, ως μέρος ενός επαναλαμβανόμενου πλαισίου από τους κρατικούς φορείς;";"Στην Ελλάδα, θα πρέπει να εξαιρεθεί η ταυτότητα φύλου από την εθνική στρατηγική για την αντιμετώπιση των εγκλημάτων και της ρητορικής μίσους;"
Hate crime & hate speech;Hate crime law (intersex);"Στην Ελλάδα, τα (αντιληπτά) χαρακτηριστικά του φύλου ή η διαφυλική ιδιότητα περιλαμβάνονται ρητά στη νομοθεσία περί εγκλημάτων μίσους ως επιβαρυντικός παράγοντας;";"Στην Ελλάδα, θα πρέπει τα (αντιληπτά) χαρακτηριστικά του φύλου ή η διαφυλική κατάσταση να συμπεριληφθούν ρητά στη νομοθεσία για τα εγκλήματα μίσους ως επιβαρυντικός παράγοντας;";"Στην Ελλάδα, θα πρέπει τα (αντιληπτά) χαρακτηριστικά του φύλου ή η διαφυλική ιδιότητα να εξαιρεθούν από τη νομοθεσία περί εγκλημάτων μίσους ως επιβαρυντικός παράγοντας;"
Hate crime & hate speech;Hate speech law (sex characteristics);"Στην Ελλάδα, τα χαρακτηριστικά του φύλου ή η διαφυλική κατάσταση περιλαμβάνονται ρητά στη νομοθεσία περί ρητορικής μίσους ως επιβαρυντικός παράγοντας;";"Στην Ελλάδα, θα πρέπει να συμπεριληφθούν ρητά τα χαρακτηριστικά του φύλου ή η διαφυλική κατάσταση στη νομοθεσία περί ρητορικής μίσους ως επιβαρυντικός παράγοντας;";"Στην Ελλάδα, θα πρέπει να εξαιρεθούν τα χαρακτηριστικά φύλου ή η διαφυλική ιδιότητα από τη νομοθεσία περί ρητορικής μίσους ως επιβαρυντικός παράγοντας;"
Hate crime & hate speech;Policies tackling hatred (intersex);"Στην Ελλάδα, περιλαμβάνονται τα χαρακτηριστικά του φύλου ή η διαφυλική ιδιότητα σε μια εθνική στρατηγική για την αντιμετώπιση των εγκλημάτων μίσους και της ρητορικής μίσους, στο πλαίσιο μιας διαρκούς, συστηματικής και επίσημα οργανωμένης δέσμης μέτρων από το κράτος;";"Στην Ελλάδα, θα πρέπει να συμπεριληφθούν τα χαρακτηριστικά του φύλου ή η διαφυλική ιδιότητα σε μια εθνική στρατηγική για την αντιμετώπιση των εγκλημάτων μίσους και της ρητορικής μίσους, ως μέρος ενός επαναλαμβανόμενου πλαισίου από τους κρατικούς φορείς;";"Στην Ελλάδα, θα πρέπει να εξαιρεθούν τα χαρακτηριστικά φύλου ή η ίντερσεξ ιδιότητα από μια εθνική στρατηγική για την αντιμετώπιση των εγκλημάτων μίσους και της ρητορικής μίσους, ως μέρος ενός επαναλαμβανόμενου πλαισίου από κρατικούς φορείς;"
Legal gender recognition;No legal framework making legal gender recognition impossible;"Στην Ελλάδα, δεν υπάρχει καμία ρητή απαγόρευση ή νομικός περιορισμός που να καθιστά εντελώς αδύνατη τη νόμιμη αναγνώριση φύλου (ακόμη και αν οι διαδικασίες είναι επαχθείς, δύσκολες ή δεν υπάρχει καθορισμένη οδός);";"Στην Ελλάδα, δεν πρέπει να υπάρχει ρητή απαγόρευση ή νομικός περιορισμός που να καθιστά εντελώς αδύνατη τη νόμιμη αναγνώριση φύλου (ακόμη και αν οι διαδικασίες είναι επαχθείς, δύσκολες ή δεν υπάρχει καθορισμένη διαδρομή);";"Στην Ελλάδα, θα πρέπει να υπάρξει απαγόρευση ή νομικός περιορισμός που να καθιστά αδύνατη τη νομική αναγνώριση του φύλου;"
Legal gender recognition;Existence of legal measures;"Υπάρχουν στην Ελλάδα νομικά μέτρα για τη νομική αναγνώριση του φύλου;";"Στην Ελλάδα, θα πρέπει να θεσπιστούν νομικά μέτρα για τη νομική αναγνώριση του φύλου;";"Στην Ελλάδα, δεν θα έπρεπε να υπάρχουν νομικά μέτρα για τη νομική αναγνώριση του φύλου;"
Legal gender recognition;Existence of administrative procedures;"Υπάρχουν στην Ελλάδα διοικητικές διαδικασίες για τη νομική αναγνώριση του φύλου;";"Στην Ελλάδα, θα πρέπει να υπάρχουν διοικητικές διαδικασίες για τη νομική αναγνώριση του φύλου;";"Στην Ελλάδα, δεν θα έπρεπε να υπάρχουν διοικητικές διαδικασίες για τη νομική αναγνώριση του φύλου;"
Legal gender recognition;Name change;"Στην Ελλάδα, η νομοθεσία επιτρέπει την αλλαγή ονόματος χωρίς περιορισμούς;";"Στην Ελλάδα, θα πρέπει η νομοθεσία να επιτρέπει την αλλαγή ονόματος χωρίς περιορισμούς;";"Στην Ελλάδα, πρέπει η νομοθεσία να αρνηθεί την αλλαγή ονόματος ή να την επιτρέψει με περιορισμούς;"
Legal gender recognition;No age restriction (Name change);"Στην Ελλάδα, δεν υπάρχει ρητός ηλικιακός περιορισμός για τους ανηλίκους για να αλλάξουν το όνομά τους;";"Στην Ελλάδα, δεν πρέπει να υπάρχει ρητός ηλικιακός περιορισμός για τους ανηλίκους από το να αλλάζουν το όνομά τους;";"Στην Ελλάδα, πρέπει να υπάρχει ηλικιακός περιορισμός για την αλλαγή του ονόματος των ανηλίκων;"
Legal gender recognition;Self-determination;"Στην Ελλάδα, η νομική αναγνώριση του φύλου βασίζεται αποκλειστικά στην εκφρασμένη επιθυμία του ενδιαφερόμενου προσώπου, χωρίς να απαιτείται η εμπλοκή τρίτων και χωρίς να αντιμετωπίζεται η διαφυλική κατάσταση ή τα χαρακτηριστικά φύλου ως αντένδειξη;";"Στην Ελλάδα, θα πρέπει η νομική αναγνώριση του φύλου να βασίζεται αποκλειστικά στην εκφρασμένη επιθυμία του ενδιαφερόμενου προσώπου, χωρίς να απαιτείται η συμμετοχή τρίτων και χωρίς να αντιμετωπίζεται η διαφυλική κατάσταση ή τα χαρακτηριστικά φύλου ως αντένδειξη;";"Στην Ελλάδα, θα πρέπει η νομική αναγνώριση του φύλου να μη βασίζεται αποκλειστικά στην εκφρασμένη επιθυμία του ενδιαφερόμενου προσώπου, αλλά να απαιτεί τη συμμετοχή τρίτου, ενώ η διαφυλική κατάσταση ή τα χαρακτηριστικά φύλου αποτελούν αντένδειξη;"
Legal gender recognition;Non-binary recognition;"Στην Ελλάδα, είναι διαθέσιμη η αναγνώριση του μη δυαδικού φύλου είτε μέσω δημόσιου μητρώου που προσφέρει περισσότερους από δύο δείκτες φύλου, διαθέσιμο μόνο κατόπιν αιτήματος με συνεπή διαδικασία και χωρίς διακρίσεις, είτε χωρίς υποχρεωτική καταγραφή ενός δείκτη φύλου για όλους στο δημόσιο μητρώο;";"Στην Ελλάδα, θα πρέπει η αναγνώριση του μη δυαδικού φύλου να είναι διαθέσιμη είτε μέσω ενός δημόσιου μητρώου που να προσφέρει περισσότερους από δύο δείκτες φύλου και να είναι διαθέσιμη μόνο κατόπιν αιτήματος με μια συνεπή διαδικασία και χωρίς διακρίσεις, είτε μέσω της μη υποχρεωτικής καταχώρησης ενός δείκτη φύλου σε όλους στο δημόσιο μητρώο;";"Στην Ελλάδα, θα πρέπει να μην είναι διαθέσιμη η αναγνώριση του μη δυαδικού φύλου είτε μέσω ενός δημόσιου μητρώου που να προσφέρει περισσότερες από δύο επιλογές δείκτη φύλου είτε μέσω της απουσίας υποχρεωτικής καταγραφής του δείκτη φύλου στο δημόσιο μητρώο;"
Legal gender recognition;No 'Gender Identity Disorder' diagnosis/psychological opinion required;"Στην Ελλάδα, δεν απαιτείται διάγνωση/ψυχολογική γνωμάτευση διαταραχής ταυτότητας φύλου για τη νομική αναγνώριση φύλου;";"Στην Ελλάδα, θα πρέπει να μην απαιτείται διάγνωση/ψυχολογική γνωμάτευση για τη νομική αναγνώριση του φύλου;";"Στην Ελλάδα, θα πρέπει να απαιτείται διάγνωση/ψυχολογική γνωμάτευση για τη νομική αναγνώριση του φύλου;"
Legal gender recognition;No compulsory medical intervention required;"Στην Ελλάδα, δεν απαιτούνται μη χειρουργικές ιατρικές παρεμβάσεις για τη νομική αναγνώριση του φύλου;";"Στην Ελλάδα, θα πρέπει να μην απαιτούνται μη χειρουργικές ιατρικές παρεμβάσεις για τη νομική αναγνώριση του φύλου;";"Στην Ελλάδα, θα πρέπει να απαιτούνται μη χειρουργικές ιατρικές παρεμβάσεις για τη νομική αναγνώριση του φύλου;"
Legal gender recognition;No compulsory surgical intervention required;"Στην Ελλάδα, δεν απαιτούνται χειρουργικές ιατρικές επεμβάσεις για τη νομική αναγνώριση του φύλου;";"Στην Ελλάδα, θα πρέπει να μην απαιτούνται χειρουργικές ιατρικές παρεμβάσεις για τη νομική αναγνώριση του φύλου;";"Στην Ελλάδα, θα πρέπει να απαιτούνται χειρουργικές ιατρικές επεμβάσεις για τη νομική αναγνώριση του φύλου;"
Legal gender recognition;No compulsory sterilisation required;"Στην Ελλάδα, δεν απαιτείται στείρωση ή απόδειξη υπογονιμότητας για τη νομική αναγνώριση του φύλου;";"Στην Ελλάδα, θα πρέπει να μην απαιτείται στείρωση ή απόδειξη υπογονιμότητας για τη νομική αναγνώριση του φύλου;";"Στην Ελλάδα, θα πρέπει να απαιτείται στείρωση ή απόδειξη υπογονιμότητας για τη νομική αναγνώριση του φύλου;"
Legal gender recognition;No compulsory divorce required;"Στην Ελλάδα, δεν απαιτείται διαζύγιο ή ανύπαντρη ιδιότητα για τη νομική αναγνώριση του φύλου;";"Στην Ελλάδα, θα πρέπει να μην απαιτείται διαζύγιο ή ανύπαντρη ιδιότητα για τη νομική αναγνώριση του φύλου;";"Στην Ελλάδα, θα πρέπει να απαιτείται διαζύγιο ή ανύπαντρη ιδιότητα για τη νομική αναγνώριση του φύλου;"
Legal gender recognition;No age restriction;"Στην Ελλάδα, τα υφιστάμενα νομικά μέτρα για την αναγνώριση του φύλου αποκλείουν ρητούς περιορισμούς ελάχιστης ή μέγιστης ηλικίας;";"Στην Ελλάδα, θα πρέπει τα υφιστάμενα νομικά μέτρα για την αναγνώριση του φύλου να μην περιλαμβάνουν ρητούς περιορισμούς ελάχιστης ή μέγιστης ηλικίας;";"Στην Ελλάδα, θα πρέπει τα υφιστάμενα νομικά μέτρα για την αναγνώριση του φύλου να περιλαμβάνουν περιορισμούς ελάχιστης ή μέγιστης ηλικίας;"
Legal gender recognition;Legal gender recognition procedures exist for minors;"Στην Ελλάδα, είναι διαθέσιμα νομικά μέτρα για την πρόσβαση στη νομική αναγνώριση του φύλου για τους ανηλίκους και παρέχουν συνεπή αποτελέσματα;";"Στην Ελλάδα, θα πρέπει να υπάρχουν νομικά μέτρα για την αξιολόγηση της νομικής αναγνώρισης του φύλου για τους ανηλίκους και να παρέχουν συνεπή αποτελέσματα;";"Στην Ελλάδα, θα πρέπει να μην είναι διαθέσιμα νομικά μέτρα για την αξιολόγηση της νομικής αναγνώρισης του φύλου για τους ανηλίκους;"
