Category;Subcategory;Fact;Support;Opposition
Equality & non-discrimination;Constitution (sexual orientation);Verbietet die österreichische Verfassung die Diskriminierung aufgrund der sexuellen Ausrichtung?;Sollte in Österreich die Verfassung die Diskriminierung aufgrund der sexuellen Ausrichtung verbieten?;Sollte in Österreich die Verfassung eine Diskriminierung aufgrund der sexuellen Ausrichtung erlauben?
Equality & non-discrimination;Employment (sexual orientation);Ist in Österreich die sexuelle Ausrichtung ausdrücklich in den Antidiskriminierungsgesetzen für den Bereich Beschäftigung enthalten?;Sollte in Österreich die sexuelle Ausrichtung ausdrücklich in die Antidiskriminierungsgesetze für den Arbeitsmarkt aufgenommen werden?;Sollte in Österreich die sexuelle Ausrichtung von den Antidiskriminierungsgesetzen im Bereich der Beschäftigung ausgenommen werden?
Equality & non-discrimination;Goods & services (sexual orientation);Ist in Österreich die sexuelle Ausrichtung ausdrücklich in den Antidiskriminierungsvorschriften für Waren und Dienstleistungen enthalten?;Sollte in Österreich die sexuelle Ausrichtung ausdrücklich in die Antidiskriminierungsvorschriften für Waren und Dienstleistungen aufgenommen werden?;Sollte in Österreich die sexuelle Ausrichtung aus den Antidiskriminierungsvorschriften für Waren und Dienstleistungen ausgeschlossen werden?
Equality & non-discrimination;Education (sexual orientation);Ist in Österreich eine Diskriminierung aufgrund der sexuellen Ausrichtung im Bildungsbereich gesetzlich verboten?;Sollte in Österreich die Diskriminierung aufgrund der sexuellen Ausrichtung im Bildungsbereich gesetzlich verboten werden?;Sollte in Österreich die Diskriminierung aufgrund der sexuellen Ausrichtung im Bildungsbereich gesetzlich erlaubt sein?
Equality & non-discrimination;Health (sexual orientation);Ist in Österreich eine Diskriminierung aufgrund der sexuellen Ausrichtung im Bereich der Gesundheit gesetzlich verboten?;Sollte in Österreich die Diskriminierung aufgrund der sexuellen Ausrichtung im Bereich der Gesundheit gesetzlich verboten werden?;Sollte in Österreich die Diskriminierung aufgrund der sexuellen Ausrichtung im Gesundheitsbereich gesetzlich erlaubt sein?
Equality & non-discrimination;Conversion practices ban (sexual orientation);Gibt es in Österreich Rechtsvorschriften oder Maßnahmen, die Bekehrungs- oder Wiederherstellungspraktiken verbieten, die darauf abzielen, die sexuelle Ausrichtung eines Minderjährigen zu ändern?;Sollten in Österreich Bekehrungs- oder Reparationspraktiken, die darauf abzielen, die sexuelle Orientierung von Minderjährigen zu ändern, gesetzlich oder politisch verboten werden?;Sollten in Österreich Bekehrungs- oder Wiederherstellungspraktiken, die darauf abzielen, die sexuelle Orientierung von Minderjährigen zu ändern, gesetzlich oder politisch erlaubt sein?
Equality & non-discrimination;Equality body mandate (sexual orientation);Gibt es in Österreich eine nationale Menschenrechtsinstitution oder eine Gleichbehandlungsstelle, die ausdrücklich beauftragt ist, sich mit Fragen der sexuellen Orientierung zu befassen und systematisch daran zu arbeiten?;Sollte in Österreich eine nationale Menschenrechtsinstitution oder Gleichbehandlungsstelle ausdrücklich damit beauftragt werden, sich mit Fragen der sexuellen Ausrichtung zu befassen und systematisch daran zu arbeiten?;Sollte in Österreich eine nationale Menschenrechtsinstitution oder Gleichstellungsstelle nicht beauftragt werden, sich mit Fragen der sexuellen Ausrichtung zu befassen?
Equality & non-discrimination;Equality action plan (sexual orientation);Gibt es in Österreich einen Aktionsplan zur Gleichstellung, der ausdrücklich die sexuelle Ausrichtung und spezifische Maßnahmen für Fortschritte beinhaltet?;Sollte es in Österreich einen Aktionsplan zur Gleichstellung geben, der ausdrücklich die sexuelle Ausrichtung und spezifische Maßnahmen für Fortschritte einschließt?;Sollte in Österreich die sexuelle Ausrichtung aus den Gleichstellungsaktionsplänen ausgeschlossen werden?
Equality & non-discrimination;Constitution (gender identity);Ist in Österreich die Diskriminierung aufgrund der Geschlechtsidentität verfassungsrechtlich verboten?;Sollte in Österreich die Verfassung die Diskriminierung aufgrund der Geschlechtsidentität verbieten?;Sollte in Österreich die Verfassung Diskriminierung aufgrund der Geschlechtsidentität zulassen?
Equality & non-discrimination;Employment (gender identity);Ist in Österreich die Geschlechtsidentität ausdrücklich in den Antidiskriminierungsgesetzen für den Bereich Beschäftigung enthalten?;Sollte in Österreich die Geschlechtsidentität ausdrücklich in die Antidiskriminierungsgesetze für den Arbeitsmarkt aufgenommen werden?;Sollte in Österreich die Geschlechtsidentität aus den Antidiskriminierungsgesetzen im Bereich der Beschäftigung ausgeschlossen werden?
Equality & non-discrimination;Goods & services (gender identity);Ist in Österreich die Geschlechtsidentität ausdrücklich in den Antidiskriminierungsvorschriften für Waren und Dienstleistungen enthalten?;Sollte in Österreich die Geschlechtsidentität ausdrücklich in die Antidiskriminierungsvorschriften für Waren und Dienstleistungen aufgenommen werden?;Sollte in Österreich die Geschlechtsidentität aus den Antidiskriminierungsvorschriften für Waren und Dienstleistungen ausgeschlossen werden?
Equality & non-discrimination;Education (gender identity);Ist in Österreich eine Diskriminierung aufgrund der Geschlechtsidentität im Bereich der Bildung gesetzlich verboten?;Sollte in Österreich die Diskriminierung aufgrund der Geschlechtsidentität im Bereich der Bildung gesetzlich verboten werden?;Sollte in Österreich die Diskriminierung aufgrund der Geschlechtsidentität im Bildungsbereich gesetzlich erlaubt sein?
Equality & non-discrimination;Health (gender identity);Ist in Österreich eine Diskriminierung aufgrund der Geschlechtsidentität im Bereich der Gesundheit gesetzlich verboten?;Sollte in Österreich die Diskriminierung aufgrund der Geschlechtsidentität im Bereich der Gesundheit gesetzlich verboten werden?;Sollte in Österreich die Diskriminierung aufgrund der Geschlechtsidentität im Gesundheitsbereich gesetzlich erlaubt sein?
Equality & non-discrimination;Conversion practices ban (gender identity);Gibt es in Österreich Rechtsvorschriften oder Maßnahmen, die Konversions- oder Reparationspraktiken verbieten, die darauf abzielen, die Geschlechtsidentität eines Minderjährigen zu ändern?;Sollten in Österreich Konversions- oder Reparationspraktiken, die darauf abzielen, die Geschlechtsidentität von Minderjährigen zu ändern, gesetzlich oder politisch verboten werden?;Sollten in Österreich Konversions- oder Reparationspraktiken, die darauf abzielen, die Geschlechtsidentität eines Minderjährigen zu ändern, gesetzlich oder politisch erlaubt sein?
Equality & non-discrimination;Equality body mandate (gender identity);Gibt es in Österreich eine nationale Menschenrechtsinstitution oder eine Gleichbehandlungsstelle, die ausdrücklich damit beauftragt ist, sich mit Fragen der Geschlechtsidentität zu befassen und systematisch daran zu arbeiten? (ich denke, man braucht nur eine);Sollte in Österreich eine nationale Menschenrechtsinstitution oder eine Gleichbehandlungsstelle ausdrücklich mit der Behandlung von Fragen der Geschlechtsidentität beauftragt werden?;Sollte in Österreich eine nationale Menschenrechtsinstitution oder Gleichstellungsstelle nicht beauftragt werden, sich mit Fragen der Geschlechtsidentität zu befassen?
Equality & non-discrimination;Equality action plan (gender identity);Gibt es in Österreich einen Aktionsplan zur Gleichstellung, der ausdrücklich die Geschlechtsidentität und spezifische Maßnahmen für Fortschritte einschließt?;Sollte es in Österreich einen Aktionsplan zur Gleichstellung geben, der ausdrücklich die Geschlechtsidentität und spezifische Maßnahmen für Fortschritte einschließt?;Sollte in Österreich die Geschlechtsidentität aus den Gleichstellungsaktionsplänen ausgeschlossen werden?
Equality & non-discrimination;Law (gender expression);Ist in Österreich der Geschlechtsausdruck ausdrücklich in den Antidiskriminierungsvorschriften enthalten?;Sollte in Österreich der Geschlechtsausdruck ausdrücklich in die Antidiskriminierungsgesetze aufgenommen werden?;Sollte in Österreich der Ausdruck des Geschlechts von der Antidiskriminierungsgesetzgebung ausgenommen werden?
Equality & non-discrimination;Constitution (sex characteristics);Ist in Österreich eine Diskriminierung aufgrund von Geschlechtsmerkmalen verfassungsrechtlich verboten?;Sollte in Österreich die Verfassung die Diskriminierung aufgrund von Geschlechtsmerkmalen verbieten?;Sollte die Verfassung in Österreich Diskriminierung aufgrund von Geschlechtsmerkmalen zulassen?
Equality & non-discrimination;Employment (sex characteristics);Sind in Österreich geschlechtsspezifische Merkmale ausdrücklich in den Antidiskriminierungsvorschriften für den Bereich Beschäftigung enthalten?;Sollten in Österreich Geschlechtsmerkmale ausdrücklich in die Antidiskriminierungsgesetze für den Bereich Beschäftigung aufgenommen werden?;Sollten in Österreich geschlechtsspezifische Merkmale von den Antidiskriminierungsgesetzen im Bereich der Beschäftigung ausgenommen werden?
Equality & non-discrimination;Goods & services (sex characteristics);Sind in Österreich Geschlechtsmerkmale ausdrücklich in den Antidiskriminierungsvorschriften für Waren und Dienstleistungen enthalten?;Sollten in Österreich Geschlechtsmerkmale ausdrücklich in die Antidiskriminierungsvorschriften für Waren und Dienstleistungen aufgenommen werden?;Sollten in Österreich Geschlechtsmerkmale aus den Antidiskriminierungsvorschriften für Waren und Dienstleistungen ausgeschlossen werden?
Equality & non-discrimination;Education (sex characteristics);Ist in Österreich eine Diskriminierung aufgrund von Geschlechtsmerkmalen im Bereich der Bildung gesetzlich verboten?;Sollte in Österreich die Diskriminierung aufgrund von Geschlechtsmerkmalen im Bereich der Bildung gesetzlich verboten werden?;Sollte in Österreich eine Diskriminierung aufgrund von Geschlechtsmerkmalen im Bildungsbereich gesetzlich erlaubt sein?
Equality & non-discrimination;Health (sex characteristics);Ist in Österreich eine Diskriminierung aufgrund von Geschlechtsmerkmalen im Bereich der Gesundheit gesetzlich verboten?;Sollte in Österreich die Diskriminierung aufgrund von Geschlechtsmerkmalen im Bereich der Gesundheit gesetzlich verboten werden?;Sollte in Österreich eine Diskriminierung aufgrund von Geschlechtsmerkmalen im Bereich der Gesundheit gesetzlich erlaubt sein?
Equality & non-discrimination;Equality body mandate (sex characteristics);Gibt es in Österreich eine nationale Menschenrechtsinstitution oder eine Gleichbehandlungsstelle, die ausdrücklich damit beauftragt ist, sich mit Fragen im Zusammenhang mit Geschlechtsmerkmalen zu befassen und systematisch daran zu arbeiten?;Sollten in Österreich nationale Menschenrechtsinstitutionen oder Gleichbehandlungsstellen ausdrücklich beauftragt werden, sich mit Fragen im Zusammenhang mit Geschlechtsmerkmalen zu befassen?;Sollten in Österreich nationale Menschenrechtsinstitutionen oder Gleichstellungsstellen nicht beauftragt werden, sich mit Fragen im Zusammenhang mit Geschlechtsmerkmalen zu befassen?
Equality & non-discrimination;Equality action plan (sex characteristics);Gibt es in Österreich einen Gleichstellungs-Aktionsplan, der ausdrücklich geschlechtsspezifische Merkmale und spezifische Maßnahmen für Fortschritte enthält?;Sollte es in Österreich einen Aktionsplan zur Gleichstellung geben, der ausdrücklich die Geschlechtsidentität und spezifische Maßnahmen für Fortschritte einschließt?;Sollten in Österreich geschlechtsspezifische Merkmale von den Gleichstellungsaktionsplänen ausgeschlossen werden?
Equality & non-discrimination;Blood donations;Ist in Österreich die Spende von Blut oder jeglicher Art von Körpergewebe für Menschen, die aufgrund ihrer sexuellen Orientierung oder Geschlechtsidentität lesbisch oder schwul sind, frei von gesetzlichen oder administrativen Verboten?;Sollte in Österreich die Spende von Blut oder jeglicher Art von Körpergewebe für Menschen, die aufgrund ihrer sexuellen Orientierung oder Geschlechtsidentität lesbisch oder schwul sind, von gesetzlichen oder administrativen Verboten ausgenommen werden?;Sollte in Österreich die Spende von Blut oder jeglicher Art von Körpergewebe für Menschen, die aufgrund ihrer sexuellen Orientierung oder Geschlechtsidentität lesbisch sind, gesetzlich oder administrativ verboten werden?
Family;Marriage equality;Dürfen gleichgeschlechtliche Paare in Österreich mit den gleichen Rechten heiraten wie andersgeschlechtliche Ehepaare?;Sollten gleichgeschlechtliche Paare in Österreich mit den gleichen Rechten heiraten dürfen wie andersgeschlechtliche Ehepaare?;Sollten gleichgeschlechtliche Paare in Österreich nicht mit den gleichen Rechten heiraten dürfen wie andersgeschlechtliche Ehepaare?
Family;Registered partnership (similar rights to marriage);Dürfen gleichgeschlechtliche Paare in Österreich eine eingetragene Partnerschaft/zivile Lebenspartnerschaft eingehen und erhalten damit den gleichen Grad an Rechten wie bei einer Ehe?;Sollten gleichgeschlechtliche Paare in Österreich eine eingetragene Partnerschaft/zivile Lebenspartnerschaft eingehen dürfen und den gleichen Grad an Rechten erhalten, wie wenn sie verheiratet wären?;Sollten gleichgeschlechtliche Paare in Österreich nicht die Möglichkeit haben, eine eingetragene Partnerschaft/zivile Lebenspartnerschaft einzugehen und das gleiche Maß an Rechten zu erhalten, das sie hätten, wenn sie verheiratet wären?
Family;Registered partnership (limited rights);Dürfen gleichgeschlechtliche Paare in Österreich eine eingetragene Partnerschaft/Lebenspartnerschaft eingehen?;Sollten gleichgeschlechtliche Paare in Österreich eine eingetragene Partnerschaft/Lebenspartnerschaft eingehen dürfen?;Sollten gleichgeschlechtliche Paare in Österreich keine eingetragene Partnerschaft/Zivilgesellschaft eingehen dürfen?
Family;Cohabitation;Sind in Österreich gleichgeschlechtliche Paare in die Gesetzgebung oder in die rechtlichen Maßnahmen zum Zusammenleben einbezogen?;Sollten in Österreich gleichgeschlechtliche Paare in die Gesetzgebung oder in die rechtlichen Maßnahmen zum Zusammenleben einbezogen werden?;Sollten in Österreich gleichgeschlechtliche Paare von den Rechtsvorschriften oder rechtlichen Maßnahmen zum Zusammenleben ausgeschlossen werden?
Family;No constitutional limitation on marriage;Gibt es in Österreich keine verfassungsrechtliche Definition der Ehe als Verbindung zwischen einem Mann und einer Frau?;Sollte es in Österreich keine verfassungsrechtliche Definition der Ehe geben, die nur die Verbindung zwischen einem Mann und einer Frau umfasst?;Sollte in Österreich die Ehe in der Verfassung als eine Verbindung zwischen Mann und Frau definiert werden?
Family;Joint adoption;Dürfen gleichgeschlechtliche Paare in Österreich rechtmäßig eine gemeinsame Adoption beantragen?;Sollten gleichgeschlechtliche Paare in Österreich rechtlich die Möglichkeit haben, eine gemeinsame Adoption zu beantragen?;Sollten gleichgeschlechtliche Paare in Österreich nicht die Möglichkeit haben, rechtmäßig eine gemeinsame Adoption zu beantragen?
Family;Second-parent adoption;Können gleichgeschlechtliche Paare in Österreich rechtmäßig eine Adoption durch einen zweiten Elternteil beantragen?;Sollten gleichgeschlechtliche Paare in Österreich die Möglichkeit haben, eine Adoption durch einen zweiten Elternteil zu beantragen?;Sollten gleichgeschlechtliche Paare in Österreich keine Zweitadoption beantragen dürfen?
Family;Automatic co-parent recognition;Werden in Österreich Kinder, die von Paaren geboren werden, automatisch von Geburt an rechtlich als Kinder beider Elternteile anerkannt, unabhängig von der sexuellen Orientierung und/oder der Geschlechtsidentität der Partner?;Sollten in Österreich Kinder, die von Paaren geboren werden, automatisch von Geburt an rechtlich als Kinder beider Elternteile anerkannt werden, unabhängig von der sexuellen Orientierung und/oder Geschlechtsidentität der Partner?;Sollten in Österreich Kinder, die von Paaren geboren werden, nicht automatisch von Geburt an rechtlich als Kinder beider Elternteile anerkannt werden, je nach sexueller Orientierung und/oder Geschlechtsidentität der Partner?
Family;Medically assisted insemination (couples);Gibt es in Österreich für Paare (unabhängig von der sexuellen Orientierung und/oder Geschlechtsidentität der Partner) keine rechtlichen Hindernisse für den Zugang zu einer Kinderwunschbehandlung?;Sollten in Österreich Paare (unabhängig von der sexuellen Orientierung und/oder Geschlechtsidentität der Partner) keine rechtlichen Hindernisse für den Zugang zu einer Kinderwunschbehandlung haben?;Sollten in Österreich Paare (unabhängig von der sexuellen Orientierung und/oder Geschlechtsidentität der Partner) rechtliche Hindernisse beim Zugang zu einer Fruchtbarkeitsbehandlung überwinden müssen?
Family;Medically assisted insemination (singles);Ist in Österreich eine Fruchtbarkeitsbehandlung für Einzelpersonen unabhängig von deren sexueller Orientierung und/oder Geschlechtsidentität rechtlich möglich?;Sollte in Österreich eine Fruchtbarkeitsbehandlung für Einzelpersonen unabhängig von deren sexueller Orientierung und/oder Geschlechtsidentität gesetzlich möglich sein?;Sollte in Österreich eine Fruchtbarkeitsbehandlung für Einzelpersonen aufgrund ihrer sexuellen Orientierung und/oder Geschlechtsidentität rechtlich möglich sein?
Family;Recognition of trans parenthood;Wird in Österreich die rechtliche Geschlechtsidentität eines Trans-Elternteils vollständig anerkannt und in der Verwandtschaftsdokumentation des Kindes korrekt wiedergegeben, und werden die Regelungen zur Elternschaft mit allen verfügbaren Geschlechtsoptionen (wenn mehr als zwei Geschlechtsmerkmale vorhanden sind) entsprechend der anerkannten Geschlechtsidentität des Elternteils in Einklang gebracht?;Sollte in Österreich die rechtliche Geschlechtsidentität eines Trans-Elternteils in vollem Umfang anerkannt werden und sich in der Verwandtschaftsdokumentation des Kindes widerspiegeln, und sollten sich die Regelungen zur Elternschaft an allen verfügbaren Geschlechtsoptionen (wenn mehr als zwei Geschlechtsmerkmale vorhanden sind) entsprechend der anerkannten Geschlechtsidentität des Elternteils orientieren?;Sollte in Österreich die rechtliche Geschlechtsidentität von Trans-Eltern nicht anerkannt und in der Dokumentation der Verwandtschaft entsprechend der anerkannten Geschlechtsidentität des Elternteils korrekt wiedergegeben werden?
Hate crime & hate speech;Hate crime law (sexual orientation);Ist in Österreich die sexuelle Orientierung ausdrücklich als erschwerender Faktor in die Gesetzgebung zu Hassverbrechen aufgenommen worden?;Sollte in Österreich die sexuelle Orientierung ausdrücklich als erschwerender Faktor in die Gesetzgebung zu Hassverbrechen aufgenommen werden?;Sollte in Österreich die sexuelle Orientierung als erschwerender Faktor von der Gesetzgebung zu Hassverbrechen ausgeschlossen werden?
Hate crime & hate speech;Hate speech law (sexual orientation);Ist in Österreich die sexuelle Orientierung ausdrücklich als erschwerender Faktor in die Gesetzgebung zu Hassreden aufgenommen?;Sollte in Österreich die sexuelle Orientierung ausdrücklich als erschwerender Faktor in die Gesetzgebung zu Hassreden aufgenommen werden?;Sollte in Österreich die sexuelle Orientierung als erschwerender Faktor von der Gesetzgebung über Hassreden ausgeschlossen werden?
Hate crime & hate speech;Policy tackling hatred (sexual orientation);Ist in Österreich die sexuelle Orientierung ausdrücklich in einer nationalen Strategie zur Bekämpfung von Hassverbrechen und Hassreden als Teil eines wiederkehrenden Rahmens durch staatliche Akteure enthalten?;Sollte in Österreich die sexuelle Orientierung ausdrücklich in eine nationale Strategie zur Bekämpfung von Hassdelikten und Hassreden als Teil eines wiederkehrenden Rahmens durch staatliche Akteure aufgenommen werden?;Sollte in Österreich die sexuelle Orientierung von einer nationalen Strategie zur Bekämpfung von Hassverbrechen und Hassreden ausgeschlossen werden?
Hate crime & hate speech;Hate crime law (gender identity);Ist in Österreich die Geschlechtsidentität ausdrücklich als erschwerender Faktor in die Gesetzgebung zu Hassverbrechen aufgenommen worden?;Sollte in Österreich die Geschlechtsidentität ausdrücklich als erschwerender Faktor in die Gesetzgebung zu Hassverbrechen aufgenommen werden?;Sollte in Österreich die Geschlechtsidentität als erschwerender Faktor von der Gesetzgebung zu Hassverbrechen ausgeschlossen werden?
Hate crime & hate speech;Hate speech law (gender identity);Ist in Österreich die Geschlechtsidentität ausdrücklich als erschwerender Faktor in die Gesetzgebung zu Hassreden aufgenommen?;Sollte in Österreich die Geschlechtsidentität ausdrücklich als erschwerender Faktor in die Gesetzgebung zu Hassreden aufgenommen werden?;Sollte in Österreich die Geschlechtsidentität als erschwerender Umstand von der Gesetzgebung zu Hassreden ausgeschlossen werden?
Hate crime & hate speech;Policy tackling hatred (gender identity);Ist in Österreich die Geschlechtsidentität Teil einer nationalen Strategie zur Bekämpfung von Hassverbrechen und Hassreden als Teil eines laufenden, systematischen und offiziell organisierten Maßnahmenpakets des Staates?;Sollte in Österreich die Geschlechtsidentität ausdrücklich in eine nationale Strategie zur Bekämpfung von Hassverbrechen und Hassreden als Teil eines wiederkehrenden Rahmens durch staatliche Akteure aufgenommen werden?;Sollte in Österreich die Geschlechtsidentität von einer nationalen Strategie zur Bekämpfung von Hassverbrechen und Hassreden ausgeschlossen werden?
Hate crime & hate speech;Hate crime law (intersex);Sind in Österreich die (wahrgenommenen) Geschlechtsmerkmale oder der intersexuelle Status ausdrücklich als erschwerender Faktor in die Gesetzgebung zu Hassverbrechen aufgenommen?;Sollten in Österreich die (wahrgenommenen) Geschlechtsmerkmale oder der intersexuelle Status ausdrücklich als erschwerender Faktor in die Gesetzgebung zu Hassverbrechen aufgenommen werden?;Sollten in Österreich die (wahrgenommenen) Geschlechtsmerkmale oder der intersexuelle Status als erschwerender Faktor von der Gesetzgebung zu Hassverbrechen ausgeschlossen werden?
Hate crime & hate speech;Hate speech law (sex characteristics);Sind in Österreich die Geschlechtsmerkmale oder der intersexuelle Status ausdrücklich als erschwerender Faktor in die Gesetzgebung zu Hassreden aufgenommen?;Sollten in Österreich die Geschlechtsmerkmale oder der intersexuelle Status ausdrücklich als erschwerender Faktor in die Gesetzgebung zu Hassreden aufgenommen werden?;Sollten in Österreich die Geschlechtsmerkmale oder der intersexuelle Status als erschwerender Faktor von der Gesetzgebung zu Hassreden ausgeschlossen werden?
Hate crime & hate speech;Policies tackling hatred (intersex);Sind in Österreich die Geschlechtsmerkmale oder der Intersex-Status in einer nationalen Strategie zur Bekämpfung von Hassverbrechen und Hassreden als Teil eines laufenden, systematischen und offiziell organisierten Maßnahmenpakets des Staates enthalten?;Sollten in Österreich Geschlechtsmerkmale oder der Intersex-Status in eine nationale Strategie zur Bekämpfung von Hassverbrechen und Hassreden als Teil eines wiederkehrenden Rahmens durch staatliche Akteure aufgenommen werden?;Sollten in Österreich Geschlechtsmerkmale oder der Intersex-Status von einer nationalen Strategie zur Bekämpfung von Hassverbrechen und Hassreden als Teil eines wiederkehrenden Rahmens durch staatliche Akteure ausgeschlossen werden?
Legal gender recognition;No legal framework making legal gender recognition impossible;Gibt es in Österreich kein ausdrückliches Verbot oder eine gesetzliche Einschränkung, die eine rechtliche Geschlechtsanerkennung gänzlich unmöglich macht (auch wenn die Verfahren aufwändig oder schwierig sind oder es keinen festgelegten Weg gibt)?;Sollte es in Österreich kein ausdrückliches Verbot oder eine gesetzliche Einschränkung geben, die eine rechtliche Geschlechtsanerkennung gänzlich unmöglich macht (auch wenn die Verfahren aufwändig und schwierig sind oder es keinen festgelegten Weg gibt)?;Sollte es in Österreich ein Verbot oder eine gesetzliche Einschränkung geben, die eine rechtliche Geschlechtsanerkennung unmöglich macht?
Legal gender recognition;Existence of legal measures;Gibt es in Österreich gesetzliche Maßnahmen zur rechtlichen Geschlechtsanerkennung?;Sollte es in Österreich gesetzliche Maßnahmen zur rechtlichen Geschlechtsanerkennung geben?;Sollte es in Österreich keine gesetzlichen Maßnahmen zur rechtlichen Geschlechtsanerkennung geben?
Legal gender recognition;Existence of administrative procedures;Gibt es in Österreich Verwaltungsverfahren zur rechtlichen Geschlechtsanerkennung?;Sollte es in Österreich Verwaltungsverfahren zur rechtlichen Geschlechtsanerkennung geben?;Sollte es in Österreich keine Verwaltungsverfahren zur rechtlichen Geschlechtsanerkennung geben?
Legal gender recognition;Name change;Ist eine Namensänderung in Österreich gesetzlich uneingeschränkt möglich?;Sollte der Gesetzgeber in Österreich eine Namensänderung ohne Einschränkungen zulassen?;Sollte der Gesetzgeber in Österreich eine Namensänderung verweigern oder mit Einschränkungen zulassen?
