Category;Subcategory;Fact;Support;Opposition
Legal gender recognition;Depathologisation;"Στην Ελλάδα, είναι προσβάσιμες και οικονομικά καλυπτόμενες οι υπηρεσίες υγειονομικής περίθαλψης ειδικά για τρανς για ενήλικες/εφήβους, οι υπηρεσίες υποστήριξης για τρανς πριν από την εφηβεία και τα παιδιά με παραλλαγές φύλου χωρίς να απαιτείται αξιολόγηση ή διάγνωση ψυχικής υγείας;";"Στην Ελλάδα, θα πρέπει να είναι προσβάσιμη και να καλύπτεται οικονομικά η ειδική υγειονομική περίθαλψη για ενήλικες/εφήβους, καθώς και οι υπηρεσίες υποστήριξης για παιδιά με τρανς και παραλλαγές φύλου πριν από την εφηβεία, χωρίς να απαιτείται αξιολόγηση ή διάγνωση ψυχικής υγείας;";"Στην Ελλάδα, δεν θα πρέπει να είναι προσβάσιμη και να καλύπτεται οικονομικά η ειδική υγειονομική περίθαλψη για ενήλικες/εφήβους και οι υπηρεσίες υποστήριξης για παιδιά με τρανς και παραλλαγές φύλου πριν από την εφηβεία, χωρίς να απαιτείται αξιολόγηση ή διάγνωση ψυχικής υγείας;"
Intersex bodily integrity;Prohibition of medical intervention without informed consent (intersex);"Στην Ελλάδα, απαγορεύεται από το νόμο στους ιατρούς να προβαίνουν σε κάθε είδους χειρουργική ή ιατρική επέμβαση σε ανήλικο intersex άτομο, όταν η επέμβαση δεν είναι ιατρικώς αναγκαία και μπορεί να αποφευχθεί ή να αναβληθεί μέχρις ότου το άτομο να μπορεί να δώσει τη συγκατάθεσή του μετά από ενημέρωση;";"Στην Ελλάδα, θα πρέπει να απαγορεύεται από το νόμο στους ιατρούς να διενεργούν κάθε είδους χειρουργική ή ιατρική επέμβαση σε ανήλικο intersex άτομο, όταν η επέμβαση δεν είναι ιατρικά αναγκαία και μπορεί να αποφευχθεί ή να αναβληθεί έως ότου το άτομο μπορέσει να δώσει τη συγκατάθεσή του μετά από ενημέρωση;";"Στην Ελλάδα, θα πρέπει να επιτρέπεται από το νόμο στους ιατρούς να διενεργούν χειρουργικές ή ιατρικές επεμβάσεις σε ανήλικα intersex άτομα, ακόμη και όταν η επέμβαση δεν έχει ιατρική αναγκαιότητα και θα μπορούσε να αποφευχθεί ή να αναβληθεί έως ότου το άτομο μπορέσει να δώσει τη συγκατάθεσή του μετά από ενημέρωση;"
Intersex bodily integrity;Universality of prohibition of medical interventions;"Στην Ελλάδα, η προστασία της σωματικής ακεραιότητας ισχύει καθολικά για όλα τα άτομα, χωρίς να βασίζεται σε συγκεκριμένες παραλλαγές ή διαγνώσεις ή όρους intersex, και απαγορεύεται από το νόμο στους ιατρούς ή άλλους επαγγελματίες να προβαίνουν σε κάθε είδους χειρουργική ή ιατρική επέμβαση σε οποιονδήποτε χωρίς την προσωπική του συναίνεση, εκτός αν συντρέχουν ζωτικοί λόγοι;";"Στην Ελλάδα, θα πρέπει η προστασία της σωματικής ακεραιότητας να είναι καθολική για όλα τα άτομα και να μην βασίζεται σε συγκεκριμένες παραλλαγές ή διαγνώσεις ή όρους intersex, και θα πρέπει να απαγορεύεται από το νόμο στους ιατρούς ή άλλους επαγγελματίες να διενεργούν κάθε είδους χειρουργική ή ιατρική επέμβαση σε οποιονδήποτε χωρίς την προσωπική του συγκατάθεση, εκτός αν συντρέχουν ζωτικοί λόγοι;";"Στην Ελλάδα, θα πρέπει η προστασία της σωματικής ακεραιότητας να εξαρτάται από συγκεκριμένες παραλλαγές ή διαγνώσεις ή όρους intersex, και θα πρέπει να επιτρέπεται από το νόμο στους ιατρούς ή άλλους επαγγελματίες να διενεργούν χειρουργικές ή ιατρικές επεμβάσεις χωρίς τη συγκατάθεση του ατόμου, ακόμη και όταν δεν υπάρχουν ζωτικοί λόγοι;"
Intersex bodily integrity;Existence of effective monitoring mechanism;"Υπάρχει στην Ελλάδα ένας μηχανισμός παρακολούθησης, ως ανεξάρτητη οντότητα από το ιατρικό σώμα, που να επιβλέπει την απαγόρευση ιατρικών επεμβάσεων σε διαφυλικούς ανηλίκους;";"Στην Ελλάδα, θα πρέπει να υπάρχει ένας μηχανισμός παρακολούθησης, ως ανεξάρτητη οντότητα από το ιατρικό κατεστημένο, για να επιβλέπει την απαγόρευση της ιατρικής παρέμβασης σε ανήλικα intersex άτομα;";"Στην Ελλάδα, δεν θα έπρεπε να υπάρχει ένας μηχανισμός παρακολούθησης, ως ανεξάρτητη οντότητα από το ιατρικό κατεστημένο, για να επιβλέπει την απαγόρευση της ιατρικής παρέμβασης σε ανήλικα ιντερσεξ;"
Intersex bodily integrity;Access to justice for victims and reparations;"Στην Ελλάδα, οι νομικές διατάξεις που απαγορεύουν τις ιατρικές επεμβάσεις σε διαφυλικούς ανηλίκους περιλαμβάνουν σαφείς και αποτελεσματικούς μηχανισμούς που αναγνωρίζουν τις πρακτικές του παρελθόντος και εξασφαλίζουν την πρόσβαση στη δικαιοσύνη, την επανόρθωση, την αποζημίωση και το δικαίωμα στην πληροφόρηση;";"Στην Ελλάδα, θα πρέπει οι νομικές διατάξεις που απαγορεύουν τις ιατρικές επεμβάσεις σε διαφυλικά ανήλικα άτομα να περιλαμβάνουν σαφείς και αποτελεσματικούς μηχανισμούς που να αναγνωρίζουν τις πρακτικές του παρελθόντος και να διασφαλίζουν την πρόσβαση στη δικαιοσύνη, την επανόρθωση, την αποζημίωση και το δικαίωμα στην πληροφόρηση;";"Στην Ελλάδα, θα πρέπει οι νομικές διατάξεις που απαγορεύουν τις ιατρικές επεμβάσεις σε διαφυλικούς ανηλίκους να αποκλείουν μηχανισμούς που αναγνωρίζουν πρακτικές του παρελθόντος και εξασφαλίζουν την πρόσβαση στη δικαιοσύνη, την αποκατάσταση, την αποζημίωση και το δικαίωμα στην ενημέρωση;"
Civil society space;Public event held, no state obstruction of freedom of assembly (last 3 years);"Στην Ελλάδα, οι νόμοι, οι πολιτικές και οι πρακτικές επιτρέπουν την πλήρη άσκηση του δικαιώματος της ελευθερίας του συνέρχεσθαι, συμπεριλαμβανομένης της διεξαγωγής δημόσιων εκδηλώσεων για τους ΛΟΑΤΚΙ χωρίς εμπόδια;";"Στην Ελλάδα, θα πρέπει οι νόμοι, οι πολιτικές και οι πρακτικές να επιτρέπουν την πλήρη άσκηση του δικαιώματος της ελευθερίας του συνέρχεσθαι, συμπεριλαμβανομένης της διεξαγωγής δημόσιων εκδηλώσεων για τους ΛΟΑΤΚΙ χωρίς εμπόδια;";"Στην Ελλάδα, πρέπει οι νόμοι, οι πολιτικές και οι πρακτικές να αρνούνται την πλήρη άσκηση του δικαιώματος της ελευθερίας του συνέρχεσθαι για δημόσιες εκδηλώσεις ΛΟΑΤΚΙ;"
Civil society space;Public event held, there is enough protection (last 3 years);"Στην Ελλάδα, προστατεύονται οι δημόσιες εκδηλώσεις των lgbti από δημόσιες αρχές που διασφαλίζουν την προσήκουσα πορεία τους, συμπεριλαμβανομένης της προστασίας από διαταραχές ή επιθέσεις;";"Στην Ελλάδα, θα πρέπει οι δημόσιες εκδηλώσεις των lgbti να προστατεύονται από δημόσιες αρχές που να διασφαλίζουν τη δέουσα πορεία τους, συμπεριλαμβανομένης της προστασίας από διαταραχές ή επιθέσεις;";"Στην Ελλάδα, δεν θα πρέπει οι δημόσιες εκδηλώσεις των lgbti να προστατεύονται από τις δημόσιες αρχές που διασφαλίζουν τη δέουσα πορεία τους, συμπεριλαμβανομένης της προστασίας από διαταραχές ή επιθέσεις;"
Civil society space;Associations operate, no state obstruction of freedom association (last 3 years);"Στην Ελλάδα, δεν υπάρχουν νομικοί και διοικητικοί περιορισμοί στη λειτουργία οργανώσεων ή εκδόσεων ΛΟΑΤΚΙ;";"Στην Ελλάδα, δεν πρέπει να υπάρχουν νομικοί και διοικητικοί περιορισμοί στη λειτουργία οργανώσεων ή εκδόσεων ΛΟΑΤΚΙ;";"Στην Ελλάδα, θα πρέπει να υπάρχουν νομικοί και διοικητικοί περιορισμοί στη λειτουργία οργανώσεων ή εκδόσεων ΛΟΑΤΚΙ;"
Civil society space;LGBTI human rights defenders are not at risk;"Στην Ελλάδα, οι υπερασπιστές των ανθρωπίνων δικαιωμάτων των ΛΟΑ δεν εκφοβίζονται και δεν ποινικοποιούνται για το έργο τους;";"Στην Ελλάδα, δεν πρέπει να εκφοβίζονται και να ποινικοποιούνται οι υπερασπιστές των ανθρωπίνων δικαιωμάτων των ΛΟΑΔ για το έργο τους;";"Στην Ελλάδα, θα πρέπει να εκφοβίζονται και να ποινικοποιούνται οι lgbti υπερασπιστές των ανθρωπίνων δικαιωμάτων για το έργο τους;"
Civil society space;No laws limiting external funding;"Στην Ελλάδα, δεν υπάρχουν σαφείς κυβερνητικοί κανονισμοί που να απαγορεύουν στις οργανώσεις να λαμβάνουν χρηματοδότηση;";"Στην Ελλάδα, δεν θα έπρεπε να υπάρχουν ρητές κυβερνητικές ρυθμίσεις που να απαγορεύουν στις οργανώσεις να λαμβάνουν χρηματοδότηση;";"Στην Ελλάδα, θα πρέπει να υπάρξουν ρητές κυβερνητικές ρυθμίσεις που να απαγορεύουν στις οργανώσεις να λαμβάνουν χρηματοδότηση;"
Civil society space;No laws limiting freedom of expression (national/local);"Στην Ελλάδα, δεν υπάρχει νομοθεσία σε εθνικό ή τοπικό επίπεδο που να περιορίζει την ελευθερία της έκφρασης για θέματα ΛΟΑΤΚΙ;";"Στην Ελλάδα, δεν πρέπει να υπάρχει νομοθεσία σε εθνικό ή τοπικό επίπεδο που να περιορίζει την ελευθερία έκφρασης για θέματα ΛΟΑΤΚΙ;";"Στην Ελλάδα, θα πρέπει να υπάρχει νομοθεσία σε εθνικό ή τοπικό επίπεδο που να περιορίζει την ελευθερία έκφρασης για θέματα ΛΟΑΤΚΙ;"
Asylum;Asylum law (sexual orientation);"Στην Ελλάδα, ο σεξουαλικός προσανατολισμός περιλαμβάνεται ρητά στο νόμο περί ασύλου ως κριτήριο προσόντων;";"Στην Ελλάδα, θα πρέπει ο σεξουαλικός προσανατολισμός να συμπεριληφθεί ρητά στη νομοθεσία περί ασύλου ως κριτήριο προσόντων;";"Στην Ελλάδα, θα πρέπει να εξαιρεθεί ο σεξουαλικός προσανατολισμός από το νόμο περί ασύλου ως κριτήριο προσόντων;"
Asylum;Other positive measures (sexual orientation);"Στην Ελλάδα, υπάρχουν εθνικές πολιτικές ή νομικά ή μη νομικά μέτρα σχετικά με το άσυλο που να αφορούν ειδικά τις ανάγκες των γκέι, λεσβιών και αμφιφυλόφιλων προσφύγων ή αιτούντων άσυλο;";"Στην Ελλάδα, θα πρέπει να υπάρξουν εθνικές πολιτικές ή νομικά ή μη νομικά μέτρα σχετικά με το άσυλο που να αφορούν ειδικά τις ανάγκες των γκέι, λεσβιών και αμφιφυλόφιλων προσφύγων ή αιτούντων άσυλο;";"Στην Ελλάδα, δεν πρέπει να υπάρχουν εθνικές πολιτικές ή νομικά ή μη νομικά μέτρα σχετικά με το άσυλο που να αφορούν ειδικά τις ανάγκες των γκέι, λεσβιών και αμφιφυλόφιλων προσφύγων ή αιτούντων άσυλο;"
Asylum;Asylum law (gender identity);"Στην Ελλάδα, η ταυτότητα φύλου περιλαμβάνεται ρητά στη νομοθεσία περί ασύλου ως κριτήριο προσόντων;";"Στην Ελλάδα, θα πρέπει η ταυτότητα φύλου να συμπεριληφθεί ρητά στη νομοθεσία περί ασύλου ως κριτήριο προσόντων;";"Στην Ελλάδα, θα πρέπει να εξαιρεθεί η ταυτότητα φύλου από το δίκαιο ασύλου ως κριτήριο προσόντων;"
Asylum;Other positive measures (gender identity);"Στην Ελλάδα, υπάρχουν εθνικές πολιτικές ή νομικά ή μη νομικά μέτρα σχετικά με το άσυλο που να αντιμετωπίζουν ειδικά τις ανάγκες των τρανς και μη δυαδικών προσφύγων ή αιτούντων άσυλο;";"Στην Ελλάδα, θα πρέπει να υπάρξουν εθνικές πολιτικές ή νομικά ή μη νομικά μέτρα σχετικά με το άσυλο που να αντιμετωπίζουν ειδικά τις ανάγκες των τρανς και μη δυαδικών προσφύγων ή αιτούντων άσυλο;";"Στην Ελλάδα, δεν πρέπει να υπάρχουν εθνικές πολιτικές ή νομικά ή μη νομικά μέτρα σχετικά με το άσυλο που να αφορούν ειδικά τις ανάγκες των τρανς και μη δυαδικών προσφύγων ή αιτούντων άσυλο;"
Asylum;Asylum law (intersex);"Στην Ελλάδα, η διαφυλική κατάσταση ή τα χαρακτηριστικά του φύλου περιλαμβάνονται ρητά στο νόμο περί ασύλου ως κριτήριο προσόντων;";"Στην Ελλάδα, θα πρέπει να συμπεριληφθούν ρητά η διαφυλική κατάσταση ή τα χαρακτηριστικά του φύλου στο δίκαιο του ασύλου ως κριτήριο προσόντων;";"Στην Ελλάδα, θα πρέπει να εξαιρεθεί η ίντερσεξ ιδιότητα ή τα χαρακτηριστικά φύλου από το δίκαιο του ασύλου ως κριτήριο προσόντων;"
Asylum;Other positive measures (intersex);"Στην Ελλάδα, υπάρχουν εθνικές πολιτικές ή νομικά ή μη νομικά μέτρα σχετικά με το άσυλο που αντιμετωπίζουν ειδικά τις ανάγκες των διαφυλικών προσφύγων ή των αιτούντων άσυλο;";"Στην Ελλάδα, θα πρέπει να υπάρξουν εθνικές πολιτικές ή νομικά ή μη νομικά μέτρα σχετικά με το άσυλο που να καλύπτουν ειδικά τις ανάγκες των διαφυλικών προσφύγων ή των αιτούντων άσυλο;";"Στην Ελλάδα, δεν πρέπει να υπάρχουν εθνικές πολιτικές ή νομικά ή μη νομικά μέτρα σχετικά με το άσυλο που να αντιμετωπίζουν ειδικά τις ανάγκες των διαφυλικών προσφύγων ή των αιτούντων άσυλο;"
