Category;Subcategory;Fact;Support;Opposition
Equality & non-discrimination;Constitution (sexual orientation);"Στην Ελλάδα, το σύνταγμα απαγορεύει τις διακρίσεις λόγω σεξουαλικού προσανατολισμού;";"Στην Ελλάδα, θα πρέπει το Σύνταγμα να απαγορεύει τις διακρίσεις λόγω σεξουαλικού προσανατολισμού;";"Στην Ελλάδα, θα πρέπει το σύνταγμα να επιτρέπει διακρίσεις λόγω σεξουαλικού προσανατολισμού;"
Equality & non-discrimination;Employment (sexual orientation);"Στην Ελλάδα, περιλαμβάνεται ρητά ο σεξουαλικός προσανατολισμός στη νομοθεσία κατά των διακρίσεων στην απασχόληση;";"Στην Ελλάδα, θα πρέπει να συμπεριληφθεί ρητά ο σεξουαλικός προσανατολισμός στη νομοθεσία κατά των διακρίσεων στην απασχόληση;";"Στην Ελλάδα, θα πρέπει να εξαιρεθεί ο σεξουαλικός προσανατολισμός από τη νομοθεσία κατά των διακρίσεων στην απασχόληση;"
Equality & non-discrimination;Goods & services (sexual orientation);"Στην Ελλάδα, περιλαμβάνεται ρητά ο σεξουαλικός προσανατολισμός στη νομοθεσία κατά των διακρίσεων για τα αγαθά και τις υπηρεσίες;";"Στην Ελλάδα, θα πρέπει να συμπεριληφθεί ρητά ο σεξουαλικός προσανατολισμός στη νομοθεσία κατά των διακρίσεων για τα αγαθά και τις υπηρεσίες;";"Στην Ελλάδα, θα πρέπει να εξαιρεθεί ο σεξουαλικός προσανατολισμός από τη νομοθεσία κατά των διακρίσεων σε αγαθά και υπηρεσίες;"
Equality & non-discrimination;Education (sexual orientation);"Στην Ελλάδα, απαγορεύονται νομοθετικά οι διακρίσεις λόγω σεξουαλικού προσανατολισμού στον τομέα της εκπαίδευσης;";"Στην Ελλάδα, θα πρέπει να απαγορευτούν νομοθετικά οι διακρίσεις λόγω σεξουαλικού προσανατολισμού στον τομέα της εκπαίδευσης;";"Στην Ελλάδα, θα πρέπει να επιτραπούν νομοθετικά οι διακρίσεις λόγω σεξουαλικού προσανατολισμού στον τομέα της εκπαίδευσης;"
Equality & non-discrimination;Health (sexual orientation);"Στην Ελλάδα, απαγορεύονται νομοθετικά οι διακρίσεις λόγω σεξουαλικού προσανατολισμού στον τομέα της υγείας;";"Στην Ελλάδα, θα πρέπει να απαγορευτούν νομοθετικά οι διακρίσεις λόγω σεξουαλικού προσανατολισμού στον τομέα της υγείας;";"Στην Ελλάδα, θα πρέπει να επιτρέπονται νομοθετικά οι διακρίσεις λόγω σεξουαλικού προσανατολισμού στον τομέα της υγείας;"
Equality & non-discrimination;Conversion practices ban (sexual orientation);"Στην Ελλάδα, υπάρχει νομοθεσία ή πολιτική που να απαγορεύει τη μεταστροφή ή τις επανορθωτικές πρακτικές που αποσκοπούν στην αλλαγή του σεξουαλικού προσανατολισμού ενός ανηλίκου;";"Στην Ελλάδα, θα πρέπει να απαγορευτούν νομοθετικά ή πολιτικά οι πρακτικές μετατροπής ή επανόρθωσης που αποσκοπούν στην αλλαγή του σεξουαλικού προσανατολισμού ενός ανηλίκου;";"Στην Ελλάδα, θα πρέπει να επιτρέπονται από τη νομοθεσία ή τις πολιτικές οι πρακτικές μετατροπής ή επανόρθωσης που αποσκοπούν στην αλλαγή του σεξουαλικού προσανατολισμού ενός ανηλίκου;"
Equality & non-discrimination;Equality body mandate (sexual orientation);"Στην Ελλάδα, υπάρχει εθνικός θεσμός ανθρωπίνων δικαιωμάτων ή φορέας ισότητας με ρητή εντολή να ασχολείται και να επεξεργάζεται συστηματικά θέματα που σχετίζονται με τον σεξουαλικό προσανατολισμό;";"Στην Ελλάδα, θα πρέπει να δοθεί ρητή εντολή σε έναν εθνικό φορέα ανθρωπίνων δικαιωμάτων ή σε έναν φορέα ισότητας να ασχολείται και να εργάζεται συστηματικά με θέματα που σχετίζονται με τον σεξουαλικό προσανατολισμό;";"Στην Ελλάδα, δεν θα πρέπει να δοθεί εντολή σε ένα εθνικό όργανο ανθρωπίνων δικαιωμάτων ή σε έναν φορέα ισότητας να ασχοληθεί με θέματα που σχετίζονται με τον σεξουαλικό προσανατολισμό;"
Equality & non-discrimination;Equality action plan (sexual orientation);"Υπάρχει στην Ελλάδα σχέδιο δράσης για την ισότητα που να περιλαμβάνει ρητά τον σεξουαλικό προσανατολισμό και συγκεκριμένα μέτρα για την πρόοδο;";"Στην Ελλάδα, θα πρέπει να υπάρχει σχέδιο δράσης για την ισότητα που να περιλαμβάνει ρητά τον σεξουαλικό προσανατολισμό και συγκεκριμένα μέτρα για την πρόοδο;";"Στην Ελλάδα, θα πρέπει να εξαιρεθεί ο σεξουαλικός προσανατολισμός από τα σχέδια δράσης για την ισότητα;"
Equality & non-discrimination;Constitution (gender identity);"Στην Ελλάδα, το Σύνταγμα απαγορεύει τις διακρίσεις λόγω ταυτότητας φύλου;";"Στην Ελλάδα, θα πρέπει το Σύνταγμα να απαγορεύει τις διακρίσεις λόγω ταυτότητας φύλου;";"Στην Ελλάδα, πρέπει το σύνταγμα να επιτρέπει διακρίσεις με βάση την ταυτότητα του γένους;"
Equality & non-discrimination;Employment (gender identity);"Στην Ελλάδα, περιλαμβάνεται ρητά η ταυτότητα φύλου στη νομοθεσία κατά των διακρίσεων στην απασχόληση;";"Στην Ελλάδα, θα πρέπει να συμπεριληφθεί ρητά η ταυτότητα φύλου στη νομοθεσία κατά των διακρίσεων στην απασχόληση;";"Στην Ελλάδα, θα πρέπει να εξαιρεθεί η ταυτότητα φύλου από τη νομοθεσία κατά των διακρίσεων στην απασχόληση;"
Equality & non-discrimination;Goods & services (gender identity);"Στην Ελλάδα, περιλαμβάνεται ρητά η ταυτότητα φύλου στη νομοθεσία κατά των διακρίσεων σε αγαθά και υπηρεσίες;";"Στην Ελλάδα, θα πρέπει να συμπεριληφθεί ρητά η ταυτότητα φύλου στη νομοθεσία κατά των διακρίσεων σε αγαθά και υπηρεσίες;";"Στην Ελλάδα, θα πρέπει να εξαιρεθεί η ταυτότητα φύλου από τη νομοθεσία κατά των διακρίσεων για τα αγαθά και τις υπηρεσίες;"
Equality & non-discrimination;Education (gender identity);"Στην Ελλάδα, απαγορεύονται νομοθετικά οι διακρίσεις λόγω ταυτότητας φύλου στον τομέα της εκπαίδευσης;";"Στην Ελλάδα, θα πρέπει να απαγορευτούν νομοθετικά οι διακρίσεις λόγω ταυτότητας φύλου στον τομέα της εκπαίδευσης;";"Στην Ελλάδα, θα πρέπει να επιτραπούν νομοθετικά οι διακρίσεις λόγω ταυτότητας φύλου στον τομέα της εκπαίδευσης;"
Equality & non-discrimination;Health (gender identity);"Στην Ελλάδα, απαγορεύονται νομοθετικά οι διακρίσεις λόγω ταυτότητας φύλου στον τομέα της υγείας;";"Στην Ελλάδα, θα πρέπει να απαγορευτούν νομοθετικά οι διακρίσεις λόγω ταυτότητας φύλου στον τομέα της υγείας;";"Στην Ελλάδα, θα πρέπει να επιτρέπονται νομοθετικά οι διακρίσεις λόγω ταυτότητας φύλου στον τομέα της υγείας;"
Equality & non-discrimination;Conversion practices ban (gender identity);"Στην Ελλάδα, υπάρχει νομοθεσία ή πολιτική που να απαγορεύει τη μεταστροφή ή τις επανορθωτικές πρακτικές που αποσκοπούν στην αλλαγή της ταυτότητας φύλου ενός ανηλίκου;";"Στην Ελλάδα, θα πρέπει να απαγορευτούν νομοθετικά ή πολιτικά οι πρακτικές μετατροπής ή επανόρθωσης που αποσκοπούν στην αλλαγή της ταυτότητας φύλου ενός ανηλίκου;";"Στην Ελλάδα, θα πρέπει να επιτρέπονται νομοθετικά ή πολιτικά οι πρακτικές μετατροπής ή επανόρθωσης που αποσκοπούν στην αλλαγή της ταυτότητας φύλου ενός ανηλίκου;"
Equality & non-discrimination;Equality body mandate (gender identity);"Στην Ελλάδα, υπάρχει εθνικός θεσμός ανθρωπίνων δικαιωμάτων ή φορέας ισότητας με ρητή εντολή να ασχολείται και να επεξεργάζεται συστηματικά θέματα που σχετίζονται με την ταυτότητα φύλου; (νομίζω ότι χρειάζεται μόνο ένα)";"Στην Ελλάδα, θα πρέπει να δοθεί ρητή εντολή σε ένα εθνικό όργανο ανθρωπίνων δικαιωμάτων ή σε έναν φορέα ισότητας να ασχοληθεί με θέματα που σχετίζονται με την ταυτότητα φύλου;";"Στην Ελλάδα, δεν θα πρέπει να δοθεί εντολή σε ένα εθνικό όργανο ανθρωπίνων δικαιωμάτων ή σε έναν φορέα ισότητας να ασχοληθεί με θέματα που σχετίζονται με την ταυτότητα φύλου;"
Equality & non-discrimination;Equality action plan (gender identity);"Υπάρχει στην Ελλάδα σχέδιο δράσης για την ισότητα που να περιλαμβάνει ρητά την ταυτότητα φύλου και συγκεκριμένα μέτρα για την πρόοδο;";"Στην Ελλάδα, θα πρέπει να υπάρχει σχέδιο δράσης για την ισότητα που να περιλαμβάνει ρητά την ταυτότητα φύλου και συγκεκριμένα μέτρα για την πρόοδο;";"Στην Ελλάδα, θα πρέπει να εξαιρεθεί η ταυτότητα φύλου από τα σχέδια δράσης για την ισότητα;"
Equality & non-discrimination;Law (gender expression);"Στην Ελλάδα, περιλαμβάνεται ρητά η έκφραση φύλου στη νομοθεσία κατά των διακρίσεων;";"Στην Ελλάδα, θα πρέπει να συμπεριληφθεί ρητά η έκφραση φύλου στη νομοθεσία κατά των διακρίσεων;";"Στην Ελλάδα, θα πρέπει να εξαιρεθεί η έκφραση φύλου από τη νομοθεσία κατά των διακρίσεων;"
Equality & non-discrimination;Constitution (sex characteristics);"Στην Ελλάδα, το σύνταγμα απαγορεύει τις διακρίσεις με βάση τα χαρακτηριστικά του φύλου;";"Στην Ελλάδα, θα πρέπει το Σύνταγμα να απαγορεύει τις διακρίσεις με βάση τα χαρακτηριστικά του φύλου;";"Στην Ελλάδα, πρέπει το Σύνταγμα να επιτρέπει διακρίσεις με βάση τα χαρακτηριστικά του φύλου;"
Equality & non-discrimination;Employment (sex characteristics);"Στην Ελλάδα, περιλαμβάνονται τα χαρακτηριστικά φύλου ρητά στη νομοθεσία κατά των διακρίσεων στην απασχόληση;";"Στην Ελλάδα, θα πρέπει να συμπεριληφθούν ρητά τα χαρακτηριστικά φύλου στη νομοθεσία κατά των διακρίσεων στην απασχόληση;";"Στην Ελλάδα, θα πρέπει να εξαιρεθούν τα χαρακτηριστικά του φύλου από τη νομοθεσία κατά των διακρίσεων στην απασχόληση;"
Equality & non-discrimination;Goods & services (sex characteristics);"Στην Ελλάδα, περιλαμβάνονται ρητά τα χαρακτηριστικά φύλου στη νομοθεσία για την καταπολέμηση των διακρίσεων σε αγαθά και υπηρεσίες;";"Στην Ελλάδα, θα πρέπει τα χαρακτηριστικά του φύλου να συμπεριληφθούν ρητά στη νομοθεσία για την καταπολέμηση των διακρίσεων σε αγαθά και υπηρεσίες;";"Στην Ελλάδα, θα πρέπει να εξαιρεθούν τα χαρακτηριστικά του φύλου από τη νομοθεσία κατά των διακρίσεων για τα αγαθά και τις υπηρεσίες;"
Equality & non-discrimination;Education (sex characteristics);"Στην Ελλάδα, απαγορεύονται από τη νομοθεσία οι διακρίσεις λόγω χαρακτηριστικών φύλου στον τομέα της εκπαίδευσης;";"Στην Ελλάδα, θα πρέπει να απαγορευθούν νομοθετικά οι διακρίσεις λόγω χαρακτηριστικών φύλου στον τομέα της εκπαίδευσης;";"Στην Ελλάδα, πρέπει να επιτραπούν νομοθετικά οι διακρίσεις με βάση τα χαρακτηριστικά του φύλου στον τομέα της εκπαίδευσης;"
Equality & non-discrimination;Health (sex characteristics);"Στην Ελλάδα, απαγορεύονται από τη νομοθεσία οι διακρίσεις λόγω χαρακτηριστικών φύλου στον τομέα της υγείας;";"Στην Ελλάδα, θα πρέπει να απαγορευτούν νομοθετικά οι διακρίσεις λόγω χαρακτηριστικών φύλου στον τομέα της υγείας;";"Στην Ελλάδα, θα πρέπει να επιτρέπονται νομοθετικά οι διακρίσεις με βάση τα χαρακτηριστικά του φύλου στον τομέα της υγείας;"
Equality & non-discrimination;Equality body mandate (sex characteristics);"Στην Ελλάδα, υπάρχει εθνικός θεσμός ανθρωπίνων δικαιωμάτων ή φορέας ισότητας με ρητή εντολή να ασχολείται και να επεξεργάζεται συστηματικά θέματα που σχετίζονται με τα χαρακτηριστικά του φύλου;";"Στην Ελλάδα, θα πρέπει τα εθνικά όργανα ανθρωπίνων δικαιωμάτων ή οι φορείς ισότητας να έχουν ρητή εντολή να ασχολούνται με θέματα που σχετίζονται με τα χαρακτηριστικά φύλου;";"Στην Ελλάδα, δεν θα πρέπει να ανατεθεί σε εθνικούς θεσμούς ανθρωπίνων δικαιωμάτων ή σε φορείς ισότητας να ασχολούνται με θέματα που σχετίζονται με τα χαρακτηριστικά φύλου;"
Equality & non-discrimination;Equality action plan (sex characteristics);"Στην Ελλάδα, υπάρχει σχέδιο δράσης για την ισότητα που να περιλαμβάνει ρητά τα χαρακτηριστικά του φύλου και συγκεκριμένα μέτρα για την πρόοδο;";"Στην Ελλάδα, θα πρέπει να υπάρχει σχέδιο δράσης για την ισότητα που να περιλαμβάνει ρητά την ταυτότητα φύλου και συγκεκριμένα μέτρα για την πρόοδο;";"Στην Ελλάδα, θα πρέπει να εξαιρεθούν τα χαρακτηριστικά φύλου από τα σχέδια δράσης για την ισότητα;"
Equality & non-discrimination;Blood donations;"Στην Ελλάδα, η αιμοδοσία ή η παροχή οποιουδήποτε είδους σωματικών ιστών σε lgbti άτομα με βάση τον σεξουαλικό τους προσανατολισμό ή την ταυτότητα φύλου τους δεν υπόκειται σε νομοθετική ή διοικητική απαγόρευση;";"Στην Ελλάδα, η αιμοδοσία ή κάθε είδους σωματικών ιστών για τα lgbti άτομα με βάση τον σεξουαλικό τους προσανατολισμό ή την ταυτότητα φύλου τους πρέπει να είναι ελεύθερη από νομοθετική ή διοικητική απαγόρευση;";"Στην Ελλάδα, θα πρέπει να απαγορευτεί νομοθετικά ή διοικητικά η αιμοδοσία ή η παροχή οποιουδήποτε είδους σωματικών ιστών σε lgbti άτομα με βάση τον σεξουαλικό τους προσανατολισμό ή την ταυτότητα φύλου τους;"
Family;Marriage equality;"Στην Ελλάδα, θα επιτραπεί στα ομόφυλα ζευγάρια να παντρευτούν με τα ίδια δικαιώματα με τα παντρεμένα ζευγάρια διαφορετικού φύλου;";"Στην Ελλάδα, θα πρέπει να επιτραπεί στα ομόφυλα ζευγάρια να παντρεύονται με τα ίδια δικαιώματα με τα παντρεμένα ζευγάρια διαφορετικού φύλου;";"Στην Ελλάδα, δεν θα πρέπει να επιτρέπεται στα ομόφυλα ζευγάρια να παντρεύονται με τα ίδια δικαιώματα που έχουν τα παντρεμένα ζευγάρια διαφορετικού φύλου;"
Family;Registered partnership (similar rights to marriage);"Στην Ελλάδα, επιτρέπεται στα ομόφυλα ζευγάρια να συνάψουν καταχωρισμένη συμβίωση/αστική συμβίωση και να αποκτήσουν το ίδιο επίπεδο δικαιωμάτων με αυτό που θα είχαν αν ήταν παντρεμένα;";"Στην Ελλάδα, θα πρέπει να επιτραπεί στα ομόφυλα ζευγάρια να συνάψουν καταχωρισμένο σύμφωνο συμβίωσης/αστική συμβίωση και να αποκτήσουν το ίδιο επίπεδο δικαιωμάτων με αυτό που θα είχαν αν ήταν παντρεμένα;";"Στην Ελλάδα, δεν θα πρέπει να επιτραπεί στα ομόφυλα ζευγάρια να συνάψουν καταχωρισμένο σύμφωνο συμβίωσης/αστική συμβίωση και να αποκτήσουν το ίδιο επίπεδο δικαιωμάτων με αυτό που θα είχαν αν ήταν παντρεμένα;"
Family;Registered partnership (limited rights);"Στην Ελλάδα, επιτρέπεται στα ομόφυλα ζευγάρια να συνάψουν καταχωρισμένη συμβίωση/αστική συμβίωση;";"Στην Ελλάδα, θα πρέπει να επιτραπεί στα ομόφυλα ζευγάρια να συνάψουν καταχωρισμένη συμβίωση/αστική συμβίωση;";"Στην Ελλάδα, θα πρέπει να μην επιτρέπεται στα ομόφυλα ζευγάρια να συνάπτουν καταχωρισμένη συμβίωση/αστική συμβίωση;"
Family;Cohabitation;"Στην Ελλάδα, περιλαμβάνονται τα ομόφυλα ζευγάρια στη νομοθεσία ή στα νομικά μέτρα για τη συμβίωση;";"Στην Ελλάδα, θα πρέπει να συμπεριληφθούν τα ομόφυλα ζευγάρια στη νομοθεσία ή στα νομικά μέτρα για τη συμβίωση;";"Στην Ελλάδα, θα πρέπει να εξαιρεθούν τα ομόφυλα ζευγάρια από τη νομοθεσία ή τα νομικά μέτρα για τη συμβίωση;"
Family;No constitutional limitation on marriage;"Στην Ελλάδα, δεν υπάρχει συνταγματικός ορισμός του γάμου ως ένωσης μόνο μεταξύ ενός άνδρα και μιας γυναίκας;";"Στην Ελλάδα, δεν θα έπρεπε να υπάρχει συνταγματικός ορισμός του γάμου ως μιας ένωσης μόνο μεταξύ ενός άνδρα και μιας γυναίκας;";"Στην Ελλάδα, θα πρέπει να υπάρξει συνταγματικός ορισμός του γάμου ως μιας ένωσης μόνο μεταξύ ενός άνδρα και μιας γυναίκας;"
Family;Joint adoption;"Στην Ελλάδα, επιτρέπεται στα ομόφυλα ζευγάρια να υποβάλουν νόμιμα αίτηση για κοινή υιοθεσία;";"Στην Ελλάδα, θα πρέπει να επιτραπεί στα ομόφυλα ζευγάρια να υποβάλουν νόμιμα αίτηση για κοινή υιοθεσία;";"Στην Ελλάδα, δεν θα πρέπει να επιτρέπεται στα ομόφυλα ζευγάρια να υποβάλλουν νόμιμα αίτηση για κοινή υιοθεσία;"
Family;Second-parent adoption;"Στην Ελλάδα, επιτρέπεται στα ομόφυλα ζευγάρια να υποβάλουν νόμιμα αίτηση για υιοθεσία από δεύτερο γονέα;";"Στην Ελλάδα, θα πρέπει να επιτραπεί στα ομόφυλα ζευγάρια να υποβάλουν αίτηση για υιοθεσία από δεύτερο γονέα;";"Στην Ελλάδα, θα πρέπει να μην επιτρέπεται στα ομόφυλα ζευγάρια να υποβάλλουν αίτηση για υιοθεσία από δεύτερο γονέα;"
