Category;Subcategory;Fact;Support;Opposition
Legal gender recognition;No compulsory surgical intervention required;Nevyžadují se v Česku chirurgické lékařské zákroky pro právní uznání pohlaví?;Neměly by být v Česku pro právní uznání pohlaví vyžadovány chirurgické lékařské zákroky?;Měl by být v Česku pro právní uznání pohlaví vyžadován chirurgický lékařský zákrok?
Legal gender recognition;No compulsory sterilisation required;Není v Česku pro uznání pohlaví vyžadována sterilizace nebo doklad o neplodnosti?;Neměla by být v Česku pro uznání pohlaví vyžadována sterilizace nebo doklad o neplodnosti?;Měla by být v Česku pro uznání pohlaví vyžadována sterilizace nebo prokázání neplodnosti?
Legal gender recognition;No compulsory divorce required;Není v Česku pro právní uznání pohlaví vyžadován rozvod nebo svobodný stav?;Neměl by být v Česku pro právní uznání pohlaví vyžadován rozvod nebo svobodný stav?;Měl by být v Česku pro právní uznání pohlaví vyžadován rozvod nebo svobodný stav?
Legal gender recognition;No age restriction;Vylučují v Česku stávající právní opatření pro uznání pohlaví nějaké výslovné omezení minimálního nebo maximálního věku?;Měla by stávající právní opatření pro uznání pohlaví v České republice vyloučit výslovné omezení minimálního nebo maximálního věku?;Měla by stávající právní opatření pro uznání pohlaví v České republice zahrnovat omezení minimálního nebo maximálního věku?
Legal gender recognition;Legal gender recognition procedures exist for minors;Jsou v České republice dostupná právní opatření pro přístup k právnímu uznání pohlaví nezletilých osob a poskytují konzistentní výsledky?;Měla by být v Česku k dispozici právní opatření pro posouzení právního uznání pohlaví nezletilých a měla by poskytovat konzistentní výsledky?;Neměla by být v Česku k dispozici právní opatření pro posouzení právního uznání pohlaví nezletilých?
Legal gender recognition;Depathologisation;Je v Česku transspecifická zdravotní péče (tshc) pro dospělé/dospívající, podpůrné služby pro trans osoby před pubertou a děti s genderovou variantou dostupná a finančně hrazená, aniž by vyžadovala posouzení duševního zdraví nebo diagnózu?;Měla by být v Česku transspecifická zdravotní péče (tshc) pro dospělé/dospívající a podpůrné služby pro trans a genderově odlišné děti před pubertou dostupné a finančně hrazené bez nutnosti posouzení duševního zdraví nebo diagnózy?;Neměla by být v Česku trans-specifická zdravotní péče (tshc) pro dospělé/dospívající a podpůrné služby pro trans a genderově odlišné děti před pubertou dostupné a finančně hrazené, aniž by bylo nutné posouzení duševního zdraví nebo diagnóza?
Intersex bodily integrity;Prohibition of medical intervention without informed consent (intersex);Je v České republice lékařům zákonem zakázáno provádět jakýkoli chirurgický nebo lékařský zákrok na intersexuální nezletilé osobě, pokud tento zákrok není z lékařského hlediska nezbytný a lze se mu vyhnout nebo jej odložit do doby, než bude tato osoba schopna poskytnout informovaný souhlas?;Měli by mít v Česku praktičtí lékaři zákonem zakázáno provádět jakýkoli chirurgický nebo lékařský zákrok na intersexuální nezletilé osobě, pokud tento zákrok není z lékařského hlediska nezbytný a lze se mu vyhnout nebo jej odložit do doby, než bude tato osoba schopna poskytnout informovaný souhlas?;Měli by mít v Česku praktičtí lékaři zákonem povoleno provádět chirurgické nebo lékařské zákroky na nezletilých intersexuálech, i když zákrok není z lékařského hlediska nezbytný a lze se mu vyhnout nebo jej odložit do doby, než dotyčná osoba poskytne informovaný souhlas?
Intersex bodily integrity;Universality of prohibition of medical interventions;Je v Česku ochrana tělesné integrity univerzální pro všechny osoby, není založena na konkrétních variantách či diagnózách nebo intersexuálních termínech, a je lékařům či jiným odborníkům zákonem zakázáno provádět na komkoli jakýkoli chirurgický či lékařský zákrok bez jeho osobního souhlasu, s výjimkou životně důležitých důvodů?;Měla by být v Česku ochrana tělesné integrity univerzální pro všechny osoby, nikoliv založená na konkrétních variantách či diagnózách nebo intersexuálních termínech, a měli by mít lékaři či jiní odborníci zákonem zakázáno provádět na komkoliv jakýkoliv chirurgický či lékařský zákrok bez jeho osobního souhlasu, s výjimkou životně důležitých důvodů?;Měla by v Česku ochrana tělesné integrity záviset na konkrétních variantách nebo diagnózách či intersexuálních termínech a měli by mít lékaři nebo jiní odborníci ze zákona právo provádět chirurgické nebo lékařské zákroky bez souhlasu člověka, i když k tomu nejsou životně důležité důvody?
Intersex bodily integrity;Existence of effective monitoring mechanism;Existuje v Česku kontrolní mechanismus, který by jako subjekt nezávislý na zdravotnickém zařízení dohlížel na zákaz lékařských zákroků u nezletilých intersexuálů?;Měl by v Česku existovat kontrolní mechanismus, který by jako subjekt nezávislý na zdravotnickém zařízení dohlížel na zákaz lékařských zákroků u nezletilých intersexuálů?;Neměl by v Česku existovat kontrolní mechanismus, který by jako subjekt nezávislý na zdravotnickém zařízení dohlížel na zákaz lékařských zákroků u nezletilých intersexuálů?
Intersex bodily integrity;Access to justice for victims and reparations;Zahrnují právní předpisy zakazující lékařské zákroky na nezletilých intersexuálech v České republice jasné a účinné mechanismy, které uznávají minulé praktiky a zajišťují přístup ke spravedlnosti, odškodnění, nápravu a právo na informace?;Měla by právní ustanovení zakazující lékařské zákroky na nezletilých intersexuálech v České republice zahrnovat jasné a účinné mechanismy, které uznávají minulé praktiky a zajišťují přístup ke spravedlnosti, odškodnění, nápravu a právo na informace?;Měla by v Česku právní ustanovení zakazující lékařské zákroky na intersexuálních nezletilých vylučovat mechanismy, které uznávají minulé praktiky a zajišťují přístup ke spravedlnosti, odškodnění, nápravu a právo na informace?
Civil society space;Public event held, no state obstruction of freedom of assembly (last 3 years);Umožňují zákony, politiky a praxe v České republice plný výkon práva na svobodu shromažďování, včetně pořádání veřejných akcí pro lgbti bez překážek?;Měly by zákony, politiky a praxe v České republice umožňovat plný výkon práva na svobodu shromažďování, včetně pořádání veřejných akcí pro lgbti bez překážek?;Měly by zákony, politiky a praxe v Česku bránit plnému výkonu práva na svobodu shromažďování na veřejných akcích lgbti?
Civil society space;Public event held, there is enough protection (last 3 years);Jsou v Česku veřejné akce lgbti chráněny veřejnými orgány, které zajišťují jejich řádný průběh, včetně ochrany před narušením nebo útoky?;Měly by být v Česku veřejné akce lgbti chráněny veřejnými orgány, které zajistí jejich řádný průběh, včetně ochrany před narušením nebo útoky?;Neměly by být v Česku veřejné akce lgbti chráněny veřejnými orgány, které zajistí jejich řádný průběh, včetně ochrany před narušením nebo útoky?
Civil society space;Associations operate, no state obstruction of freedom association (last 3 years);Neexistují v Česku žádná právní a administrativní omezení pro fungování lgbti organizací nebo publikací?;Neměla by v Česku existovat žádná právní a administrativní omezení pro fungování lgbti organizací nebo publikací?;Měla by v Česku existovat právní a administrativní omezení pro fungování lgbti organizací nebo publikací?
Civil society space;LGBTI human rights defenders are not at risk;Nejsou v Česku obránci lidských práv zastrašováni a kriminalizováni za svou práci?;Neměli by být v Česku obránci lidských práv zastrašováni a kriminalizováni za svou práci?;Měli by být v Česku obránci lidských práv zastrašováni a kriminalizováni za svou práci?
Civil society space;No laws limiting external funding;Neexistují v Česku žádná výslovná vládní nařízení, která by zakazovala organizacím přijímat finanční prostředky?;Nemělo by v Česku existovat výslovné vládní nařízení, které by zakazovalo organizacím přijímat finanční prostředky?;Měla by v Česku existovat výslovná vládní nařízení, která by zakazovala organizacím přijímat finanční prostředky?
Civil society space;No laws limiting freedom of expression (national/local);Neexistuje v Česku legislativa na národní nebo místní úrovni, která by omezovala svobodu projevu v oblasti lgbti?;Neměla by v Česku existovat žádná legislativa na národní či místní úrovni, která by omezovala svobodu projevu v oblasti lgbti?;Měla by v Česku existovat legislativa na národní nebo místní úrovni, která by omezovala svobodu projevu v oblasti lgbti?
Asylum;Asylum law (sexual orientation);Je v České republice sexuální orientace výslovně zahrnuta do azylového zákona jako kvalifikační kritérium?;Měla by být v Česku sexuální orientace výslovně zahrnuta do azylového zákona jako kvalifikační kritérium?;Měla by být v Česku sexuální orientace vyloučena z azylového práva jako kvalifikační kritérium?
Asylum;Other positive measures (sexual orientation);Existují v České republice nějaké národní politiky nebo právní či neprávní opatření týkající se azylu, které se specificky zaměřují na potřeby gayů, leseb a bisexuálních uprchlíků nebo žadatelů o azyl?;Měly by v Česku existovat národní politiky nebo právní či mimoprávní opatření týkající se azylu, které by se konkrétně zabývaly potřebami gayů, leseb a bisexuálních uprchlíků nebo žadatelů o azyl?;Neměly by v Česku existovat žádné národní politiky nebo právní či mimoprávní opatření týkající se azylu, které by se specificky zabývaly potřebami gayů, leseb a bisexuálních uprchlíků nebo žadatelů o azyl?
Asylum;Asylum law (gender identity);Je v České republice genderová identita výslovně zahrnuta v azylovém zákoně jako kvalifikační kritérium?;Měla by být v Česku genderová identita výslovně zahrnuta do azylového zákona jako kvalifikační kritérium?;Měla by být v Česku genderová identita vyloučena z azylového práva jako kvalifikační kritérium?
Asylum;Other positive measures (gender identity);Existují v Česku nějaké národní politiky nebo právní či neprávní opatření týkající se azylu, které se specificky zaměřují na potřeby trans a nebinárních uprchlíků nebo žadatelů o azyl?;Měly by v Česku existovat národní politiky nebo právní či neprávní opatření týkající se azylu, které by specificky řešily potřeby trans a nebinárních uprchlíků či žadatelů o azyl?;Neměly by v Česku existovat žádné národní politiky nebo právní či neprávní opatření týkající se azylu, které by se specificky zabývaly potřebami trans a nebinárních uprchlíků nebo žadatelů o azyl?
Asylum;Asylum law (intersex);Je v České republice intersexuální status nebo pohlavní znaky výslovně zahrnuty v azylovém zákoně jako kvalifikační kritérium?;Měl by být v České republice intersexuální status nebo pohlavní znaky výslovně zahrnuty do azylového zákona jako kvalifikační kritérium?;Měl by být v Česku status intersexuála nebo pohlavní znaky vyloučeny z azylového práva jako kvalifikační kritérium?
Asylum;Other positive measures (intersex);Existují v České republice nějaké národní politiky nebo právní či mimoprávní opatření týkající se azylu, které se specificky zaměřují na potřeby intersexuálních uprchlíků nebo žadatelů o azyl?;Měla by v Česku existovat národní politika nebo právní či jiná opatření týkající se azylu, která by se konkrétně zabývala potřebami intersexuálních uprchlíků nebo žadatelů o azyl?;Neměly by v Česku existovat žádné národní politiky nebo právní či neprávní opatření týkající se azylu, které by se specificky zabývaly potřebami intersexuálních uprchlíků nebo žadatelů o azyl?
