Category;Subcategory;Fact;Support;Opposition
Equality & non-discrimination;Constitution (sexual orientation);Zakazuje v Česku ústava diskriminaci na základě sexuální orientace?;Měla by v Česku ústava zakázat diskriminaci na základě sexuální orientace?;Měla by ústava v Česku povolovat diskriminaci na základě sexuální orientace?
Equality & non-discrimination;Employment (sexual orientation);Je v Česku sexuální orientace výslovně zahrnuta do antidiskriminační legislativy v oblasti zaměstnávání?;Měla by být v Česku sexuální orientace výslovně zahrnuta do antidiskriminační legislativy v oblasti zaměstnanosti?;Měla by být v Česku sexuální orientace vyloučena z antidiskriminační legislativy v oblasti zaměstnávání?
Equality & non-discrimination;Goods & services (sexual orientation);Je v Česku sexuální orientace výslovně zahrnuta do antidiskriminační legislativy v oblasti zboží a služeb?;Měla by být v Česku sexuální orientace výslovně zahrnuta do antidiskriminační legislativy v oblasti zboží a služeb?;Měla by být v Česku sexuální orientace vyloučena z antidiskriminační legislativy v oblasti zboží a služeb?
Equality & non-discrimination;Education (sexual orientation);Je v Česku diskriminace na základě sexuální orientace v oblasti vzdělávání legislativně zakázána?;Měla by být v Česku legislativně zakázána diskriminace na základě sexuální orientace v oblasti vzdělávání?;Měla by být v Česku legislativně povolena diskriminace na základě sexuální orientace v oblasti vzdělávání?
Equality & non-discrimination;Health (sexual orientation);Je v Česku diskriminace na základě sexuální orientace v oblasti zdraví legislativně zakázána?;Měla by být v Česku legislativně zakázána diskriminace na základě sexuální orientace v oblasti zdravotnictví?;Měla by být v Česku legislativně povolena diskriminace na základě sexuální orientace v oblasti zdravotnictví?
Equality & non-discrimination;Conversion practices ban (sexual orientation);Existují v České republice nějaké právní předpisy nebo zásady, které zakazují konverzi nebo reparační praktiky zaměřené na změnu sexuální orientace nezletilých?;Měly by být v České republice legislativně nebo politicky zakázány konverzní nebo reparační praktiky zaměřené na změnu sexuální orientace nezletilých?;Měly by být v České republice legislativně nebo politicky povoleny konverzní nebo reparační praktiky zaměřené na změnu sexuální orientace nezletilých?
Equality & non-discrimination;Equality body mandate (sexual orientation);Existuje v Česku národní instituce pro lidská práva nebo orgán pro rovnost, který by byl výslovně pověřen zabývat se otázkami souvisejícími se sexuální orientací a systematicky se jimi zabývat?;Měla by být v Česku národní instituce pro lidská práva nebo orgán pro rovnost výslovně pověřen zabývat se otázkami souvisejícími se sexuální orientací a systematicky na nich pracovat?;Neměla by být v Česku národní instituce pro lidská práva nebo orgán pro rovnost pověřen řešením otázek souvisejících se sexuální orientací?
Equality & non-discrimination;Equality action plan (sexual orientation);Existuje v Česku akční plán pro rovnost, který výslovně zahrnuje sexuální orientaci a konkrétní opatření pro dosažení pokroku?;Měl by v Česku existovat akční plán pro rovnost, který by výslovně zahrnoval sexuální orientaci a konkrétní opatření pro dosažení pokroku?;Měla by být v Česku sexuální orientace vyloučena z akčních plánů pro rovnost?
Equality & non-discrimination;Constitution (gender identity);Zakazuje v Česku ústava diskriminaci na základě pohlavní identity?;Měla by ústava v Česku zakázat diskriminaci na základě pohlavní identity?;Měla by v Česku ústava povolovat diskriminaci na základě pohlavní identity?
Equality & non-discrimination;Employment (gender identity);Je v Česku genderová identita výslovně zahrnuta do antidiskriminační legislativy v oblasti zaměstnávání?;Měla by být v Česku genderová identita výslovně zahrnuta do antidiskriminační legislativy v oblasti zaměstnávání?;Měla by být v Česku genderová identita vyloučena z antidiskriminační legislativy v oblasti zaměstnávání?
Equality & non-discrimination;Goods & services (gender identity);Je v Česku genderová identita výslovně zahrnuta v antidiskriminační legislativě týkající se zboží a služeb?;Měla by být v Česku genderová identita výslovně zahrnuta do antidiskriminační legislativy v oblasti zboží a služeb?;Měla by být v Česku genderová identita vyloučena z antidiskriminační legislativy v oblasti zboží a služeb?
Equality & non-discrimination;Education (gender identity);Je v Česku diskriminace na základě pohlavní identity v oblasti vzdělávání legislativně zakázána?;Měla by být v Česku legislativně zakázána diskriminace na základě pohlavní identity v oblasti vzdělávání?;Měla by být v Česku legislativně povolena diskriminace na základě pohlavní identity v oblasti vzdělávání?
Equality & non-discrimination;Health (gender identity);Je v Česku diskriminace na základě pohlavní identity v oblasti zdraví legislativně zakázána?;Měla by být v Česku legislativně zakázána diskriminace na základě pohlavní identity v oblasti zdravotnictví?;Měla by být v Česku legislativně povolena diskriminace na základě pohlavní identity v oblasti zdravotnictví?
Equality & non-discrimination;Conversion practices ban (gender identity);Existují v České republice nějaké právní předpisy nebo zásady, které zakazují konverzi nebo reparační praktiky zaměřené na změnu pohlavní identity nezletilých?;Měly by být v České republice legislativně nebo politicky zakázány konverzní nebo reparační praktiky zaměřené na změnu pohlavní identity nezletilých?;Měla by být v Česku legislativně nebo politicky povolena konverze nebo reparativní praktiky zaměřené na změnu pohlavní identity nezletilých?
Equality & non-discrimination;Equality body mandate (gender identity);Existuje v České republice vnitrostátní instituce pro lidská práva nebo orgán pro rovnost, který by byl výslovně pověřen zabývat se otázkami souvisejícími s genderovou identitou a systematicky se jimi zabývat? (myslím, že stačí jeden);Měla by být v Česku národní instituce pro lidská práva nebo orgán pro rovnost výslovně pověřen řešením otázek souvisejících s genderovou identitou?;Neměla by být v Česku národní instituce pro lidská práva nebo orgán pro rovnost pověřen řešením otázek souvisejících s genderovou identitou?
Equality & non-discrimination;Equality action plan (gender identity);Existuje v Česku akční plán pro rovnost, který výslovně zahrnuje genderovou identitu a konkrétní opatření pro dosažení pokroku?;Měl by v Česku existovat akční plán pro rovnost, který by výslovně zahrnoval genderovou identitu a konkrétní opatření pro dosažení pokroku?;Měla by být v Česku genderová identita vyloučena z akčních plánů pro rovnost?
Equality & non-discrimination;Law (gender expression);Je v Česku vyjádření pohlaví výslovně zahrnuto v antidiskriminační legislativě?;Měl by být v Česku do antidiskriminační legislativy výslovně zahrnut projev pohlaví?;Měl by být v Česku z antidiskriminační legislativy vyloučen projev pohlaví?
Equality & non-discrimination;Constitution (sex characteristics);Zakazuje ústava v České republice diskriminaci na základě pohlaví?;Měla by ústava v Česku zakazovat diskriminaci na základě pohlavních znaků?;Měla by ústava v Česku povolovat diskriminaci na základě pohlavních znaků?
Equality & non-discrimination;Employment (sex characteristics);Jsou v Česku pohlavní znaky výslovně zahrnuty do antidiskriminační legislativy v oblasti zaměstnávání?;Měly by být v Česku pohlavní znaky výslovně zahrnuty do antidiskriminační legislativy v oblasti zaměstnávání?;Měly by být v Česku z antidiskriminační legislativy v oblasti zaměstnávání vyloučeny pohlavní znaky?
Equality & non-discrimination;Goods & services (sex characteristics);Jsou v Česku pohlavní znaky výslovně zahrnuty do antidiskriminační legislativy v oblasti zboží a služeb?;Měly by být v Česku pohlavní znaky výslovně zahrnuty do antidiskriminační legislativy v oblasti zboží a služeb?;Měly by být v Česku pohlavní znaky vyloučeny z antidiskriminační legislativy v oblasti zboží a služeb?
Equality & non-discrimination;Education (sex characteristics);Je v České republice diskriminace na základě pohlavních znaků v oblasti vzdělávání legislativně zakázána?;Měla by být v České republice legislativně zakázána diskriminace na základě pohlaví v oblasti vzdělávání?;Měla by být v Česku legislativně povolena diskriminace na základě pohlavních znaků v oblasti vzdělávání?
Equality & non-discrimination;Health (sex characteristics);Je v České republice diskriminace na základě pohlavních znaků v oblasti zdraví legislativně zakázána?;Měla by být v Česku legislativně zakázána diskriminace na základě pohlavních znaků v oblasti zdraví?;Měla by být v Česku legislativně povolena diskriminace na základě pohlavních znaků v oblasti zdraví?
Equality & non-discrimination;Equality body mandate (sex characteristics);Existuje v České republice vnitrostátní instituce pro lidská práva nebo orgán pro rovnost, který by byl výslovně pověřen zabývat se otázkami souvisejícími s pohlavím a systematicky se jimi zabývat?;Měly by být v Česku vnitrostátní instituce pro lidská práva nebo orgány pro rovnost výslovně pověřeny řešením otázek souvisejících s pohlavními znaky?;Neměly by být v Česku vnitrostátní instituce pro lidská práva nebo orgány pro rovnost pověřeny řešením otázek souvisejících s pohlavními znaky?
Equality & non-discrimination;Equality action plan (sex characteristics);Existuje v České republice akční plán pro rovnost, který výslovně zahrnuje charakteristiky pohlaví a konkrétní opatření pro dosažení pokroku?;Měl by v Česku existovat akční plán pro rovnost, který by výslovně zahrnoval genderovou identitu a konkrétní opatření pro dosažení pokroku?;Měly by být v Česku z akčních plánů pro rovnost vyloučeny charakteristiky pohlaví?
Equality & non-discrimination;Blood donations;Neplatí v Česku legislativní nebo administrativní zákaz darování krve nebo jakýchkoli tělesných tkání pro lgbti osoby na základě jejich sexuální orientace nebo genderové identity?;Mělo by v Česku darování krve nebo jakýchkoli tělesných tkání pro lgbti osoby na základě jejich sexuální orientace nebo genderové identity nepodléhat legislativnímu nebo administrativnímu zákazu?;Mělo by být v Česku legislativně nebo administrativně zakázáno darování krve nebo jakýchkoli tělesných tkání pro lgbti osoby na základě jejich sexuální orientace nebo genderové identity?
Family;Marriage equality;Mohou v Česku páry stejného pohlaví uzavírat manželství se stejnými právy jako páry různého pohlaví?;Měly by mít v Česku páry stejného pohlaví možnost uzavírat manželství se stejnými právy jako páry různého pohlaví?;Neměly by mít v Česku páry stejného pohlaví možnost uzavírat manželství se stejnými právy jako páry různého pohlaví?
Family;Registered partnership (similar rights to marriage);Mohou v Česku páry stejného pohlaví uzavřít registrované partnerství a získat stejná práva, jako kdyby uzavřeli manželství?;Měly by mít páry stejného pohlaví v Česku možnost uzavřít registrované partnerství a získat stejná práva, jako kdyby uzavřeli manželství?;Neměly by mít páry stejného pohlaví v Česku možnost uzavřít registrované partnerství a získat stejná práva, jako kdyby uzavřeli manželství?
Family;Registered partnership (limited rights);Mohou v Česku páry stejného pohlaví uzavřít registrované partnerství?;Měly by mít páry stejného pohlaví v Česku možnost uzavřít registrované partnerství?;Neměly by v Česku páry stejného pohlaví mít možnost uzavřít registrované partnerství?
Family;Cohabitation;Jsou v Česku stejnopohlavní páry zahrnuty do legislativy nebo právních opatření týkajících se soužití?;Měly by být v Česku stejnopohlavní páry zahrnuty do legislativy nebo právních opatření týkajících se soužití?;Měly by být v Česku páry stejného pohlaví vyloučeny z legislativy nebo právních opatření týkajících se soužití?
Family;No constitutional limitation on marriage;Neexistuje v Česku ústavní definice manželství jako svazku pouze mezi mužem a ženou?;Nemělo by v Česku existovat ústavní vymezení manželství pouze jako svazku muže a ženy?;Mělo by v Česku existovat ústavní vymezení manželství pouze jako svazku muže a ženy?
Family;Joint adoption;Mohou v Česku páry stejného pohlaví legálně žádat o společnou adopci?;Měly by mít v Česku stejnopohlavní páry možnost legálně žádat o společnou adopci?;Neměly by v Česku stejnopohlavní páry mít možnost legálně žádat o společnou adopci?
Family;Second-parent adoption;Mohou v Česku páry stejného pohlaví legálně žádat o adopci druhým rodičem?;Měly by mít v Česku stejnopohlavní páry možnost žádat o adopci druhým rodičem?;Neměly by v Česku páry stejného pohlaví mít možnost žádat o adopci druhým rodičem?
Family;Automatic co-parent recognition;Jsou v Česku děti narozené v páru automaticky právně uznávány od narození jako děti obou rodičů bez ohledu na sexuální orientaci a/nebo genderovou identitu partnerů?;Měly by být v Česku děti narozené v páru automaticky právně uznávány od narození jako děti obou rodičů bez ohledu na sexuální orientaci a/nebo genderovou identitu partnerů?;Neměly by být v Česku děti narozené v páru automaticky právně uznávány od narození jako děti obou rodičů v závislosti na sexuální orientaci a/nebo genderové identitě partnerů?
Family;Medically assisted insemination (couples);Nemají v Česku páry (bez ohledu na sexuální orientaci a/nebo genderovou identitu partnerů) žádné právní překážky v přístupu k léčbě neplodnosti?;Neměly by v Česku páry (bez ohledu na sexuální orientaci a/nebo genderovou identitu partnerů) čelit žádným právním překážkám v přístupu k léčbě neplodnosti?;Měly by v Česku páry (bez ohledu na sexuální orientaci a/nebo genderovou identitu partnerů) čelit právním překážkám v přístupu k léčbě neplodnosti?
Family;Medically assisted insemination (singles);Je v Česku léčba neplodnosti pro jednotlivce legálně možná bez ohledu na jejich sexuální orientaci a/nebo genderovou identitu?;Měla by být v Česku léčba neplodnosti pro jednotlivce legálně možná bez ohledu na jejich sexuální orientaci a/nebo genderovou identitu?;Měla by být v Česku legálně umožněna léčba neplodnosti pro jednotlivce na základě jejich sexuální orientace a/nebo genderové identity?
Family;Recognition of trans parenthood;Je v Česku plně uznána a správně reflektována právní genderová identita trans rodiče v dokladech o příbuzenství dítěte a jsou předpisy o rodičovství sladěny se všemi dostupnými možnostmi pohlaví (pokud existují více než dva genderové znaky) podle uznané genderové identity rodiče?;Měla by být v Česku právní genderová identita trans rodiče plně uznána a zohledněna v dokladech o příbuzenství dítěte a měla by se úprava rodičovství přizpůsobit všem dostupným možnostem pohlaví (pokud existují více než dva genderové znaky) podle uznané genderové identity rodiče?;Neměla by být v Česku trans rodičům uznána jejich právní genderová identita a správně zohledněna v dokumentaci o příbuzenství podle uznané genderové identity rodiče?
Hate crime & hate speech;Hate crime law (sexual orientation);Je v České republice sexuální orientace výslovně zahrnuta do právních předpisů o trestných činech z nenávisti jako přitěžující okolnost?;Měla by být v Česku sexuální orientace výslovně zahrnuta do právních předpisů o trestných činech z nenávisti jako přitěžující okolnost?;Měla by být v Česku sexuální orientace vyloučena z legislativy o trestných činech z nenávisti jako přitěžující okolnost?
Hate crime & hate speech;Hate speech law (sexual orientation);Je v Česku sexuální orientace výslovně zahrnuta do právních předpisů o nenávistných projevech jako přitěžující okolnost?;Měla by být v Česku sexuální orientace výslovně zahrnuta do právních předpisů o nenávistných projevech jako přitěžující okolnost?;Měla by být v Česku sexuální orientace vyloučena z právních předpisů o nenávistných projevech jako přitěžující okolnost?
Hate crime & hate speech;Policy tackling hatred (sexual orientation);Je v Česku sexuální orientace výslovně zahrnuta do národní strategie boje proti trestným činům z nenávisti a nenávistným projevům jako součást opakujícího se rámce státních aktérů?;Měla by být v České republice sexuální orientace výslovně zahrnuta do národní strategie boje proti trestným činům z nenávisti a nenávistným projevům jako součást opakujícího se rámce státních aktérů?;Měla by být v Česku sexuální orientace vyloučena z národní strategie boje proti trestným činům z nenávisti a nenávistným projevům?
Hate crime & hate speech;Hate crime law (gender identity);Je v České republice genderová identita výslovně zahrnuta do právních předpisů o trestných činech z nenávisti jako přitěžující okolnost?;Měla by být v Česku genderová identita výslovně zahrnuta do právních předpisů o trestných činech z nenávisti jako přitěžující okolnost?;Měla by být v Česku genderová identita vyloučena z právních předpisů o trestných činech z nenávisti jako přitěžující okolnost?
Hate crime & hate speech;Hate speech law (gender identity);Je v Česku genderová identita výslovně zahrnuta do právních předpisů o nenávistných projevech jako přitěžující okolnost?;Měla by být v Česku genderová identita výslovně zahrnuta do právních předpisů o nenávistných projevech jako přitěžující okolnost?;Měla by být v Česku genderová identita vyloučena z právních předpisů o nenávistných projevech jako přitěžující okolnost?
Hate crime & hate speech;Policy tackling hatred (gender identity);Je v Česku genderová identita zahrnuta do národní strategie boje proti trestným činům z nenávisti a nenávistným projevům jako součást trvalého, systematického a oficiálně organizovaného souboru opatření ze strany státu?;Měla by být v Česku genderová identita výslovně zahrnuta do národní strategie boje proti trestným činům z nenávisti a nenávistným projevům jako součást opakujícího se rámce státních aktérů?;Měla by být v Česku genderová identita vyloučena z národní strategie boje proti trestným činům z nenávisti a nenávistným projevům?
Hate crime & hate speech;Hate crime law (intersex);Jsou v Česku (domnělé) pohlavní znaky nebo intersexuální status výslovně zahrnuty do právních předpisů o trestných činech z nenávisti jako přitěžující okolnost?;Měly by být v Česku (domnělé) pohlavní znaky nebo intersexuální status výslovně zahrnuty do právních předpisů o trestných činech z nenávisti jako přitěžující okolnost?;Měly by být v Česku (domnělé) pohlavní znaky nebo intersexuální status vyloučeny z právních předpisů o trestných činech z nenávisti jako přitěžující okolnost?
Hate crime & hate speech;Hate speech law (sex characteristics);Jsou v Česku pohlavní znaky nebo intersexuální status výslovně zahrnuty do právních předpisů o nenávistných projevech jako přitěžující okolnost?;Měly by být v Česku pohlavní znaky nebo intersexuální status výslovně zahrnuty do právních předpisů o nenávistných projevech jako přitěžující okolnost?;Měly by být v Česku pohlavní znaky nebo intersexuální status vyloučeny z právních předpisů o nenávistných projevech jako přitěžující okolnost?
Hate crime & hate speech;Policies tackling hatred (intersex);Jsou v České republice pohlavní znaky nebo intersexuální status zahrnuty do národní strategie boje proti trestným činům z nenávisti a nenávistným projevům jako součást trvalého, systematického a oficiálně organizovaného souboru opatření ze strany státu?;Měly by být v Česku pohlavní znaky nebo intersexuální status zahrnuty do národní strategie boje proti trestným činům z nenávisti a nenávistným projevům jako součást opakujícího se rámce státních aktérů?;Měly by být v Česku pohlavní znaky nebo intersexuální status vyloučeny z národní strategie boje proti trestným činům z nenávisti a nenávistným projevům jako součást opakujícího se rámce státních aktérů?
Legal gender recognition;No legal framework making legal gender recognition impossible;Neexistuje v Česku výslovný zákaz nebo zákonné omezení, které by zcela znemožňovalo legální uznání pohlaví (i když jsou postupy náročné, obtížné nebo neexistuje žádná stanovená cesta)?;Neměl by v Česku existovat výslovný zákaz nebo zákonné omezení, které by zcela znemožňovalo legální uznání pohlaví (i když jsou postupy náročné, obtížné nebo neexistuje žádná stanovená cesta)?;Měl by v Česku existovat zákaz nebo zákonné omezení, které by znemožnilo právní uznání pohlaví?
Legal gender recognition;Existence of legal measures;Existují v Česku právní opatření pro právní uznání pohlaví?;Měla by v Česku existovat právní opatření pro uznání pohlaví?;Neměla by v Česku existovat žádná zákonná opatření pro právní uznání pohlaví?
Legal gender recognition;Existence of administrative procedures;Existují v Česku správní postupy pro právní uznání pohlaví?;Mělo by v Česku existovat správní řízení pro právní uznání pohlaví?;Nemělo by v Česku existovat správní řízení pro právní uznání pohlaví?
Legal gender recognition;Name change;Umožňuje česká legislativa změnu jména bez omezení?;Měla by v Česku legislativa umožnit změnu jména bez omezení?;Měla by v Česku legislativa změnu jména odmítnout, nebo ji s omezeními povolit?
Legal gender recognition;No age restriction (Name change);Neexistuje v Česku výslovné věkové omezení pro změnu jména nezletilých?;Nemělo by v Česku existovat výslovné věkové omezení pro změnu jména nezletilých?;Mělo by v Česku existovat věkové omezení pro změnu jména nezletilého?
Legal gender recognition;Self-determination;Je v Česku právní uznání pohlaví založeno výhradně na vyjádřeném přání dotyčné osoby, aniž by se vyžadovala účast třetí strany a aniž by se intersexuální status nebo pohlavní znaky považovaly za kontraindikaci?;Mělo by být v Česku právní uznání pohlaví založeno výhradně na výslovném přání dotyčné osoby, bez nutnosti účasti třetí strany a bez toho, aby byl intersexuální status nebo pohlavní znaky považovány za kontraindikaci?;Nemělo by se v Česku právní uznání pohlaví zakládat výhradně na projeveném přání dotyčné osoby, ale vyžadovat účast třetí strany, přičemž intersexuální status nebo pohlavní znaky jsou kontraindikací?
Legal gender recognition;Non-binary recognition;Je v Česku uznání nebinárního pohlaví dostupné buď prostřednictvím veřejného registru nabízejícího více než dvě označení pohlaví, dostupného pouze na žádost s jednotným postupem a bez diskriminace, nebo bez povinného zápisu označení pohlaví pro všechny do veřejného registru?;Mělo by být v Česku uznání nebinárního pohlaví dostupné buď prostřednictvím veřejného registru, který by nabízel více než dvě označení pohlaví a byl by dostupný pouze na žádost s jednotným postupem a bez diskriminace, nebo bez povinného zápisu označení pohlaví pro všechny do veřejného registru?;Nemělo by být v Česku uznání nebinárního pohlaví dostupné buď prostřednictvím veřejného rejstříku, který nabízí více než dvě možnosti označení pohlaví, nebo prostřednictvím absence povinného zápisu označení pohlaví ve veřejném rejstříku?
Legal gender recognition;No 'Gender Identity Disorder' diagnosis/psychological opinion required;Není v Česku pro právní uznání pohlaví vyžadována diagnóza poruchy pohlavní identity/psychologický posudek?;Neměla by být v Česku pro právní uznání pohlaví vyžadována diagnóza poruchy pohlavní identity/psychologický posudek?;Měla by být v Česku pro právní uznání pohlaví vyžadována diagnóza poruchy pohlavní identity/psychologický posudek?
Legal gender recognition;No compulsory medical intervention required;Nevyžadují se v Česku nechirurgické lékařské zákroky pro právní uznání pohlaví?;Neměly by být v Česku pro právní uznání pohlaví vyžadovány nechirurgické lékařské zákroky?;Měly by být v Česku pro právní uznání pohlaví vyžadovány nechirurgické lékařské zákroky?
