criterion_id;Fact;Support;Opposition
64;У Србији, да ли закони, политике и праксе омогућавају пуно остваривање права на слободу окупљања, укључујући одржавање ЛГБТИ јавних догађаја без препрека?;У Србији, да ли би закони, политике и праксе требало да омогуће пуно остваривање права на слободу окупљања, укључујући одржавање ЛГБТИ јавних догађаја без препрека?;У Србији, да ли би закони, политике и праксе требало да ускрате потпуно остваривање права на слободу окупљања за јавне ЛГБТИ догађаје?
65;У Србији, да ли јавне власти штите ЛГБТИ јавне догађаје и обезбеђују њихово несметано одржавање, укључујући заштиту од поремећаја или напада?;У Србији, да ли јавне власти треба да штите ЛГБТИ јавне догађаје и обезбеде њихово несметано одржавање, укључујући заштиту од поремећаја или напада?;У Србији, да ли јавне ЛГБТИ манифестације не би требало да буду заштићене од стране јавних власти које обезбеђују њихово несметано одржавање, укључујући заштиту од поремећаја или напада?
66;У Србији нема ли правних и административних ограничења за функционисање ЛГБТИ организација или публикација?;У Србији, да ли би требало да не постоје правна и административна ограничења у функционисању ЛГБТИ организација или публикација?;У Србији, да ли би требало да постоје законска и административна ограничења у функционисању ЛГБТИ организација или публикација?
67;У Србији, да ли нису ЛГБТИ браниоци људских права застрашани и криминализовани због свог рада?;У Србији, да ли браниоци људских права ЛГБТИ не би требало да буду застрашивани и криминализовани због свог рада?;У Србији, да ли би браниоци људских права ЛГБТИ требало да буду застрашивани и криминализовани због свог рада?
68;У Србији нема изричитих владиних прописа који забрањују организацијама пријем средстава?;У Србији, зар не би требало да постоје експлицитни државни прописи који забрањују организацијама примање средстава?;У Србији, да ли би требало да постоје експлицитни владини прописи који забрањују организацијама примање средстава?
69;У Србији не постоји ли законодавство на националном или локалном нивоу које ограничава слободу изражавања о ЛГБТИ питањима?;У Србији, да ли би требало да не постоји законодавство на националном или локалном нивоу које ограничава слободу изражавања о ЛГБТИ питањима?;У Србији, да ли би требало да постоји законодавство на националном или локалном нивоу које ограничава слободу изражавања о ЛГБТИ питањима?
70;У Србији, да ли је сексуална оријентација изричито укључена у закон о азилу као критеријум за квалификацију?;У Србији, да ли би сексуална оријентација требало изричито да буде укључена у закон о азилу као критеријум квалификације?;У Србији, да ли сексуална оријентација треба да буде искључена из закона о азилу као критеријум за квалификацију?
71;У Србији, да ли постоје неке националне политике или правни или неправни механизми у вези са азилом који посебно узимају у обзир потребе геј, лезбејских и бисексуалних избеглица или тражилаца азила?;У Србији, да ли би требало да постоје националне политике или правни или неправни механизми у вези са азилом који посебно узимају у обзир потребе геј, лезбејских и бисексуалних избеглица или тражилаца азила?;У Србији, зар не би требало да постоје националне политике или правни или неправни механизми у вези са азилом који посебно узимају у обзир потребе геј, лезбијских и бисексуалних избеглица или тражилаца азила?
72;У Србији, да ли је родни идентитет изричито укључен у закон о азилу као критеријум за квалификацију?;У Србији, да ли би полни идентитет требало изричито укључити у закон о азилу као критеријум квалификације?;У Србији, да ли би требало искључити родни идентитет из закона о азилу као критеријум за квалификацију?
73;У Србији ли постоје неке националне политике или правни или неправни механизми у вези са азилом који посебно узимају у обзир потребе транс и небинарних избеглица или тражилаца азила?;У Србији, да ли би требало да постоје националне политике или правни или неправни механизми у вези са азилом који посебно узимају у обзир потребе транс и небинарних избеглица или тражилаца азила?;У Србији, зар не би требало да постоје националне политике или правни или неправни механизми у вези са азилом који посебно узимају у обзир потребе транс и небинарних избеглица или азиланата?
74;У Србији, да ли је интерсекс статус или полне карактеристике изричито укључен у закон о азилу као критеријум за квалификацију?;У Србији, да ли би требало изричито укључити интерсекс статус или полне карактеристике у закон о азилу као критеријум за квалификацију?;У Србији, да ли би требало искључити интерсекс статус или полне карактеристике из закона о азилу као критеријум за квалификацију?
75;У Србији, да ли постоје националне политике или правни или неправни механизми у вези са азилом који посебно узимају у обзир потребе интерсекс избеглица или азиланата?;У Србији, да ли би требало да постоје националне политике или правни или неправни механизми у вези са азилом који посебно узимају у обзир потребе интерсекс избеглица или азиланата?;У Србији, да ли не би требало да постоје националне политике или правни или неправни механизми у вези са азилом који посебно узимају у обзир потребе интерсекс избеглица или азиланата?
