Category;Subcategory;Fact;Support;Opposition
Legal gender recognition;No compulsory sterilisation required;Krävs det inte sterilisering eller bevis på infertilitet för juridiskt erkännande av könstillhörighet i Finland?;Borde det i Finland inte krävas sterilisering eller bevis på barnlöshet för juridiskt erkännande av könstillhörighet?;Bör det i Finland krävas sterilisering eller bevis på infertilitet för juridiskt erkännande av könstillhörighet?
Legal gender recognition;No compulsory divorce required;Krävs det inte skilsmässa eller att man är ensamstående för att man ska kunna erkänna sitt kön juridiskt i Finland?;Borde det i Finland inte krävas skilsmässa eller ensamstående för juridiskt erkännande av könstillhörighet?;Bör man i Finland kräva skilsmässa eller att man är ensamstående för att få ett juridiskt erkännande av könstillhörighet?
Legal gender recognition;No age restriction;Finns det i Finland några uttryckliga åldersgränser för erkännande av könstillhörighet i de befintliga rättsakterna?;I Finland, bör befintliga rättsliga åtgärder för erkännande av könstillhörighet inte innehålla några uttryckliga begränsningar av lägsta eller högsta ålder?;Bör man i Finland införa åldersgränser för erkännande av könstillhörighet i de befintliga rättsakterna?
Legal gender recognition;Legal gender recognition procedures exist for minors;Finns det i Finland rättsliga åtgärder för minderåriga att få tillgång till juridiskt könsbekräftelse och ger de konsekventa resultat?;Bör minderåriga i Finland ha tillgång till rättsliga åtgärder för bedömning av juridiskt erkännande av kön och bör dessa åtgärder ge konsekventa resultat?;Bör minderåriga i Finland inte ha tillgång till rättsliga åtgärder för bedömning av juridiskt erkännande av könstillhörighet?
Legal gender recognition;Depathologisation;Finns det i Finland tillgång till transspecifik hälso- och sjukvård för vuxna/ungdomar, stödtjänster för transpersoner före puberteten och barn med könsvariation, och omfattas dessa av ekonomiskt stöd utan krav på bedömning eller diagnos av psykisk ohälsa?;Bör transspecifik hälso- och sjukvård för vuxna/ungdomar och stödtjänster för transpersoner och barn med könsvariation före puberteten vara tillgängliga och omfattas av ekonomiskt stöd utan krav på bedömning eller diagnos av psykisk ohälsa i Finland?;Borde inte transspecifik hälso- och sjukvård för vuxna/ungdomar och stödtjänster för transpersoner och barn med könsvariation före puberteten vara tillgängliga och ekonomiskt täckta i Finland utan krav på bedömning eller diagnos av psykisk ohälsa?
Intersex bodily integrity;Prohibition of medical intervention without informed consent (intersex);Är det i Finland enligt lag förbjudet för läkare att utföra något kirurgiskt eller medicinskt ingrepp på en minderårig intersexuell person, om ingreppet inte är medicinskt nödvändigt och kan undvikas eller skjutas upp tills personen kan ge sitt informerade samtycke?;Borde det i Finland enligt lag vara förbjudet för läkare att utföra någon form av kirurgiskt eller medicinskt ingrepp på en minderårig intersexuell person, om ingreppet inte är medicinskt nödvändigt och kan undvikas eller skjutas upp tills personen kan ge sitt informerade samtycke?;Bör läkare i Finland enligt lag ha rätt att utföra kirurgiska eller medicinska ingrepp på minderåriga intersexuella även om ingreppet inte är medicinskt nödvändigt och kan undvikas eller skjutas upp tills personen kan ge sitt informerade samtycke?
Intersex bodily integrity;Universality of prohibition of medical interventions;Är skyddet för den kroppsliga integriteten i Finland universellt för alla människor, inte baserat på specifika variationer eller diagnoser eller intersexuella termer, och är det enligt lag förbjudet för läkare eller andra yrkesutövare att utföra någon form av kirurgiskt eller medicinskt ingrepp på någon utan dennes personliga samtycke, utom i fall av vitala skäl?;Borde skyddet av den kroppsliga integriteten i Finland vara universellt för alla människor och inte grunda sig på specifika variationer eller diagnoser eller intersexuella termer, och borde läkare eller andra yrkesutövare enligt lag förbjudas att utföra någon form av kirurgiskt eller medicinskt ingrepp på någon utan dennes personliga samtycke, utom i fall av vitala skäl?;Bör skyddet för den kroppsliga integriteten i Finland vara beroende av specifika variationer eller diagnoser eller intersexuella termer, och bör läkare eller andra yrkesutövare enligt lag ha rätt att utföra kirurgiska eller medicinska ingrepp utan en persons samtycke, även om det inte finns några vitala skäl?
Intersex bodily integrity;Existence of effective monitoring mechanism;Finns det i Finland en övervakningsmekanism, som är oberoende av den medicinska verksamheten, för att övervaka förbudet mot medicinska ingrepp på minderåriga intersexuella?;Bör det i Finland finnas en övervakningsmekanism, som är oberoende av den medicinska verksamheten, för att övervaka förbudet mot medicinska ingrepp på minderåriga intersexuella?;Borde det i Finland inte finnas en övervakningsmekanism, som är oberoende av den medicinska verksamheten, för att övervaka förbudet mot medicinska ingrepp på minderåriga intersexuella?
Intersex bodily integrity;Access to justice for victims and reparations;Innehåller de finska lagbestämmelserna om förbud mot medicinska ingrepp på minderåriga intersexuella tydliga och effektiva mekanismer som erkänner tidigare praxis och säkerställer tillgång till rättvisa, gottgörelse, skadestånd och rätten till information?;Bör lagbestämmelser i Finland som förbjuder medicinska ingrepp på minderåriga intersexuella innehålla tydliga och effektiva mekanismer som erkänner tidigare praxis och säkerställer tillgång till rättvisa, gottgörelse, skadestånd och rätten till information?;I Finland, bör lagbestämmelser som förbjuder medicinska ingrepp på minderåriga intersexuella utesluta mekanismer som erkänner tidigare praxis och säkerställer tillgång till rättvisa, gottgörelse, skadestånd och rätten till information?
Civil society space;Public event held, no state obstruction of freedom of assembly (last 3 years);I Finland, gör lagar, policyer och praxis det möjligt att fullt ut utöva rätten till mötesfrihet, inklusive att hålla offentliga evenemang för lgbti-personer utan hinder?;I Finland, bör lagar, policyer och praxis möjliggöra ett fullständigt utövande av rätten till mötesfrihet, inklusive att offentliga evenemang för lgbti-personer kan hållas utan hinder?;I Finland, bör lagar, policyer och praxis hindra det fulla utövandet av rätten till mötesfrihet för offentliga evenemang för lgbti-personer?
Civil society space;Public event held, there is enough protection (last 3 years);I Finland, skyddas offentliga evenemang för lgbti-personer av offentliga myndigheter som säkerställer att de genomförs i vederbörlig ordning, inklusive skydd mot störningar eller attacker?;Bör offentliga evenemang för lgbti-personer i Finland skyddas av offentliga myndigheter som ser till att de genomförs på rätt sätt, inklusive skydd mot störningar eller attacker?;Borde inte offentliga evenemang för lgbti-personer i Finland skyddas av offentliga myndigheter som ser till att de genomförs i vederbörlig ordning, inklusive skydd mot störningar eller attacker?
Civil society space;Associations operate, no state obstruction of freedom association (last 3 years);Finns det i Finland inga rättsliga eller administrativa begränsningar för lgbti-organisationer eller -publikationer?;Borde det i Finland inte finnas några juridiska eller administrativa begränsningar för hbtqi-organisationers eller hbtqi-publikationers verksamhet?;Bör det i Finland finnas juridiska och administrativa begränsningar för hbtqi-organisationers eller hbtqi-publikationers verksamhet?
Civil society space;LGBTI human rights defenders are not at risk;I Finland, hotas och kriminaliseras inte människorättsförsvarare för lgbti-personer på grund av sitt arbete?;Borde inte människorättsförsvarare som företräder lgbti-personer i Finland hotas och kriminaliseras för sitt arbete?;Bör människorättsförsvarare som företräder lgbti-personer i Finland hotas och kriminaliseras på grund av sitt arbete?
Civil society space;No laws limiting external funding;Finns det i Finland inga uttryckliga statliga bestämmelser som förbjuder organisationer att ta emot finansiering?;Borde det inte i Finland finnas uttryckliga statliga bestämmelser som förbjuder organisationer att ta emot bidrag?;Borde det i Finland finnas uttryckliga statliga bestämmelser som förbjuder organisationer att ta emot bidrag?
Civil society space;No laws limiting freedom of expression (national/local);I Finland, finns det ingen lagstiftning på nationell eller lokal nivå som begränsar yttrandefriheten i hbtq-frågor?;I Finland, bör det inte finnas någon lagstiftning på nationell eller lokal nivå som begränsar yttrandefriheten i hbtq-frågor?;Borde det i Finland finnas lagstiftning på nationell eller lokal nivå som begränsar yttrandefriheten i hbtq-frågor?
Asylum;Asylum law (sexual orientation);Finns det i Finland en uttrycklig bestämmelse om sexuell läggning som ett kvalifikationskriterium i asyllagstiftningen?;Bör sexuell läggning i Finland uttryckligen tas med som ett kvalifikationskriterium i asyllagstiftningen?;Bör sexuell läggning i Finland uteslutas från asylrätten som ett kvalifikationskriterium?
Asylum;Other positive measures (sexual orientation);Finns det i Finland någon nationell politik eller några rättsliga eller icke-rättsliga åtgärder i anslutning till asyl som särskilt beaktar homo-, bi- och transsexuella flyktingars eller asylsökandes behov?;Bör det i Finland finnas nationella riktlinjer eller rättsliga eller icke-rättsliga åtgärder i anslutning till asyl som särskilt beaktar homo-, bi- och transsexuella flyktingars eller asylsökandes behov?;Borde det i Finland inte finnas någon nationell politik eller några rättsliga eller icke-rättsliga åtgärder i anslutning till asyl som särskilt beaktar homo-, bi- och transsexuella flyktingars eller asylsökandes behov?
Asylum;Asylum law (gender identity);Finns det i Finland en uttrycklig bestämmelse om könsidentitet som ett kvalifikationskriterium i asylrätten?;Bör könsidentitet uttryckligen tas in som ett kvalifikationskriterium i den finska asylrätten?;Borde könsidentitet i Finland uteslutas från asylrätten som ett kvalifikationskriterium?
Asylum;Other positive measures (gender identity);Finns det i Finland några nationella riktlinjer eller rättsliga eller icke-rättsliga åtgärder som rör asyl och som specifikt tar hänsyn till transpersoners och icke-binära flyktingars eller asylsökandes behov?;Bör det i Finland finnas nationella riktlinjer eller rättsliga eller icke-rättsliga åtgärder som rör asyl och som specifikt tar hänsyn till transpersoners och icke-binära flyktingars eller asylsökandes behov?;Borde det i Finland inte finnas några nationella riktlinjer eller rättsliga eller icke-rättsliga åtgärder som rör asyl och som specifikt tar hänsyn till transpersoners och icke-binära flyktingars eller asylsökandes behov?
Asylum;Asylum law (intersex);Finns det i Finland en uttrycklig bestämmelse om intersexuell status eller könskarakteristika som ett kvalifikationskriterium i asylrätten?;Bör intersexuell status eller könskarakteristika uttryckligen tas med i asylrätten som ett kvalifikationskriterium i Finland?;Borde intersexuell status eller könskarakteristika i Finland uteslutas från asylrätten som ett kvalifikationskriterium?
Asylum;Other positive measures (intersex);Finns det i Finland någon nationell politik eller några rättsliga eller icke-rättsliga åtgärder i anslutning till asyl som särskilt beaktar intersexuella flyktingars eller asylsökandes behov?;Bör det i Finland finnas nationella riktlinjer eller rättsliga eller icke-rättsliga åtgärder i samband med asyl som särskilt beaktar intersexuella flyktingars eller asylsökandes behov?;Borde det i Finland inte finnas någon nationell politik eller rättsliga eller icke-rättsliga åtgärder i anslutning till asyl som särskilt beaktar intersexuella flyktingars eller asylsökandes behov?
