Category;Subcategory;Fact;Support;Opposition
Intersex bodily integrity;Prohibition of medical intervention without informed consent (intersex);"В Беларуси запрещено ли законом медицинским работникам проводить любые хирургические или медицинские вмешательства в отношении несовершеннолетнего интерсексуала; если вмешательство не имеет медицинской необходимости и может быть предотвращено или отложено до тех пор; пока человек не сможет дать информированное согласие?";"В Беларуси следует ли законодательно запретить врачам проводить любые хирургические или медицинские вмешательства в отношении несовершеннолетних интерсексуалов; если в них нет медицинской необходимости и их можно избежать или отложить до тех пор; пока человек не даст осознанного согласия?";"В Беларуси следует ли законодательно разрешить врачам проводить хирургические или медицинские вмешательства в отношении несовершеннолетних интерсексуалов; даже если в них нет медицинской необходимости и их можно избежать или отложить до тех пор; пока человек не сможет дать информированное согласие?"
Intersex bodily integrity;Universality of prohibition of medical interventions;"Является ли в Беларуси защита телесной неприкосновенности универсальной для всех людей; не основанной на конкретных вариациях или диагнозах или терминах интерсекс; и запрещено ли законом врачам или другим специалистам проводить любые хирургические или медицинские вмешательства в отношении кого-либо без его личного согласия; за исключением случаев; когда это необходимо по жизненным показаниям?";"В Беларуси защита телесной неприкосновенности должна быть универсальной для всех людей; а не основываться на конкретных вариациях или диагнозах или терминах интерсекс; и должен ли закон запрещать врачам или другим специалистам проводить любые хирургические или медицинские вмешательства в отношении кого-либо без его личного согласия; за исключением случаев; когда это необходимо по жизненным показаниям?";"Должна ли в Беларуси защита телесной неприкосновенности зависеть от конкретных вариаций или диагнозов; или интерсексуальных терминов; и должен ли закон разрешать врачам или другим специалистам проводить хирургическое или медицинское вмешательство без согласия человека; даже если для этого нет жизненно важных причин?"
Intersex bodily integrity;Existence of effective monitoring mechanism;Существует ли в Беларуси независимый от медицинского учреждения механизм контроля за соблюдением запрета на медицинское вмешательство в отношении несовершеннолетних интерсексуалов?;"Должен ли в Беларуси существовать механизм мониторинга; независимый от медицинского учреждения; для контроля за запретом медицинского вмешательства в отношении несовершеннолетних интерсексуалов?";"Должен ли в Беларуси существовать независимый от медицинского учреждения механизм мониторинга; контролирующий запрет на медицинское вмешательство в отношении несовершеннолетних интерсексуалов?"
Intersex bodily integrity;Access to justice for victims and reparations;"Включают ли законодательные положения; запрещающие медицинское вмешательство в отношении несовершеннолетних интерсексуалов; четкие и эффективные механизмы; признающие прошлую практику и обеспечивающие доступ к правосудию; возмещению ущерба; компенсации и праву на информацию?";"Должны ли в Беларуси законодательные положения; запрещающие медицинское вмешательство в отношении несовершеннолетних интерсексуалов; включать четкие и эффективные механизмы; признающие прошлую практику и обеспечивающие доступ к правосудию; возмещению ущерба; компенсации и праву на информацию?";"Должны ли в Беларуси законодательные положения; запрещающие медицинское вмешательство в отношении несовершеннолетних интерсексуалов; исключать механизмы; признающие прошлую практику и обеспечивающие доступ к правосудию; возмещению ущерба; компенсации и праву на информацию?"
Civil society space;"Public event held; no state obstruction of freedom of assembly (last 3 years)";"Позволяют ли законы; политика и практика в Беларуси в полной мере осуществлять право на свободу собраний; включая беспрепятственное проведение публичных мероприятий для представителей ЛГБТИ?";"Должны ли в Беларуси законы; политика и практика обеспечивать полное осуществление права на свободу собраний; включая беспрепятственное проведение публичных мероприятий для представителей ЛГБТИ?";"Должны ли в Беларуси законы; политика и практика препятствовать полному осуществлению права на свободу собраний при проведении публичных мероприятий для ЛГБТИ?"
Civil society space;"Public event held; there is enough protection (last 3 years)";"Находятся ли в Беларуси публичные мероприятия ЛГБТ под защитой государственных органов; которые обеспечивают их надлежащее проведение; включая защиту от срыва или нападений?";"Должны ли в Беларуси публичные мероприятия ЛГБТ охраняться государственными органами; обеспечивающими их надлежащее проведение; включая защиту от срыва или нападений?";"Должны ли в Беларуси публичные мероприятия ЛГБТ не охраняться государственными органами; обеспечивающими их надлежащее проведение; включая защиту от срыва или нападений?"
Civil society space;"Associations operate; no state obstruction of freedom association (last 3 years)";Существуют ли в Беларуси законодательные и административные ограничения на функционирование организаций и изданий ЛГБТ?;В Беларуси не должно быть законодательных и административных ограничений на деятельность лгбт организаций и изданий?;Должны ли в Беларуси существовать правовые и административные ограничения на функционирование организаций или изданий ЛГБТ?
Civil society space;LGBTI human rights defenders are not at risk;Не запугивают ли в Беларуси правозащитников из числа ЛГБТ и не привлекают ли их к уголовной ответственности за их работу?;В Беларуси правозащитники не должны подвергаться запугиванию и уголовному преследованию за свою работу?;Стоит ли в Беларуси запугивать и привлекать к уголовной ответственности правозащитников из числа ЛГБТ за их работу?
Civil society space;No laws limiting external funding;"Существуют ли в Беларуси прямые постановления правительства; запрещающие организациям получать финансирование?";"Не следует ли в Беларуси ввести четкие правила; запрещающие организациям получать финансирование?";"Должны ли в Беларуси существовать четкие правила; запрещающие организациям получать финансирование?"
Civil society space;No laws limiting freedom of expression (national/local);"Существует ли в Беларуси законодательство на национальном или местном уровне; которое ограничивает свободу выражения мнений по вопросам ЛГБТ?";"В Беларуси не должно быть законодательства на национальном или местном уровне; ограничивающего свободу выражения мнений по вопросам ЛГБТ?";"Существует ли в Беларуси законодательство на национальном или местном уровне; ограничивающее свободу выражения мнений по вопросам ЛГБТ?"
Asylum;Asylum law (sexual orientation);Включена ли в Беларуси сексуальная ориентация в закон о предоставлении убежища в качестве квалификационного критерия?;Следует ли в Беларуси включить сексуальную ориентацию в закон о предоставлении убежища в качестве квалификационного критерия?;Следует ли в Беларуси исключить сексуальную ориентацию из закона о предоставлении убежища в качестве квалификационного критерия?
Asylum;Other positive measures (sexual orientation);"Существует ли в Беларуси какая-либо национальная политика или правовые или неправовые меры; связанные с предоставлением убежища; которые конкретно учитывают потребности геев; лесбиянок и бисексуалов; являющихся беженцами или лицами; ищущими убежище?";"Должна ли в Беларуси существовать национальная политика или правовые или неправовые меры; связанные с предоставлением убежища; которые конкретно учитывали бы потребности геев; лесбиянок и бисексуалов - беженцев или лиц; ищущих убежище?";"Не существует ли в Беларуси какой-либо национальной политики или правовых или неправовых мер; связанных с предоставлением убежища; которые конкретно учитывали бы потребности геев; лесбиянок и бисексуалов; являющихся беженцами или просителями убежища?"
Asylum;Asylum law (gender identity);Включена ли в Беларуси гендерная идентичность в закон об убежище в качестве квалификационного критерия?;Следует ли в Беларуси включить гендерную идентичность в закон об убежище в качестве квалификационного критерия?;Следует ли в Беларуси исключить гендерную идентичность из закона о предоставлении убежища в качестве квалификационного критерия?
Asylum;Other positive measures (gender identity);"Существует ли в Беларуси какая-либо национальная политика или правовые или неправовые меры; связанные с предоставлением убежища; которые конкретно учитывают потребности транс и небинарных беженцев или просителей убежища?";"Должна ли в Беларуси существовать национальная политика или правовые или неправовые меры; связанные с предоставлением убежища; которые бы учитывали потребности транс и небинарных беженцев или лиц; ищущих убежище?";"Не существует ли в Беларуси какой-либо национальной политики или правовых или неправовых мер; связанных с предоставлением убежища; которые конкретно учитывали бы потребности транс и небинарных беженцев или лиц; ищущих убежища?"
Asylum;Asylum law (intersex);В Беларуси интерсексуальный статус или половые признаки прямо включены в закон об убежище в качестве квалификационного критерия?;Должен ли в Беларуси интерсексуальный статус или половые признаки быть прямо включены в закон об убежище в качестве квалификационного критерия?;Следует ли в Беларуси исключить интерсексуальный статус или половые признаки из закона о предоставлении убежища в качестве квалификационного критерия?
Asylum;Other positive measures (intersex);"Существует ли в Беларуси какая-либо национальная политика или правовые или неправовые меры; связанные с предоставлением убежища; которые конкретно учитывают потребности интерсексуальных беженцев или лиц; ищущих убежище?";"Должна ли в Беларуси существовать национальная политика или правовые или неправовые меры; связанные с предоставлением убежища; которые конкретно учитывали бы потребности интерсексуальных беженцев или лиц; ищущих убежище?";"Не существует ли в Беларуси какой-либо национальной политики или правовых или неправовых мер; связанных с предоставлением убежища; которые конкретно учитывали бы потребности интерсексуальных беженцев или лиц; ищущих убежища?"
