Category;Subcategory;Fact;Support;Opposition
Family;Medically assisted insemination (couples);"Есть ли в Беларуси пары (независимо от сексуальной ориентации и/или гендерной идентичности партнеров); которые не сталкиваются с юридическими препятствиями при обращении за лечением бесплодия?";Должны ли в Беларуси супружеские пары (независимо от сексуальной ориентации и/или гендерной идентичности партнеров) не сталкиваться с юридическими препятствиями при обращении за лечением бесплодия?;Должны ли в Беларуси супружеские пары (независимо от сексуальной ориентации и/или гендерной идентичности партнеров) сталкиваться с юридическими препятствиями при обращении за лечением бесплодия?
Family;Medically assisted insemination (singles);"Возможно ли в Беларуси лечение бесплодия у частных лиц; независимо от их сексуальной ориентации и/или гендерной идентичности?";"Должно ли в Беларуси быть законодательно разрешено лечение бесплодия у частных лиц; независимо от их сексуальной ориентации и/или гендерной идентичности?";Должно ли в Беларуси быть законодательно разрешено лечение бесплодия по признаку сексуальной ориентации и/или гендерной идентичности человека?
Family;Recognition of trans parenthood;"В Беларуси полностью ли признана и правильно ли отражена в документах о родстве ребенка юридическая гендерная идентичность трансгендерного родителя; а также приведены ли нормативные акты о родительстве в соответствие со всеми доступными гендерными вариантами (когда существует более двух гендерных маркеров) в соответствии с признанной гендерной идентичностью родителя?";"Должна ли в Беларуси юридическая гендерная идентичность трансгендерного родителя полностью признаваться и отражаться в документах о родстве ребенка; а также должны ли нормативные акты о родительстве соответствовать всем имеющимся гендерным вариантам (когда существует более двух гендерных маркеров) в соответствии с признанной гендерной идентичностью родителя?";Должны ли в Беларуси трансгендерные родители не признавать свою юридическую гендерную идентичность и правильно отражать в документах родство в соответствии с признанной гендерной идентичностью родителя?
Hate crime & hate speech;Hate crime law (sexual orientation);Включена ли в Беларуси сексуальная ориентация в законодательство о преступлениях на почве ненависти в качестве отягчающего обстоятельства?;Следует ли в Беларуси включить сексуальную ориентацию в законодательство о преступлениях на почве ненависти в качестве отягчающего обстоятельства?;Следует ли в Беларуси исключить сексуальную ориентацию из законодательства о преступлениях на почве ненависти в качестве отягчающего обстоятельства?
Hate crime & hate speech;Hate speech law (sexual orientation);Включена ли в Беларуси сексуальная ориентация в законодательство о разжигании ненависти в качестве отягчающего обстоятельства?;Следует ли в Беларуси включить сексуальную ориентацию в законодательство о разжигании ненависти в качестве отягчающего обстоятельства?;Следует ли в Беларуси исключить сексуальную ориентацию из законодательства о разжигании ненависти в качестве отягчающего обстоятельства?
Hate crime & hate speech;Policy tackling hatred (sexual orientation);Включена ли в Беларуси сексуальная ориентация в национальную стратегию борьбы с преступлениями на почве ненависти и высказываниями на почве ненависти в рамках постоянно действующей государственной программы?;Должна ли сексуальная ориентация быть четко включена в национальную стратегию борьбы с преступлениями на почве ненависти и разжиганием ненависти в Беларуси в рамках постоянно действующей государственной программы?;Следует ли в Беларуси исключить сексуальную ориентацию из национальной стратегии по борьбе с преступлениями на почве ненависти и разжиганием ненависти?
Hate crime & hate speech;Hate crime law (gender identity);Включена ли в Беларуси гендерная идентичность в законодательство о преступлениях на почве ненависти в качестве отягчающего обстоятельства?;Следует ли в Беларуси включить гендерную идентичность в законодательство о преступлениях на почве ненависти в качестве отягчающего обстоятельства?;Следует ли в Беларуси исключить гендерную идентичность из законодательства о преступлениях на почве ненависти в качестве отягчающего обстоятельства?
Hate crime & hate speech;Hate speech law (gender identity);В Беларуси гендерная идентичность прямо включена в законодательство о разжигании ненависти в качестве отягчающего обстоятельства?;Следует ли в Беларуси включить гендерную идентичность в законодательство о разжигании ненависти в качестве отягчающего обстоятельства?;Следует ли в Беларуси исключить гендерную идентичность из законодательства о разжигании ненависти в качестве отягчающего обстоятельства?
Hate crime & hate speech;Policy tackling hatred (gender identity);"Включена ли в Беларуси гендерная идентичность в национальную стратегию борьбы с преступлениями на почве ненависти и языком ненависти как часть постоянного; систематического и официально организованного комплекса мер со стороны государства?";Следует ли в Беларуси включить гендерную идентичность в национальную стратегию по борьбе с преступлениями на почве ненависти и разжиганием ненависти в рамках постоянно действующей государственной программы?;Следует ли в Беларуси исключить гендерную идентичность из национальной стратегии по борьбе с преступлениями на почве ненависти и разжиганием ненависти?
Hate crime & hate speech;Hate crime law (intersex);Включены ли в Беларуси (предполагаемые) половые признаки или интерсексуальный статус в законодательство о преступлениях на почве ненависти в качестве отягчающего обстоятельства?;Следует ли в Беларуси включить (предполагаемые) половые признаки или интерсексуальный статус в законодательство о преступлениях на почве ненависти в качестве отягчающего обстоятельства?;Следует ли в Беларуси исключить (предполагаемые) половые признаки или интерсексуальный статус из законодательства о преступлениях на почве ненависти в качестве отягчающего обстоятельства?
Hate crime & hate speech;Hate speech law (sex characteristics);В Беларуси половые признаки или интерсексуальный статус прямо включены в законодательство о разжигании ненависти в качестве отягчающего обстоятельства?;Следует ли в Беларуси включить половые признаки или интерсексуальный статус в законодательство о разжигании ненависти в качестве отягчающего обстоятельства?;В Беларуси следует ли исключить половые признаки или интерсексуальный статус из законодательства о разжигании ненависти в качестве отягчающего обстоятельства?
Hate crime & hate speech;Policies tackling hatred (intersex);"Включены ли в Беларуси половые признаки или интерсексуальный статус в национальную стратегию борьбы с преступлениями на почве ненависти и языком вражды как часть постоянного; систематического и официально организованного комплекса мер со стороны государства?";"Следует ли в Беларуси включить половые признаки или интерсексуальный статус в национальную стратегию по борьбе с преступлениями на почве ненависти и разжиганием ненависти; как часть постоянно действующей рамочной программы государственных органов?";"Следует ли в Беларуси исключить половые признаки или интерсексуальный статус из национальной стратегии по борьбе с преступлениями на почве ненависти и разжиганием ненависти; как часть повторяющейся рамочной программы государственных органов?"
Legal gender recognition;No legal framework making legal gender recognition impossible;"Существует ли в Беларуси прямой запрет или законодательное ограничение; которое делает юридическое признание пола полностью невозможным (даже если процедуры обременительны; сложны или не существует установленного пути)?";"В Беларуси не должно быть прямых запретов или законодательных ограничений; которые делают юридическое признание пола полностью невозможным (даже если процедуры обременительны; сложны или не существует установленного пути)?";"Должен ли в Беларуси существовать запрет или законодательное ограничение; делающее невозможным юридическое признание пола?"
Legal gender recognition;Existence of legal measures;Существуют ли в Беларуси законодательные меры для юридического признания пола?;Должны ли в Беларуси быть приняты законодательные меры для юридического признания пола?;В Беларуси не должно быть законодательных мер по юридическому признанию пола?
Legal gender recognition;Existence of administrative procedures;Существуют ли в Беларуси административные процедуры для юридического признания пола?;Должны ли в Беларуси существовать административные процедуры для юридического признания пола?;В Беларуси не должно быть административных процедур для юридического признания пола?
Legal gender recognition;Name change;Разрешает ли законодательство Беларуси менять имя без ограничений?;Должно ли законодательство Беларуси разрешать смену имени без ограничений?;В Беларуси законодательство должно запрещать смену имени или разрешать с ограничениями?
Legal gender recognition;No age restriction (Name change);В Беларуси нет четких возрастных ограничений для несовершеннолетних на изменение имени?;Должно ли в Беларуси существовать четкое возрастное ограничение для несовершеннолетних на изменение имени?;Должно ли в Беларуси существовать возрастное ограничение для смены имени несовершеннолетним?
Legal gender recognition;Self-determination;"В Беларуси юридическое признание пола основывается исключительно на выраженном желании заинтересованного лица; не требуя участия третьих лиц и не рассматривая интерсексуальный статус или половые признаки как противопоказание?";"Должно ли в Беларуси юридическое признание пола основываться исключительно на выраженном желании заинтересованного лица; не требуя участия третьих лиц и не рассматривая интерсексуальный статус или половые признаки как противопоказание?";"Должно ли в Беларуси юридическое признание пола основываться не только на выраженном желании заинтересованного лица; но и требовать участия третьей стороны; а интерсексуальный статус или половые признаки являться противопоказанием?"
Legal gender recognition;Non-binary recognition;"В Беларуси признание небинарного пола доступно либо через государственный реестр; предлагающий более двух гендерных маркеров; доступных только по запросу с соблюдением последовательной процедуры и без дискриминации; либо через отсутствие обязательной записи гендерного маркера для всех в государственном реестре?";"В Беларуси признание небинарного пола должно быть доступно либо через государственный реестр; предлагающий более двух гендерных маркеров и доступный только по запросу с соблюдением последовательной процедуры и без дискриминации; либо через отсутствие обязательной записи гендерного маркера для всех в государственном реестре?";"В Беларуси признание небинарного пола не должно быть доступно ни через государственный реестр; предлагающий более двух вариантов гендерных маркеров; ни через отсутствие обязательной записи гендерных маркеров в государственном реестре?"
Legal gender recognition;No 'Gender Identity Disorder' diagnosis/psychological opinion required;В Беларуси для юридического признания пола не требуется диагноз расстройства гендерной идентичности/психологическое заключение?;Должен ли в Беларуси диагноз расстройства гендерной идентичности/психологическое заключение не требоваться для юридического признания пола?;Должна ли в Беларуси требоваться диагностика расстройства гендерной идентичности/психологическое заключение для юридического признания пола?
Legal gender recognition;No compulsory medical intervention required;В Беларуси безоперационные медицинские вмешательства не требуются для юридического признания пола?;Должны ли в Беларуси нехирургические медицинские вмешательства не требоваться для юридического признания пола?;Должны ли в Беларуси требоваться нехирургические медицинские вмешательства для юридического признания пола?
Legal gender recognition;No compulsory surgical intervention required;В Беларуси хирургическое вмешательство не требуется для юридического признания пола?;В Беларуси для юридического признания пола не требуется хирургическое вмешательство?;Должны ли в Беларуси требоваться хирургические вмешательства для юридического признания пола?
Legal gender recognition;No compulsory sterilisation required;В Беларуси для юридического признания пола не требуется стерилизация или подтверждение бесплодия?;Должна ли в Беларуси стерилизация или подтверждение бесплодия не требоваться для юридического признания пола?;Должна ли в Беларуси требоваться стерилизация или подтверждение бесплодия для юридического признания пола?
Legal gender recognition;No compulsory divorce required;В Беларуси развод или статус холостяка не является обязательным условием для юридического признания пола?;В Беларуси развод или статус холостяка не должен быть обязательным условием для юридического признания пола?;Должен ли в Беларуси развод или статус холостяка быть обязательным условием для юридического признания пола?
Legal gender recognition;No age restriction;"Существуют ли в Беларуси законодательные меры по признанию гендера; не предусматривающие каких-либо четких ограничений по минимальному или максимальному возрасту?";Должны ли в Беларуси существующие правовые меры по признанию пола исключать какие-либо четкие ограничения по минимальному или максимальному возрасту?;Должны ли в Беларуси существующие правовые меры по признанию пола включать ограничения по минимальному или максимальному возрасту?
Legal gender recognition;Legal gender recognition procedures exist for minors;Доступны ли в Беларуси правовые меры по получению несовершеннолетними юридического признания пола и дают ли они последовательные результаты?;Должны ли в Беларуси юридические меры по оценке юридического признания пола быть доступны для несовершеннолетних и давать последовательные результаты?;Должны ли в Беларуси законодательные меры по оценке юридического признания пола быть недоступны для несовершеннолетних?
Legal gender recognition;Depathologisation;"Доступна ли в Беларуси и покрывается ли финансово транссексуальная медицинская помощь (ТСП) для взрослых/подростков; услуги поддержки для препубертатных трансов и детей с гендерными вариантами; не требующие оценки психического здоровья или постановки диагноза?";"Должна ли в Беларуси быть доступной и финансово оплачиваемой трансспецифическая медицинская помощь (ТСПМ) для взрослых/подростков и услуги поддержки для детей до полового созревания; не требующие оценки психического здоровья или постановки диагноза?";В Беларуси транссексуальная медицинская помощь (ТСП) для взрослых/подростков и услуги поддержки для детей-транссексуалов и детей с гендерными вариантами в препубертатном возрасте не должны быть доступными и финансово оплачиваемыми без необходимости оценки психического здоровья или постановки диагноза?
