Category;Subcategory;Fact;Support;Opposition
Equality & non-discrimination;Constitution (sexual orientation);Запрещает ли конституция Беларуси дискриминацию по признаку сексуальной ориентации?;Должна ли конституция Беларуси запрещать дискриминацию по признаку сексуальной ориентации?;Должна ли конституция Беларуси разрешать дискриминацию по признаку сексуальной ориентации?
Equality & non-discrimination;Employment (sexual orientation);Включена ли в Беларуси сексуальная ориентация в антидискриминационное законодательство в сфере занятости?;Следует ли в Беларуси включить сексуальную ориентацию в антидискриминационное законодательство в сфере занятости?;Следует ли в Беларуси исключить сексуальную ориентацию из антидискриминационного законодательства в сфере занятости?
Equality & non-discrimination;Goods & services (sexual orientation);Включена ли в Беларуси сексуальная ориентация в антидискриминационное законодательство в сфере товаров и услуг?;Следует ли в Беларуси включить сексуальную ориентацию в антидискриминационное законодательство в сфере товаров и услуг?;Следует ли в Беларуси исключить сексуальную ориентацию из антидискриминационного законодательства в сфере товаров и услуг?
Equality & non-discrimination;Education (sexual orientation);Запрещена ли в Беларуси законодательством дискриминация по признаку сексуальной ориентации в сфере образования?;Следует ли в Беларуси законодательно запретить дискриминацию по признаку сексуальной ориентации в сфере образования?;Должна ли в Беларуси законодательно разрешаться дискриминация по признаку сексуальной ориентации в сфере образования?
Equality & non-discrimination;Health (sexual orientation);Запрещена ли в Беларуси законодательством дискриминация по признаку сексуальной ориентации в сфере здравоохранения?;Следует ли в Беларуси законодательно запретить дискриминацию по признаку сексуальной ориентации в сфере здравоохранения?;Должна ли в Беларуси законодательно разрешаться дискриминация по признаку сексуальной ориентации в сфере здравоохранения?
Equality & non-discrimination;Conversion practices ban (sexual orientation);"Есть ли в Беларуси законодательство или политика; запрещающие конверсионные или репаративные практики; направленные на изменение сексуальной ориентации несовершеннолетних?";"Следует ли в Беларуси законодательно или политически запретить конверсионные или репаративные практики; направленные на изменение сексуальной ориентации несовершеннолетних?";"Должны ли в Беларуси законодательно или политически разрешаться конверсионные или репаративные практики; направленные на изменение сексуальной ориентации несовершеннолетних?"
Equality & non-discrimination;Equality body mandate (sexual orientation);"Существует ли в Беларуси национальное правозащитное учреждение или орган по вопросам равенства; которому прямо поручено заниматься вопросами; связанными с сексуальной ориентацией; и систематически работать над ними?";"Должен ли в Беларуси национальный институт по правам человека или орган по вопросам равенства иметь четкий мандат на рассмотрение и систематическую работу по вопросам; связанным с сексуальной ориентацией?";"Должен ли в Беларуси национальный институт по правам человека или орган по вопросам равенства не иметь мандата на решение вопросов; связанных с сексуальной ориентацией?"
Equality & non-discrimination;Equality action plan (sexual orientation);"Существует ли в Беларуси план действий по обеспечению равенства; в котором четко прописаны вопросы сексуальной ориентации и конкретные меры по достижению прогресса?";"Должен ли в Беларуси существовать план действий по обеспечению равенства; в котором четко прописана сексуальная ориентация и конкретные меры по достижению прогресса?";Следует ли в Беларуси исключить сексуальную ориентацию из планов действий по обеспечению равенства?
Equality & non-discrimination;Constitution (gender identity);Запрещает ли конституция Беларуси дискриминацию по признаку гендерной идентичности?;Должна ли конституция Беларуси запретить дискриминацию по признаку гендерной идентичности?;Должна ли конституция Беларуси разрешать дискриминацию по признаку генной принадлежности?
Equality & non-discrimination;Employment (gender identity);Включена ли в Беларуси гендерная идентичность в антидискриминационное законодательство в сфере занятости?;Следует ли в Беларуси включить гендерную идентичность в антидискриминационное законодательство в сфере занятости?;Следует ли в Беларуси исключить гендерную идентичность из антидискриминационного законодательства в сфере занятости?
Equality & non-discrimination;Goods & services (gender identity);Включена ли в Беларуси гендерная идентичность в антидискриминационное законодательство в сфере товаров и услуг?;Следует ли в Беларуси включить гендерную идентичность в антидискриминационное законодательство в сфере товаров и услуг?;Следует ли в Беларуси исключить гендерную идентичность из антидискриминационного законодательства в сфере товаров и услуг?
Equality & non-discrimination;Education (gender identity);Запрещена ли в Беларуси законодательством дискриминация по признаку гендерной идентичности в сфере образования?;Следует ли в Беларуси законодательно запретить дискриминацию по признаку гендерной идентичности в сфере образования?;Должна ли в Беларуси законодательно разрешаться дискриминация по признаку гендерной идентичности в сфере образования?
Equality & non-discrimination;Health (gender identity);Запрещена ли в Беларуси законодательством дискриминация по признаку гендерной идентичности в сфере здравоохранения?;Следует ли в Беларуси законодательно запретить дискриминацию по признаку гендерной идентичности в сфере здравоохранения?;Должна ли в Беларуси законодательно разрешаться дискриминация по признаку гендерной идентичности в сфере здравоохранения?
Equality & non-discrimination;Conversion practices ban (gender identity);"Есть ли в Беларуси законодательство или политика; запрещающие конверсионные или репаративные практики; направленные на изменение гендерной идентичности несовершеннолетних?";"Следует ли в Беларуси законодательно или политически запретить конверсионные или репаративные практики; направленные на изменение гендерной идентичности несовершеннолетних?";"Должны ли в Беларуси законодательно или политически разрешаться конверсионные или репаративные практики; направленные на изменение гендерной идентичности несовершеннолетних?"
Equality & non-discrimination;Equality body mandate (gender identity);"Есть ли в Беларуси национальный институт по правам человека или орган по вопросам равенства; уполномоченный заниматься вопросами; связанными с гендерной идентичностью; и систематически работать над ними? (Думаю; вам нужен только один)";"Должен ли в Беларуси национальный институт по правам человека или орган по вопросам равенства иметь четкий мандат на решение вопросов; связанных с гендерной идентичностью?";"Должен ли в Беларуси национальный институт по правам человека или орган по вопросам равенства не иметь мандата на решение вопросов; связанных с гендерной идентичностью?"
Equality & non-discrimination;Equality action plan (gender identity);"Существует ли в Беларуси план действий по обеспечению равенства; в котором четко прописана гендерная идентичность и конкретные меры по достижению прогресса?";"Должен ли в Беларуси существовать план действий по обеспечению равенства; в котором четко прописана гендерная идентичность и конкретные меры по достижению прогресса?";В Беларуси следует ли исключить гендерную идентичность из планов действий по обеспечению равенства?
Equality & non-discrimination;Law (gender expression);Включено ли в Беларуси гендерное самовыражение в антидискриминационное законодательство?;Следует ли в Беларуси включить гендерное самовыражение в антидискриминационное законодательство?;Следует ли в Беларуси исключить гендерное самовыражение из антидискриминационного законодательства?
Equality & non-discrimination;Constitution (sex characteristics);Запрещает ли конституция Беларуси дискриминацию по половому признаку?;Должна ли конституция Беларуси запрещать дискриминацию по половому признаку?;Должна ли конституция Беларуси разрешать дискриминацию по половому признаку?
Equality & non-discrimination;Employment (sex characteristics);Включены ли в Беларуси половые признаки в антидискриминационное законодательство в сфере занятости?;Должны ли в Беларуси половые признаки быть прямо включены в антидискриминационное законодательство в сфере занятости?;Следует ли в Беларуси исключить половые признаки из антидискриминационного законодательства в сфере занятости?
Equality & non-discrimination;Goods & services (sex characteristics);Включены ли в Беларуси половые признаки в антидискриминационное законодательство в сфере товаров и услуг?;Должны ли в Беларуси половые признаки быть прямо включены в антидискриминационное законодательство в сфере товаров и услуг?;Следует ли в Беларуси исключить половые признаки из антидискриминационного законодательства в сфере товаров и услуг?
Equality & non-discrimination;Education (sex characteristics);Запрещена ли в Беларуси законодательством дискриминация по половому признаку в сфере образования?;Следует ли в Беларуси законодательно запретить дискриминацию по половому признаку в сфере образования?;Должна ли в Беларуси законодательно разрешаться дискриминация по половому признаку в сфере образования?
Equality & non-discrimination;Health (sex characteristics);Запрещена ли в Беларуси законодательством дискриминация по половому признаку в сфере здравоохранения?;Следует ли в Беларуси законодательно запретить дискриминацию по половому признаку в сфере здравоохранения?;Должна ли в Беларуси законодательно разрешаться дискриминация по половому признаку в сфере здравоохранения?
Equality & non-discrimination;Equality body mandate (sex characteristics);"Существует ли в Беларуси национальное правозащитное учреждение или орган по вопросам равенства; которому прямо поручено заниматься и систематически работать над вопросами; связанными с половыми признаками?";"Следует ли в Беларуси наделить национальные правозащитные учреждения или органы по вопросам равенства прямым мандатом на решение вопросов; связанных с половыми признаками?";"Должны ли национальные правозащитные учреждения или органы по вопросам равенства в Беларуси не иметь мандата на решение вопросов; связанных с половыми признаками?"
Equality & non-discrimination;Equality action plan (sex characteristics);"Существует ли в Беларуси план действий по обеспечению равенства; в котором четко указаны половые признаки и конкретные меры по достижению прогресса?";"Должен ли в Беларуси существовать план действий по обеспечению равенства; в котором четко прописана гендерная идентичность и конкретные меры по достижению прогресса?";Следует ли в Беларуси исключать половые признаки из планов действий по обеспечению равенства?
Equality & non-discrimination;Blood donations;Является ли в Беларуси донорство крови или любых видов тканей тела для представителей ЛГБТ по признаку их сексуальной ориентации или гендерной идентичности свободным от законодательных или административных запретов?;Должны ли в Беларуси законодательно или административно запретить донорство крови или любых видов тканей организма для людей с сексуальной ориентацией или гендерной идентичностью?;Следует ли в Беларуси законодательно или административно запретить донорство крови или любых тканей тела для представителей ЛГБТ по признаку их сексуальной ориентации или гендерной идентичности?
Family;Marriage equality;"Разрешено ли в Беларуси однополым парам вступать в брак с теми же правами; что и разнополым парам?";"Должны ли в Беларуси однополые пары иметь право заключать брак на тех же правах; что и разнополые пары?";"Должны ли в Беларуси однополые пары не иметь права заключать брак на том же уровне; что и разнополые пары?"
Family;Registered partnership (similar rights to marriage);"В Беларуси разрешено ли однополым парам вступать в зарегистрированное партнерство/гражданское партнерство и получать тот же уровень прав; что и в случае брака?";"Следует ли в Беларуси разрешить однополым парам вступать в зарегистрированное партнерство/гражданское партнерство и получать тот же уровень прав; что и в случае брака?";"Должны ли в Беларуси однополые пары не иметь права вступать в зарегистрированное партнерство/гражданское партнерство и получать тот же уровень прав; что и в случае брака?"
Family;Registered partnership (limited rights);Разрешено ли в Беларуси однополым парам вступать в зарегистрированное партнерство/гражданское партнерство?;Следует ли в Беларуси разрешить однополым парам вступать в зарегистрированное партнерство/гражданское партнерство?;Должны ли в Беларуси однополые пары не иметь права вступать в зарегистрированное партнерство/гражданское партнерство?
Family;Cohabitation;"Включены ли в Беларуси однополые пары в законодательство или правовые меры; касающиеся совместного проживания?";"Должны ли в Беларуси однополые пары быть включены в законодательство или правовые меры; касающиеся сожительства?";"Должны ли в Беларуси однополые пары быть исключены из законодательства или правовых мер; касающихся совместного проживания?"
Family;No constitutional limitation on marriage;В Беларуси нет конституционного определения брака как союза между мужчиной и женщиной?;Следует ли в Беларуси отказаться от конституционного определения брака как союза между мужчиной и женщиной?;Должно ли в Беларуси существовать конституционное определение брака как союза между мужчиной и женщиной?
Family;Joint adoption;Могут ли в Беларуси однополые пары подать заявление на совместное усыновление?;Следует ли в Беларуси разрешить однополым парам подавать заявления на совместное усыновление на законных основаниях?;Должны ли в Беларуси однополые пары не иметь права подавать заявления на совместное усыновление на законных основаниях?
Family;Second-parent adoption;Могут ли в Беларуси однополые пары на законных основаниях подавать заявления на усыновление вторым родителем?;Следует ли в Беларуси разрешить однополым парам подавать заявления на усыновление вторыми родителями?;Должны ли в Беларуси однополые пары не иметь права подавать заявление на усыновление вторым родителем?
Family;Automatic co-parent recognition;"В Беларуси дети; рожденные в супружеских парах; автоматически признаются с рождения детьми обоих родителей; независимо от сексуальной ориентации и/или гендерной идентичности партнеров?";"Должны ли в Беларуси дети; рожденные в супружеских парах; автоматически признаваться с рождения детьми обоих родителей; независимо от сексуальной ориентации и/или гендерной идентичности партнеров?";"Должны ли в Беларуси дети; рожденные в супружеских парах; не признаваться автоматически по закону с рождения детьми обоих родителей в зависимости от сексуальной ориентации и/или гендерной идентичности партнеров?"
