Category;Subcategory;Fact;Support;Opposition
Equality & non-discrimination;Constitution (sexual orientation);Конституция запрещает дискриминацию по признаку сексуальной ориентации?;Должен ли Конституция запретить дискриминацию по ориентации в сексуальных отношениях?;Должен ли Конституция запретить дискриминацию по ориентации сексуальной привязанности?
Equality & non-discrimination;Employment (sexual orientation);Включено ли сексуальное направление открыто в законодательстве о запрете дискриминации при найме?;Должны ли ориентация сексуального предпочтения быть явно включенной в законодательство о запрете дискриминации при найме?;Должны ли ориентация сексуального характера быть исключенной из законодательства о неравном признании в сфере труда?
Equality & non-discrimination;Goods & services (sexual orientation);Ее сексуальная ориентация включена в законодательство о запрете дискриминации при предоставлении товаров и услуг Explicitly?;Должен ли сексуальный признак быть явно включенным в законодательство о неравном обслуживании товаров и услуг?;Должен ли сексуальный ориентацион быть исключенным в законодательстве о неравном предоставлении услуг и товаров?
Equality & non-discrimination;Education (sexual orientation);Дискриминация на основе сексуальной ориентации в области образования запрещена законодательством?;Должны ли законы запрещать дискриминацию на основе сексуальной ориентации в образовательной сфере?;Должна ли законодательство позволять дискриминации на основе сексуальной ориентации в образовании?
Equality & non-discrimination;Health (sexual orientation);Дискриминация на основе сексуальной ориентации в области здравоохранения запрещена законодательством?;Должны ли запреты на дискриминацию по ориентации в поле здравоохранения быть законодательными?;Должна ли законодательство разрешать дискриминацию на основе сексуальной ориентации в области здравоохранения?
Equality & non-discrimination;Conversion practices ban (sexual orientation);Существуют законодательные акты или политики, запрещающие конверсии или практики исправления, направленные на изменение сексуальной ориентации несовершеннолетнего?;Должны ли законы или политики, позволяющие конверсии или репаративные практики, направленные на изменение сексуальной ориентации несовершеннолетнего, быть запрещены?;Должны ли законы или политики разрешать конверсионные или репаративные практики, направленные на изменение сексуальной ориентации несовершеннолетнего?
Equality & non-discrimination;Equality body mandate (sexual orientation);Национальные учреждения по правам человека или равенство не являются явными мандатом, а также систематически работают над вопросами, связанными с ориентацией на полу?;Должны ли национальные институты по правам человека или органы равенства быть явно уполномоченными отрабатывать и систематически работать над вопросами, связанными с ориентацией в сексуальном отношении?;Должны ли учреждения по правам человека на национальном уровне или органы равенства не иметь мандата для рассмотрения вопросов, связанных с ориентацией вlove?
Equality & non-discrimination;Equality action plan (sexual orientation);Существует план действий по равенству, который явно включает в себя ориентацию на сексуальную направленность и конкретные меры для прогресса?;Должно ли быть планом действий по равенству, который явно включает в себя ориентацию и конкретные меры для прогресса?;Должна быть исключена ориентация в планах действий по равенству?
Equality & non-discrimination;Constitution (gender identity);Конституция запрещает дискриминацию на основе идентичности пола?;Должен ли Конституция запрещать дискриминацию по признаку гендерной идентичности?;Должна ли Конституция запрещать дискриминацию на основе гендерной идентичности?
Equality & non-discrimination;Employment (gender identity);Идентичность пола в законодательстве о запрете дискриминации в области труда является явно включенной?;Должно ли включать в законодательство о запрете дискриминации на работе явное упоминание гендерной идентичности?;Должны ли гендерная идентичность исключаться из законодательства о неравном обогащении на работе?
Equality & non-discrimination;Goods & services (gender identity);Распознаётся ли гендерная идентичность открыто в законодательстве о запрещении дискриминации по отношению к товарам и услугам?;Должны ли быть гендерная идентичность явно включена в законодательство о запрете дискриминации в отношении товаров и услуг?;Должны ли исключить идентичность пола при законодательстве о запрете дискриминации в товарах и услугах?
Equality & non-discrimination;Education (gender identity);Дискриминация на основе идентичности пола в области образования запрещается законодательством?;Должны ли быть запрещены законом дискриминация по признаку гендерной идентичности в области образования?;Должна ли быть законодательной разрешенной дискриминация по признаку гендерной идентичности в области образования?
Equality & non-discrimination;Health (gender identity);Дискриминация по идентичности пола в сфере здравоохранения запрещена законодательством ли?;Должно ли быть запрещено законодательством дискриминация по признаку гендерной идентичности в области здравоохранения?;Должна ли быть разрешена законодательством дискриминация по признаку гендерной идентичности в области здравоохранения?
Equality & non-discrimination;Conversion practices ban (gender identity);Существуют ли законодательные акты и политики, запрещающие конверсии или репаративные практики, направленные на изменение гендерной идентичности несовершеннолетнего?;Должны ли законы и политики, разрешающие преобразование или практики реабилитации, направленные на изменение гендерной идентичности ребенка, быть запрещены?;Должны ли быть законодательством и политиками, позволяющими конверсионным или репаративным практикам, направленными на изменение гендерной идентичности несовершеннолетнего?
Equality & non-discrimination;Equality body mandate (gender identity);Национальные учреждения по правам человека или органы равенства явно уполномоченыaddressать и систематически заниматься вопросами, связанными с идентичностью пола?;Должны ли национальные институты по правам человека или органы равенства явно быть уполномоченными разрешать вопросы, связанные с гендерной идентичностью?;Должны ли национальные институты по правам человека или органы равенства быть уполномоченными рассматривать вопросы, связанные с гендерной идентичностью?
Equality & non-discrimination;Equality action plan (gender identity);Существует план действий по равенству, который напрямую включает в себя идентичность пола и конкретные меры для прогресса?;Должна ли быть программа действий по равенству, которая явно включает в себя идентичность пола и конкретные меры прогресса?;Должна ли гендерная идентичность исключаться из планов по равенству?
Equality & non-discrimination;Law (gender expression);Родовая экспрессия включена в законодательство о запрете дискриминации открыто?;Должно ли быть выражение пола эксплицитно включено в законодательство о запрете дискриминации?;Должен ли пол экспрессия быть явно исключенным из законодательства об антидискриминации?
Equality & non-discrimination;Constitution (sex characteristics);Конституция запрещает дискриминацию по признакам пола?;Должна ли Конституция запрещать дискриминацию по признакам пола?;"Если Конституция не должна запретить дискриминацию по признакам пола?

(Note: I translated ""sex characteristics"" as ""признаками пола"", which is a more literal translation, but it's worth noting that in modern Russian the term ""гендерными признаками"" or simply ""гендером"" might be used to refer to gender identity and expression.)"
Equality & non-discrimination;Employment (sex characteristics);"Включены ли признаки пола в законодательстве о равенстве в труде?

(Prikazanni li priznaki pola v zakonodatel'stve o ravenstve v trude?)";Должны ли признаки пола быть явно включены в законодательство о неравном обращении в трудовом контексте?;Должны ли быть исключены признаки пола в законодательстве о запрете дискриминации в области трудоустройства?
Equality & non-discrimination;Goods & services (sex characteristics);Сексуальные признаки прямо включены в законодательство о запрете дискриминации в отношении товаров и услуг?;Должны ли признаки пола быть явно включены в законодательство о неравенстве в области товаров и услуг?;Должны ли быть исключены признаки пола в законодательстве о запрете дискриминации по отношению к товарам и услугам?
Equality & non-discrimination;Education (sex characteristics);Дискриминация на основании половых признаков в области образования запрещается законодательством?;Должна ли быть законом запрещена дискриминация в зависимости от половых признаков в образовательной сфере?;Должно ли законодательство разрешать дискриминацию на основе половых признаков в области образования?
Equality & non-discrimination;Health (sex characteristics);Дискриминация на основе половых признаков в области здравоохранения запрещена законодательством?;Должны ли быть запрещены законодательством дискриминация по признакам пола в области здравоохранения?;Должна ли быть законодательно разрешена дискриминация по признакам пола в области здравоохранения?
Equality & non-discrimination;Equality body mandate (sex characteristics);Национальные институты по правам человека или органы равенства явно уполномочены решать и систематически работать над вопросами, связанными с половой характеристикой?;Должны ли национальные институты по правам человека или органы равенства получать явное поручение для рассмотрения вопросов, связанных с половой характеристикой?;Должны ли национальные институты по правам человека или органы равенства не иметь мандата на рассмотрение вопросов, связанных с половой характеристикой?
Equality & non-discrimination;Equality action plan (sex characteristics);Существует план действий по равенству, который явно включает в себя сексуальные признаки и конкретные меры прогресса?;Должно быть план действий по равенству, который явно включает в себя идентичность пола и конкретные меры для прогресса?;Должны ли половые признаки исключаться из планов действий по равенству?
Equality & non-discrimination;Blood donations;Продавать кровь или какой-либо вид тканей тела в свободе от законодательного или административного запрета на основании сексуальной ориентации или идентичности пола ЛГБТИ людям?;Должна ли донация крови или каких-либо тканей тела для ЛГБТИ-людей в зависимости от их сексуальной ориентации или гендерной идентичности быть свободной от законодательного или административного запрета?;Должны ли подвергать законодательскому или административному запрету доноры крови или любых других тканей для ЛГБТИ людей в зависимости от их сексуальной ориентации или гендерной идентичности?
Family;Marriage equality;Самцелые пары могут ли жениться с тем же уровнем прав, что и разнополые супружеские пары?;Должны ли однополые пары иметь право на брак с теми же правами, что и разнополые пары?;Должны ли пары с одинаковым полом не иметь возможности вступать в брак на равных правах, как и пары с разным полом?
Family;Registered partnership (similar rights to marriage);Сожаления по типу половой принадлежности могут ли пары образовывать зарегистрированное партнерство/гражданское партнерство и получить те же права, которые они получили бы, если бы они были женаты?;Должны ли та же сексуальные пары иметь право вступать в зарегистрированное партнерство/гражданское партнерство и получать те же права, какие они бы имели, если бы были женаты?;Должны ли не гомосексуальные пары иметь возможность заключать зарегистрированное партнерство/гражданское партнерство и получать те же права, которые они бы получили, если бы они были женаты?
Family;Registered partnership (limited rights);Смогут ли пары с 同полом заключать зарегистрированное партнерство/гражданское партнерство с правами, существенно слабее чем те, которые предлагаются браком?;Должны ли пары того же пола иметь возможность заключать зарегистрированное партнерство/гражданское партнерство с правами, существенно уступающими тем, которые предлагаются браком?;Почему бы самим сексуальным парам не иметь права на заключение зарегистрированного партнерства/гражданского партнерства с меньшими и существенно слабее правами, чем те, которые предлагаются браком?
Family;Cohabitation;Сексуальные пары того же пола включены в законодательство или правовые меры по совместному проживанию?;Должны ли пары одного пола быть включенными в законодательство или правовые меры по совместной жизни?;Подлежат ли одинакovo-pol sexes-pair включать в законодательство или меры правового регулирования совместной жизни?
Family;No constitutional limitation on marriage;Есть ли конституционный определение брака как только союз между мужчиной и женщиной?;Должна ли быть конституционной определением брака как только союз между мужчиной и женщиной?;Должно ли быть конституционным определением брака как только союз между мужчиной и женщиной?
Family;Joint adoption;Могут ли однополые пары легально подавать заявку на совместное усыновление?;Должны ли однополые пары иметь право на легальное приёмство детей в совместное адоптивное устройство?;Право на совместное усыновление для пар с одним полом не должно ли быть ограничено?
Family;Second-parent adoption;Можно ли однополым парам легально подавать заявку на усыновление второй родительницы?;Должны ли гомосексуальные пары иметь возможность подавать заявку на усыновление второго родителя?;Должны ли однополые пары иметь право на приём родительства второго родителя?
Family;Automatic co-parent recognition;Дети рождаются парам, вне зависимости от ориентации партнеров или идентичности гендерной, и должны быть юридически признаны с рождения в отношении обеих членов пары без барьеров?;Должны ли дети, рождаемые парами, независимо от сексуальной ориентации или гендерной идентичности партнеров, быть легально признанными с рождения в отношении обоих членов пары без барьеров?;Должны ли дети, рожденные у пар, иметь юридическое признание с рождения в отношении обоих членов пары в зависимости от ориентации пары или идентичности пола?
Family;Medically assisted insemination (couples);Семейные пары (независимо от сексуальной ориентации партнёров и/или гендерной идентичности) не сталкиваются с юридическими барьерами для получения лечения бесплодия?;Должны ли пары (независимо от сексуальной ориентации и/или идентичности гендеров партнеров) не сталкиваться ни одной юридической барьеры в получении лечения стерility?;Должны ли пары сталкиваться с юридическими барьерами при получении лечения искусственного оплодотворения в зависимости от ориентации партнеров и/или их гендерной идентичности?
Family;Medically assisted insemination (singles);Легальна ли возможность лечения бесплодия для лиц вне зависимости от их сексуальной ориентации и/или идентичности гендера?;Должны ли быть легальными меры лечения бесплодия для лиц, вне зависимости от их сексуальной ориентации и/или идентичности гендерного самовыражения?;Должны ли быть юридически возможными меры по artırению плодовности для индивидуумов в зависимости от их сексуальной ориентации и/или идентичности пола?
