Category;Subcategory;Fact;Support;Opposition
Equality & non-discrimination;Constitution (sexual orientation);a constituição proíbe a discriminação com base na orientação sexual?;a constituição deve proibir a discriminação com base na orientação sexual?;a constituição deve permitir a discriminação com base na orientação sexual?
Equality & non-discrimination;Employment (sexual orientation);a orientação sexual está explicitamente incluída na legislação anti-discriminação em matéria de emprego?;a orientação sexual deve ser explicitamente incluída na legislação anti-discriminação em matéria de emprego?;a orientação sexual deve ser excluída da legislação anti-discriminação em matéria de emprego?
Equality & non-discrimination;Goods & services (sexual orientation);a orientação sexual está explicitamente incluída na legislação anti-discriminação de bens e serviços?;a orientação sexual deve ser explicitamente incluída na legislação anti-discriminação de bens e serviços?;a orientação sexual deve ser excluída da legislação anti-discriminação de bens e serviços?
Equality & non-discrimination;Education (sexual orientation);a discriminação com base na orientação sexual no domínio da educação é proibida pela legislação?;a discriminação com base na orientação sexual no domínio da educação deve ser proibida por lei?;a discriminação com base na orientação sexual no domínio da educação deve ser permitida pela legislação?
Equality & non-discrimination;Health (sexual orientation);a discriminação com base na orientação sexual no domínio da saúde é proibida pela legislação?;a discriminação com base na orientação sexual no domínio da saúde deve ser proibida por lei?;a discriminação com base na orientação sexual no domínio da saúde deve ser permitida pela legislação?
Equality & non-discrimination;Conversion practices ban (sexual orientation);existe legislação ou políticas que proíbam práticas de conversão ou reparadoras destinadas a alterar a orientação sexual de um menor?;as práticas de conversão ou de reparação destinadas a alterar a orientação sexual de um menor devem ser proibidas por legislação ou políticas?;as práticas de conversão ou de reparação destinadas a alterar a orientação sexual de um menor devem ser permitidas pela legislação ou pelas políticas?
Equality & non-discrimination;Equality body mandate (sexual orientation);existe uma instituição nacional de direitos humanos ou um organismo para a igualdade explicitamente mandatado para abordar e trabalhar sistematicamente em questões relacionadas com a orientação sexual?;deve uma instituição nacional de direitos humanos ou um organismo para a igualdade ser explicitamente mandatado para abordar e trabalhar sistematicamente em questões relacionadas com a orientação sexual?;não deveria uma instituição nacional de direitos humanos ou um organismo para a igualdade ser mandatado para tratar de questões relacionadas com a orientação sexual?
Equality & non-discrimination;Equality action plan (sexual orientation);existe um plano de ação para a igualdade que inclua explicitamente a orientação sexual e medidas específicas para o progresso?;deve haver um plano de ação para a igualdade que inclua explicitamente a orientação sexual e medidas específicas para o progresso?;a orientação sexual deve ser excluída dos planos de ação para a igualdade?
Equality & non-discrimination;Constitution (gender identity);a constituição proíbe a discriminação com base na identidade de género?;a constituição deve proibir a discriminação com base na identidade de género?;a constituição deve permitir a discriminação com base na identidade de género?
Equality & non-discrimination;Employment (gender identity);a identidade de género está explicitamente incluída na legislação anti-discriminação em matéria de emprego?;a identidade de género deve ser explicitamente incluída na legislação anti-discriminação em matéria de emprego?;a identidade de género deve ser excluída da legislação anti-discriminação em matéria de emprego?
Equality & non-discrimination;Goods & services (gender identity);a identidade de género está explicitamente incluída na legislação anti-discriminação de bens e serviços?;a identidade de género deve ser explicitamente incluída na legislação anti-discriminação de bens e serviços?;a identidade de género deve ser excluída da legislação anti-discriminação de bens e serviços?
Equality & non-discrimination;Education (gender identity);a discriminação com base na identidade de género no domínio da educação é proibida pela legislação?;a discriminação com base na identidade de género no domínio da educação deve ser proibida por lei?;a discriminação com base na identidade de género no domínio da educação deve ser permitida pela legislação?
Equality & non-discrimination;Health (gender identity);a discriminação com base na identidade de género no domínio da saúde é proibida pela legislação?;a discriminação com base na identidade de género no domínio da saúde deve ser proibida por lei?;a discriminação com base na identidade de género no domínio da saúde deve ser permitida pela legislação?
Equality & non-discrimination;Conversion practices ban (gender identity);existe alguma legislação ou política que proíba práticas de conversão ou reparadoras destinadas a alterar a identidade de género de um menor?;as práticas de conversão ou de reparação destinadas a alterar a identidade de género de um menor devem ser proibidas por legislação ou políticas?;as práticas de conversão ou de reparação destinadas a alterar a identidade de género de um menor devem ser permitidas por legislação ou políticas?
Equality & non-discrimination;Equality body mandate (gender identity);existe uma instituição nacional de direitos humanos ou um organismo para a igualdade explicitamente mandatado para abordar e trabalhar sistematicamente em questões relacionadas com a identidade de género? (penso que só precisa de um);deve uma instituição nacional de direitos humanos ou um organismo para a igualdade ser explicitamente mandatado para tratar de questões relacionadas com a identidade de género?;não deveria uma instituição nacional de direitos humanos ou um organismo para a igualdade ser mandatado para tratar de questões relacionadas com a identidade de género?
Equality & non-discrimination;Equality action plan (gender identity);existe um plano de ação para a igualdade que inclua explicitamente a identidade de género e medidas específicas para o progresso?;deve haver um plano de ação para a igualdade que inclua explicitamente a identidade de género e medidas específicas para o progresso?;a identidade de género deve ser excluída dos planos de ação para a igualdade?
Equality & non-discrimination;Law (gender expression);a expressão do género está explicitamente incluída na legislação anti-discriminação?;a expressão do género deve ser explicitamente incluída na legislação anti-discriminação?;a expressão do género deve ser excluída da legislação anti-discriminação?
Equality & non-discrimination;Constitution (sex characteristics);a constituição proíbe a discriminação com base nas caraterísticas sexuais?;a constituição deve proibir a discriminação com base nas caraterísticas sexuais?;a constituição deve permitir a discriminação com base nas caraterísticas sexuais?
Equality & non-discrimination;Employment (sex characteristics);as caraterísticas sexuais estão explicitamente incluídas na legislação anti-discriminação em matéria de emprego?;as caraterísticas sexuais devem ser explicitamente incluídas na legislação anti-discriminação no emprego?;as caraterísticas sexuais devem ser excluídas da legislação anti-discriminação em matéria de emprego?
Equality & non-discrimination;Goods & services (sex characteristics);as caraterísticas sexuais estão explicitamente incluídas na legislação anti-discriminação de bens e serviços?;as caraterísticas sexuais devem ser explicitamente incluídas na legislação anti-discriminação de bens e serviços?;as caraterísticas sexuais devem ser excluídas da legislação anti-discriminação de bens e serviços?
Equality & non-discrimination;Education (sex characteristics);a discriminação com base nas caraterísticas sexuais no domínio da educação é proibida pela legislação?;a discriminação com base nas caraterísticas sexuais no domínio da educação deve ser proibida por lei?;a discriminação com base nas caraterísticas sexuais no domínio da educação deve ser permitida pela legislação?
Equality & non-discrimination;Health (sex characteristics);a discriminação com base nas caraterísticas sexuais no domínio da saúde é proibida pela legislação?;a discriminação com base nas caraterísticas sexuais no domínio da saúde deve ser proibida por lei?;a discriminação com base nas caraterísticas sexuais no domínio da saúde deve ser permitida pela legislação?
Equality & non-discrimination;Equality body mandate (sex characteristics);existe uma instituição nacional de direitos humanos ou um organismo para a igualdade explicitamente mandatado para abordar e trabalhar sistematicamente em questões relacionadas com as caraterísticas sexuais?;as instituições nacionais de direitos humanos ou os organismos para a igualdade devem ser explicitamente mandatados para tratar de questões relacionadas com as caraterísticas sexuais?;as instituições nacionais de direitos humanos ou os organismos para a igualdade não devem ser mandatados para tratar de questões relacionadas com as caraterísticas sexuais?
Equality & non-discrimination;Equality action plan (sex characteristics);existe um plano de ação para a igualdade que inclua explicitamente as caraterísticas do sexo e medidas específicas para o progresso?;deve haver um plano de ação para a igualdade que inclua explicitamente a identidade de género e medidas específicas para o progresso?;as caraterísticas sexuais devem ser excluídas dos planos de ação para a igualdade?
Equality & non-discrimination;Blood donations;a doação de sangue ou de qualquer tipo de tecidos corporais a pessoas lgbti com base na sua orientação sexual ou identidade de género está isenta de proibição legislativa ou administrativa?;a doação de sangue ou de qualquer tipo de tecidos corporais a pessoas lgbti, com base na sua orientação sexual ou identidade de género, deve estar isenta de proibição legislativa ou administrativa?;a doação de sangue ou de qualquer tipo de tecidos corporais a pessoas lgbti com base na sua orientação sexual ou identidade de género deve ser objeto de uma proibição legislativa ou administrativa?
Family;Marriage equality;os casais do mesmo sexo podem casar-se com o mesmo nível de direitos que os casais de sexo diferente?;os casais do mesmo sexo devem ser autorizados a casar com o mesmo nível de direitos que os casais de sexo diferente?;os casais do mesmo sexo não devem ser autorizados a casar com o mesmo nível de direitos que os casais de sexo diferente?
Family;Registered partnership (similar rights to marriage);os casais do mesmo sexo podem celebrar uma parceria registada/parceria civil e obter o mesmo nível de direitos que obteriam se fossem casados?;devem os casais do mesmo sexo ser autorizados a celebrar uma parceria registada/parceria civil e obter o mesmo nível de direitos que teriam se fossem casados?;não devem os casais do mesmo sexo ser autorizados a celebrar uma parceria registada/parceria civil e obter o mesmo nível de direitos que teriam se fossem casados?
Family;Registered partnership (limited rights);os casais do mesmo sexo podem celebrar uma parceria registada/parceria civil?;os casais do mesmo sexo devem ser autorizados a celebrar uma parceria registada/parceria civil?;os casais do mesmo sexo não devem ser autorizados a celebrar uma parceria registada/parceria civil?
Family;Cohabitation;os casais do mesmo sexo estão incluídos na legislação ou nas medidas jurídicas relativas à coabitação?;os casais do mesmo sexo devem ser incluídos na legislação ou nas medidas jurídicas relativas à coabitação?;os casais do mesmo sexo devem ser excluídos da legislação ou das medidas jurídicas relativas à coabitação?
Family;No constitutional limitation on marriage;não existe uma definição constitucional do casamento como sendo apenas uma união entre um homem e uma mulher?;não deveria haver uma definição constitucional do casamento como sendo apenas uma união entre um homem e uma mulher?;deve haver uma definição constitucional do casamento como sendo apenas uma união entre um homem e uma mulher?
Family;Joint adoption;os casais do mesmo sexo podem candidatar-se legalmente a uma adoção conjunta?;os casais do mesmo sexo devem ser autorizados a candidatar-se legalmente à adoção conjunta?;os casais do mesmo sexo não devem ser autorizados a candidatar-se legalmente à adoção conjunta?
Family;Second-parent adoption;os casais do mesmo sexo podem candidatar-se legalmente a uma adoção por parte de um segundo progenitor?;os casais do mesmo sexo devem ser autorizados a candidatar-se à adoção por segunda pessoa?;os casais do mesmo sexo não devem ser autorizados a candidatar-se à adoção por segunda pessoa?
Family;Automatic co-parent recognition;os filhos nascidos de casais são automaticamente reconhecidos legalmente, desde o nascimento, como filhos de ambos os pais, independentemente da orientação sexual e/ou identidade de género dos parceiros?;os filhos nascidos de casais devem ser automaticamente reconhecidos legalmente, desde o nascimento, como filhos de ambos os pais, independentemente da orientação sexual e/ou identidade de género dos parceiros?;as crianças nascidas de casais não devem ser automaticamente reconhecidas legalmente, desde o nascimento, como filhos de ambos os pais, dependendo da orientação sexual e/ou identidade de género dos parceiros?
Family;Medically assisted insemination (couples);os casais (independentemente da orientação sexual e/ou identidade de género dos parceiros) não enfrentam barreiras legais para aceder a tratamentos de fertilidade?;os casais (independentemente da orientação sexual e/ou identidade de género dos parceiros) não devem enfrentar barreiras legais para aceder a tratamentos de fertilidade?;os casais (independentemente da orientação sexual e/ou identidade de género dos parceiros) devem enfrentar barreiras legais para aceder a tratamentos de fertilidade?
Family;Medically assisted insemination (singles);o tratamento da fertilidade de indivíduos é legalmente possível independentemente da sua orientação sexual e/ou identidade de género?;o tratamento da fertilidade de indivíduos deve ser legalmente possível independentemente da sua orientação sexual e/ou identidade de género?;o tratamento da fertilidade de um indivíduo deve ser legalmente possível com base na sua orientação sexual e/ou identidade de género?
Family;Recognition of trans parenthood;a identidade de género legal de um progenitor trans é plenamente reconhecida e corretamente reflectida na documentação de parentesco da criança, e os regulamentos sobre a parentalidade estão alinhados com todas as opções de género disponíveis (quando existem mais de dois marcadores de género) de acordo com a identidade de género reconhecida do progenitor?;a identidade de género legal de um progenitor trans deve ser plenamente reconhecida e reflectida na documentação de parentesco da criança, e os regulamentos sobre a parentalidade devem estar alinhados com todas as opções de género disponíveis (quando existem mais de dois marcadores de género) de acordo com a identidade de género reconhecida do progenitor?;os pais trans devem ter a sua identidade de género legal não reconhecida e corretamente reflectida na documentação de parentesco de acordo com a identidade de género reconhecida do progenitor?
Hate crime & hate speech;Hate crime law (sexual orientation);a orientação sexual está explicitamente incluída na legislação sobre crimes de ódio como fator agravante?;a orientação sexual deve ser explicitamente incluída na legislação sobre crimes de ódio como um fator agravante?;a orientação sexual deve ser excluída da legislação sobre crimes de ódio como fator agravante?
Hate crime & hate speech;Hate speech law (sexual orientation);a orientação sexual está explicitamente incluída na legislação relativa ao discurso de ódio como fator agravante?;a orientação sexual deve ser explicitamente incluída na legislação sobre discurso de ódio como fator agravante?;a orientação sexual deve ser excluída da legislação relativa ao discurso de ódio como fator agravante?
Hate crime & hate speech;Policy tackling hatred (sexual orientation);a orientação sexual está explicitamente incluída numa estratégia nacional de combate aos crimes de ódio e ao discurso de ódio, como parte de um quadro recorrente dos actores estatais?;a orientação sexual deve ser explicitamente incluída numa estratégia nacional de combate aos crimes de ódio e ao discurso de ódio, como parte de um quadro recorrente dos actores estatais?;a orientação sexual deve ser excluída de uma estratégia nacional de combate aos crimes e discursos de ódio?
Hate crime & hate speech;Hate crime law (gender identity);a identidade de género está explicitamente incluída na legislação sobre crimes de ódio como fator agravante?;a identidade de género deve ser explicitamente incluída na legislação sobre crimes de ódio como fator agravante?;a identidade de género deve ser excluída da legislação sobre crimes de ódio como fator agravante?
Hate crime & hate speech;Hate speech law (gender identity);a identidade de género está explicitamente incluída na legislação relativa ao discurso de ódio como fator agravante?;a identidade de género deve ser explicitamente incluída na legislação sobre discurso de ódio como fator agravante?;a identidade de género deve ser excluída da legislação relativa ao discurso de ódio como fator agravante?
Hate crime & hate speech;Policy tackling hatred (gender identity);a identidade de género está incluída numa estratégia nacional de combate aos crimes de ódio e ao discurso de ódio, como parte de um conjunto de medidas contínuas, sistemáticas e oficialmente organizadas pelo Estado?;a identidade de género deve ser explicitamente incluída numa estratégia nacional de combate aos crimes de ódio e ao discurso de ódio, como parte de um quadro recorrente dos actores estatais?;a identidade de género deve ser excluída de uma estratégia nacional de combate aos crimes de ódio e ao discurso de ódio?
Hate crime & hate speech;Hate crime law (intersex);as caraterísticas sexuais (percebidas) ou o estatuto intersexual estão explicitamente incluídos na legislação sobre crimes de ódio como fator agravante?;as caraterísticas sexuais (percebidas) ou o estatuto intersexual devem ser explicitamente incluídos na legislação sobre crimes de ódio como fator agravante?;as caraterísticas sexuais (percebidas) ou o estatuto de intersexo devem ser excluídos da legislação relativa aos crimes de ódio como fator agravante?
Hate crime & hate speech;Hate speech law (sex characteristics);as caraterísticas sexuais ou o estatuto intersexual estão explicitamente incluídos na legislação relativa ao discurso de ódio como fator agravante?;as caraterísticas sexuais ou o estatuto intersexual devem ser explicitamente incluídos na legislação relativa ao discurso de ódio como fator agravante?;as caraterísticas sexuais ou o estatuto intersexual devem ser excluídos da legislação relativa ao discurso de ódio como fator agravante?
Hate crime & hate speech;Policies tackling hatred (intersex);as caraterísticas sexuais ou o estatuto de intersexo estão incluídos numa estratégia nacional de combate aos crimes de ódio e ao discurso de ódio, como parte de um conjunto de medidas contínuas, sistemáticas e oficialmente organizadas pelo Estado?;as caraterísticas sexuais ou o estatuto de intersexo devem ser incluídos numa estratégia nacional de combate aos crimes de ódio e ao discurso de ódio, como parte de um quadro recorrente dos actores estatais?;as caraterísticas sexuais ou o estatuto de intersexo devem ser excluídos de uma estratégia nacional de combate aos crimes de ódio e ao discurso de ódio, como parte de um quadro recorrente dos actores estatais?
Legal gender recognition;No legal framework making legal gender recognition impossible;não existe nenhuma proibição explícita ou limitação legal que torne o reconhecimento legal do género totalmente impossível (mesmo que os procedimentos sejam onerosos, difíceis ou que não exista uma via definida)?;não deve haver uma proibição explícita ou uma limitação legal que torne o reconhecimento legal do género totalmente impossível (mesmo que os procedimentos sejam onerosos, difíceis ou que não exista uma via definida)?;deve haver uma proibição ou limitação legal que impossibilite o reconhecimento legal do género?
Legal gender recognition;Existence of legal measures;existem medidas legais em vigor para o reconhecimento legal do género?;devem ser adoptadas medidas legais para o reconhecimento legal do género?;não deveriam existir medidas legais para o reconhecimento legal do género?
Legal gender recognition;Existence of administrative procedures;existem procedimentos administrativos para o reconhecimento legal do género?;devem existir procedimentos administrativos para o reconhecimento legal do género?;não deveria haver procedimentos administrativos para o reconhecimento legal do género?
Legal gender recognition;Name change;a legislação permite uma mudança de nome sem restrições?;a legislação deve permitir uma mudança de nome sem restrições?;a legislação deve recusar uma mudança de nome ou autorizá-la com restrições?
Legal gender recognition;No age restriction (Name change);não existe uma restrição de idade explícita para que os menores possam alterar o seu nome?;não deve haver uma restrição explícita de idade para que os menores possam alterar o seu nome?;deve haver uma restrição de idade para os menores alterarem o seu nome?
Legal gender recognition;Self-determination;o reconhecimento legal do género baseia-se exclusivamente na vontade expressa da pessoa em causa, sem exigir a intervenção de terceiros e sem considerar o estatuto intersexual ou as caraterísticas sexuais como uma contraindicação?;o reconhecimento legal do género deve basear-se exclusivamente na vontade expressa da pessoa em causa, sem exigir a intervenção de terceiros e sem considerar o estatuto intersexual ou as caraterísticas sexuais como uma contraindicação?;o reconhecimento legal do género não deve basear-se exclusivamente na vontade expressa da pessoa em causa, mas requerer a participação de terceiros, e o estatuto intersexual ou as caraterísticas sexuais constituem uma contraindicação?
Legal gender recognition;Non-binary recognition;o reconhecimento do género não binário está disponível através de um registo público que ofereça mais de dois marcadores de género, disponível apenas a pedido, com um procedimento coerente e sem discriminação, ou através da não obrigatoriedade de registo de um marcador de género para todos no registo público?;o reconhecimento do género não binário deve ser disponibilizado através de um registo público que ofereça mais de dois marcadores de género e só esteja disponível mediante pedido, com um procedimento coerente e sem discriminação, ou através da não obrigatoriedade de registo de um marcador de género para todos no registo público?;o reconhecimento do género não binário não deve estar disponível quer através de um registo público que ofereça mais de duas opções de marcadores de género, quer através da ausência de registo obrigatório de marcadores de género no registo público?
Legal gender recognition;No 'Gender Identity Disorder' diagnosis/psychological opinion required;não é necessário um diagnóstico/parecer psicológico de perturbação de identidade de género para o reconhecimento legal do género?;não deve ser exigido um diagnóstico/parecer psicológico de perturbação de identidade de género para o reconhecimento legal do género?;deve ser exigido um diagnóstico/parecer psicológico de perturbação de identidade de género para o reconhecimento legal do género?
Legal gender recognition;No compulsory medical intervention required;não são necessárias intervenções médicas não cirúrgicas para o reconhecimento legal do género?;não devem ser exigidas intervenções médicas não cirúrgicas para o reconhecimento legal do género?;devem ser exigidas intervenções médicas não cirúrgicas para o reconhecimento legal do género?
Legal gender recognition;No compulsory surgical intervention required;não são necessárias intervenções médicas cirúrgicas para o reconhecimento legal do género?;não devem ser exigidas intervenções médicas cirúrgicas para o reconhecimento legal do género?;devem ser exigidas intervenções médicas cirúrgicas para o reconhecimento legal do género?
