Category;Subcategory;Fact;Support;Opposition
Equality & non-discrimination;Constitution (sexual orientation);Da li Ustav zabranjuje diskriminaciju na osnovu spolnog usmjerenja?;Da li Ustav treba da zabranjuje diskriminaciju na osnovu seksualne orijentacije?;Da li Konstitucija ne bi trebalo da zabranjuje diskriminaciju na osnovu seksualne orientacije?
Equality & non-discrimination;Employment (sexual orientation);Je li spoljna seksualna orijentacija implicitno uključena u zakon o zaštiti radnika od diskriminacije u radnom mjestu?;Da li bi trebalo da se seksualna orijentacija explicitno uključuje u zakone o anti-diskriminaciji u radnom prostoru?;Ће ли сексуална оријентација бити изузета из законодавства о антидискриминацији у раду?
Equality & non-discrimination;Goods & services (sexual orientation);Je li spoljnja orijentacija seksualnog karaktera explicitno uključena u zakone o zabrani diskriminacije u pogodbi o robe i uslugama?;Da li bi trebalo da seksualna orijentacija explicitno uključena u zakone o diskriminaciji u pogodbi robe i usluga?;Da li bi trebalo da se izvršavanje seksualne usmerenosti uključuje u zakone protiv diskriminacije kod robe i uslug?
Equality & non-discrimination;Education (sexual orientation);Дискриминација на основу сексуалне оријентације у области образовања је ли забрањена законодавством?;Da li bi trebalo da zakonom se zabranjava diskriminacija osnovan na seksualnom usmjerenju u obrazovanju?;Da li treba da se omogući diskriminacija na osnovu seksualne orijentacije u oblasti obrazovanja zakonom?
Equality & non-discrimination;Health (sexual orientation);Је ли дискриминација на основу сексуалног утицаја у области здравља забрањена законом?;Da li bi trebalo da diskriminacija na osnovu seksualne orientacije biti zabranjena zakonom u zdravstvenoj oblasti?;Da li bi trebalo dopustiti diskriminaciju na osnovu seksualne orijentacije u oblasti zdravlja zakonom?
Equality & non-discrimination;Conversion practices ban (sexual orientation);Postoji li zakonski propisi ili politike koje zabranjuju konvertiranje ili praksu reparatorne namene da se menjaju seksualna orijentacija dečaka/maloga?;Da li bi trebalo da se zabranjavaju zakonski propisi ili politike koje omogućavaju konverziju ili praksu vraćanja fizičkog stanja, kojim se pokušava promeniti seksualno orijentisanje maloljetnika?;Da li je zakonodavstvo ili politike trebalo dopustiti konverziju ili popravne praktike namenjene promenu seksualnog usmjerenja maloletnika?
Equality & non-discrimination;Equality body mandate (sexual orientation);Суверане националне институције за људска права или тела за једнакост експлицитно лига да се обрачунају и систематски раде на питањима везаним за сексуалну оријентацију?;Da li institucije za nacionalna ljudska prava ili tijela za ravnopravnost trebaju da imaju izričitu obavezu da se bave i sistematski radite na pitanjima vezanim za spolnu orijentaciju?;Da li institucije za nacionalna ljudska prava ili tijela za ravnopravnost ne bi trebale imati ovlašćenja da se bave pitanjima vezanim uz orijentaciju u seksualnom smislu?
Equality & non-discrimination;Equality action plan (sexual orientation);Postoji li plan akcije jednakosti koji explicitno uključuje orijentaciju na seksualni odnos i specifične mere za napredak?;Da li treba da postoje plan akcije u vezi jednakosti koji implicitno obuhvata seksualnu orijentaciju i specifične mere za napredak?;Da li bi trebalo da se seksualna orijentacija izuzme iz planova za dejstvo ravnopravnosti?
Equality & non-discrimination;Constitution (gender identity);Da li Ustav zabranjuje diskriminaciju na osnovu rodnog identiteta?;Da li Konstitucija treba da zabranjuje diskriminaciju na osnovu rodnog identiteta?;Da li ustava mora da zabranjuje diskriminaciju na osnovu rodnog identiteta?
Equality & non-discrimination;Employment (gender identity);Je li rodna identitet eksplicitno uključena u zakon o zabrani diskriminacije na radnom mestu?;Da li bi trebalo da rodnost identitet bude explicitno uključena u zakone o protuzakonskoj diskriminaciji u radnom prostoru?;Da li bi trebalo da se rodni identitet izuzme iz zakonske regulative protiv diskriminacije u radnom prostoru?
Equality & non-discrimination;Goods & services (gender identity);Ће ли је полна идентитет експлицитно уключен у закон о забрани дискриминације по производима и услугама?;Da li bi trebalo da se spolna identitet explicitno uključi u zakone o zabrani diskriminacije kod proizvoda i usluga?;Da li bi trebalo da rodnost identiteta bude izuzeto iz zakonske regulative protiv diskriminacije u vezi sa robom i uslugama?
Equality & non-discrimination;Education (gender identity);Je li diskriminacija na osnovu rodnog identiteta u oblasti obrazovanja zakonom zabranjena?;Biće li diskriminacija na osnovu spolne identiteta u oblasti obrazovanja zabranjena zakonom?;Da li bi trebalo da se izglasava diskriminacija na osnovu rodne identiteta u oblasti obrazovanja zakonom?
Equality & non-discrimination;Health (gender identity);Дискриминација на основу полне идентитета у области здравља забрањена је законодавством?;Da li bi trebalo da zakonom bude zabranjeno diskriminiranje na osnovu spolnog identiteta u zdravstvenom kontekstu?;Da li bi trebalo da se po zakonom dopušta diskriminacija na osnovu rodne identiteta u zdravstvenom polju?
Equality & non-discrimination;Conversion practices ban (gender identity);Postoji li zakonske regulative i politike koje zabranjuju konverziju ili reparatorne prakse namenjene promeni decevoj rođenoj identiteta?;Da li treba da se zabranjavaju zakonske i politike koje dopušćaju promenu ili reparatorne prakse namenjene promeni identiteta roda dece?;Da li treba da postoje zakonske propuste i politike koje omogućavaju konverziju ili reparativne prakse namenjene promenu spolnog identiteta malog deteta?
Equality & non-discrimination;Equality body mandate (gender identity);Суђе националне институтије за људска права или тела за равноправност експлицитно су наређене да се баве питањима везаним за идентитет пола и систематски раде на том пољу?;Da li nacionalne institucije za ljudska prava ili tijela za ravnopravnost trebaju biti explicitno ovlašćene da se bavi pitanjima vezanim uz rodnu identitet?;Da li institucije za nacionalna ljudska prava ili tijela za ravnopravnost ne bi trebale imati ovlašćenje da se bave pitanjima vezanim uz rodnu identitet?
Equality & non-discrimination;Equality action plan (gender identity);Postoji li plan akcije za ravnopravnost koji explicitno uključuje identitet rodne osobe i specifične mere za napredak?;Da li treba da postoje plan akcije za ravnopravnost koji explicitno uključuje identitet pola i specifične mjere za napredak?;Da li bi trebalo da se izbegava identitet spolne orijentacije u planovima za akciju jednakosti?
Equality & non-discrimination;Law (gender expression);Ће ли се изражај пола експлицитно уврставља у законодавство о антидискриминацији?;Da li treba da se izražavanje roda eksplicitno uključi u zakon o zabrani diskriminacije?;Da li treba da se izrično isključi spolna izražajnost u zakonodaji protiv diskriminacije?
Equality & non-discrimination;Constitution (sex characteristics);Да ли Устав забрањује дискриминацију на основу полних карактеристика?;Da li ustava treba da zabranjuje diskriminaciju na osnovu spolnih karaktera?;Da li Ustav ne smije zabranjavati diskriminaciju na osnovu spolnih karakteristika?
Equality & non-discrimination;Employment (sex characteristics);Suđavaju li spolne карактеристике у законодавству о заштити од дискриминације у раду?;Da li bi trebalo da spolne osobine explicitno bile uključene u zakon o protivdiscriminaciji u radnom zadrugu?;Da li bi trebalo izbrisati polne karakteristike u zakonskoj regulativi o nediskriminaciji u radu?
Equality & non-discrimination;Goods & services (sex characteristics);Сексуалне карактеристике експлицитно укључене су у законодавству о антидискриминацији поља робе и услуга?;Da li bi trebalo da spolne karakteristike budu implicitno uključene u zakone o izbjegavanju diskriminacije u vezi s robom i uslugama?;Da li bi trebalo da se izravni spolni karakteristici isključile iz zakonodavstva o zabrani diskriminacije u pogodbi i uslugama?
Equality & non-discrimination;Education (sex characteristics);Дискриминација на основу полних карактеристика у области образовања је ли забрањена законодавством?;Da li bi trebalo da se diskriminacija bazirana na spolnim karakteristikama u oblasti obrazovanja zabranjuje zakonom?;Da li bi trebalo dopustiti diskriminaciju na osnovu polnih karaktera u području obrazovanja zakonom?
Equality & non-discrimination;Health (sex characteristics);Дискриминација на основу полних карактеристика у области здравља забрањена је законодавством?;Da li treba da bude zakonom regulisano rasipanje na osnovu spolnih karaktera u oblasti zdravlja?;Da li bi trebalo da se dozvoli diskriminacija na osnovu spolnih karakteristika u zdravstvenoj oblasti po zakonu?
Equality & non-discrimination;Equality body mandate (sex characteristics);Суверне институције за људска права или тела равенства експлицитно ли су дата задаци да се баве и систематски раде на питањима везаним за полне карактеристике?;Da li nacionalne institucije za čovekeva prava ili tela za jednakost treba explicitno ovlašćivanje da se bave pitanjima vezanim za spolne karakteristike?;Da li institucije za nacionalna ljudska prava ili tela za ravnopravnost ne bi trebalo biti obvezne da se bave pitanjima vezanim uz spolne karakteristike?
Equality & non-discrimination;Equality action plan (sex characteristics);Postoji li plan akcije za jednakost koji explicitno uključuje spolne karakteristike i specifična mjera za napredak?;Da li bi trebalo da postoji plan akcije za jednakost koji explicitno uključuje identitet pola i posebne mere za napredak?;Da li bi trebalo da spolne karakteristike bude izuzete u planovima za dejstvo jednakosti?
Equality & non-discrimination;Blood donations;Да ли даривање крви или било којег других телесних ткива за ЛГБТИ особе на основу њихове сексуалне оријентације или родног идентитета слободно је од законодавне или административне забране?;Da li bi trebalo da davaju krv ili neki vrsta tijela tkiva LGBTI ljudima zasnivanjem njihove seksualne orijentacije ili spolne identiteta slobodno od zakonske ili upravne zabrane?;Da li bi trebalo da se doniranje krvi ili nekih tkiva tela zakonom ili administrativnim zabranama podvrgne istraživanju zasnovanom na spolnoj orijentaciji ili rodnoj identitetu LGBTI osoba?
Family;Marriage equality;Može li istopolne parove da se udaju s istim stepenom prava kao heteroseksualni brakovi?;Da li treba da se istopolni parovi mogu venčati s istim nivoom prava kao i brakovanu različitog pola?;Da li isti spolne pare ne bi trebale da mogu udruživanje u braku sa istim stupnjem prava kao bračni različite spolne pare?
Family;Registered partnership (similar rights to marriage);Može li istopolne паре да уђу у регистровану партнерство/граждански партнерство и стекnu истi ниво права као би биле ожењене?;Da li isti spolne pare trebaju moći da ulaze u registrovani partnerstvo/građansko partnerstvo i dobiti iste prava kao ako bi bili venčani?;Da li ne sme da istopolne parove nisu mogli ulaziti u registrovan odnos i stječati isti nivo prava kao ako su se udavali?
Family;Registered partnership (limited rights);Suđaju li istopolne parove da uđu у званични паропостојење/гражданско партнерство са другим и значајно слабијим правима него она која је нуди брак?;Da li isti spolovi parovi trebaju imati mogućnost ulaska u registrovan bratstvo/građansko partnerstvo sa različitim i znatno slabijim pravima nego ona koja je ponuđena braku?;Da li isti spolne pare ne bi trebale imati mogućnost ući u registrovan pristup/ivični partnerski odnos s različitim i znatno slabijim pravima nego one koje nudi brak?
Family;Cohabitation;Суђени су сејн-секс парови укључени у законодавство или правне мере на кохабитацији?;Da li treba uključiti istopolne parove u zakonske norme o kohabitaciji?;Da li istospolne pareja treba izključiti iz zakonskih regulativa ili mere o stalnoj zajednici?
Family;No constitutional limitation on marriage;Postoji li konstitutivna definicija braka kao što je samo unija muškarca i žene?;Da li treba da postoji ustavno definicija braka kao jedinstvo samo između muškarca i žene?;Da li treba da postoji ustavna definicija braka kao jedinstvo isključivo između muškarca i žene?
Family;Joint adoption;Мојим се истopolним пару може легално пријавити за zajedničku усвојеност?;Da li isti spolovi parovi treba da mogu zakonomno tražiti zajedničko ustanakivanje?;Da li isti spolovi ne bi trebali mogli zakonom da se prijavljivaju za zajedničko usvajanje?
Family;Second-parent adoption;"Moći li istopolni parovi zakonom da se prijavljaju za drugo roditeljsko adoptivno?

(Note: I translated ""same-sex"" as ""istopolni"", which is a common term in Serbian to refer to same-sex couples or individuals. If you want me to use the term ""gej"" instead, please let me know.)";Da li bi trebalo da isti spolne pare mogle da se kandiduju za adoptivno roditeljstvo drugog roditelja?;Da li ne smiju istopolni parovi da se prijavljaju za drugo roditeljstvo?
Family;Automatic co-parent recognition;Деца се рођују брачним паровима, без обзира на партнерова сексуалну оријентацију или родни идентитет, да би били легално признати од рођења у вези са обома члановима пара без преграда?;Деца рођена у паровима, без обзира на сексуално или родну оријентацију партнера, да би била легално призната од рождения у вези са обома члановима пара без баријера?;Da li djeca rođena muževima i ženama koji ne su u istom spolnom odnosu, treba da im se priznaje zakonski status od rođenja u pogodbi oba člana tog para bazirano na njihovoj seksualnoj orijentaciji ili rodnoj identiteti?
Family;Medically assisted insemination (couples);Razni paražno parove (neovisno o seksualnoj usmjerenosti i/ili identitetu roda partnera) ne čine lići nikakve zakonske prepreke za dobijanje asistencije u kontracepciji?;Da li parovi ( bez obzira na seksualnu orientaciju i/gender identitet partnera) ne bi trebali da imaju nikakve zakonske prepreke za dobijanje assisted reproductive treatments?;Da li parovi često liječničke barijere za dobiti trajanje tretman na osnovu seksualne usmjerenosti i/ili rodnog identiteta partnera?
Family;Medically assisted insemination (singles);Je li lično oplemenjivanje za pojedinace bez obzira na njihovu seksualnu usmjereność i/ili rodni identitet zakonom moguće?;Da li bi trebalo da je legalno moguće liječko traktovanje parenja osobe bez obzira na njenu seksualnu orijentaciju i/ili spolnu identitet?;Da li bi trebalo da je pristupna reproduktivnoj medicini osoba na osnovu njihove seksualne orientacije i/ili spolne identiteta zakonski moguća?
Family;Recognition of trans parenthood;Je li roditeljski transgenderov izvršavani pravni rod identitet prezentovan i korektno otkriven u dokumentaciji rodbinske povezanosti prema priznatom rodu roditelja?;Šta da roditelji koji su trans imaju pravo da njihovo zakonsko rodno identitet prezentiraju i reflektuju istinito u dokumentaciji o poreklo prema njihovom priznatome rodnom identitetu?;Da li roditelji koji su transmorfolizovani trebaju da im se ne priznaje istinska spolna identitet i da se njihova spolna identitet reflektuje u dokumentaciji o rodstvu prema njihovoj priznatoj spolnoj identiteti?
Hate crime & hate speech;Hate crime law (sexual orientation);Је ли сексуално усмерење експлицитно уложено као појачање фактора у законодавству о злочинима на основу врлина као такво?;Da li bi trebalo da seksualna orijentacija bude explicitno uključena kao štetan faktor u zakonodavstvu o mržnji i krivičnim djelima?;Da li bi trebalo da seksualna orijentacija bude izuzeta iz zakonske regulative o mržnjackim zločinima kao posiljka?
Hate crime & hate speech;Hate speech law (sexual orientation);Je li seksualna usmjerenost explicitno uključena u zakone o mržnjoj retorici kao faktor koji pogubljava?;Da li bi trebalo da se seksualna orijentacija explicitno uključuje u zakone o mržnjoj govorni kao pospeška faktor?;Da li bi trebalo da orijentacija spolnog uravnoteženja biti izuzetak iz zakonodavstva o mrznjenoj retorici kao dopunska količina?
Hate crime & hate speech;Policy tackling hatred (sexual orientation);Je li izrično uključeno orijentacija na seksualni život u nacionalnoj strategiji koja se bavi mrzićima i mrzićima govora, kao dio ponavljajućeg okvira koji su sprovodili državne aktere?;Da li bi trebalo da se spoljašnja orijentacija explicitno uključuje u nacionalni plan za borbu protiv mržnje i mržljive govorne, kao dio recurentnog okvira koji obuhvaća delovanje državnih aktora?;Da li bi trebalo izbrisati seksualnu orijentaciju iz nacionalne strategije koja se bavi mržnjom i mržnjenjem govora?
Hate crime & hate speech;Hate crime law (gender identity);Je li rodnost izražena u zakonu o mržnjoj krivičnosti kao znak za povećavanje kazne?;Da li bi trebalo da rodnost identitet biti explicitno uključena u zakon o mržnjackom krivljenju kao dopunska okolnost?;Da li bi trebalo da rodni identitet izuzme se iz zakonske regulative o mržnjačkim zločinima kao dopunski faktor?
Hate crime & hate speech;Hate speech law (gender identity);Ће ли родни идентитет експлицитно ујамљен у законодатству о мржњивом говору као допунски фактор?;Da li treba da se spolna identitet explicitno uključi u zakon o mržnjoj retorici kao dopunsko faktor?;Da li bi trebalo da rođenopska identitet biti izostavljen iz zakonske regulative o mržnjoj govornici kao dopunskog faktora?
Hate crime & hate speech;Policy tackling hatred (gender identity);Je li identitet rodnosti explicitno uključena u nacionalnu strategiju koja se bavi mržnjom i mrzljivim govorom, kao dio ponovnog okvira koji koriste državni aktivori?;Da li bi trebalo da se rođenopoložajno identitetnost izravno uključi u nacionalni plan koji se bavi mržnjom i mržninom govornom, kao deo redovitog okvira koji koriste državne aktivnosti?;Da li bi trebalo izbrisati rodnu identitu iz nacionalne strategije borbe protiv mržnje i mržnog govora?
Hate crime & hate speech;Hate crime law (intersex);Da li su (poimanje) spolne karakteristike ili-status međupolački u zakonodavstvu o mržnjoj kriminalnosti kao pojačao faktor upisan u samom zakonu?;Da li bi trebalo da se u zakonu o nasiljima izazvanim mržnjom explicitno navesti spolne karakteristike ili status međuseksualnosti kao poslovica za pogoršanje kazne?;Da li bi se (pojacano) spolne karakteristike ili stanje interseksa trebalo izuciti kao posredovan faktor u zakonskoj regulaciji mržnje?
Hate crime & hate speech;Hate speech law (sex characteristics);Сексуе карактеристике или интерсекс статус експлицитно укључени у законодавство о мржњивом језику као повећајући фактор?;Da li bi trebalo da spolne osobine ili status međuseksualnosti biti izrazito uključeni u zakonsku regulativu o mržnjoj retorici kao dopunska okolnost?;Da li bi trebalo da se spolne karakteristike ili polne identifikacije međuseksualnosti izuzmu iz zakonodavstva o mrzovoljnom govoru kao faktor koji povećava kaznu?
Hate crime & hate speech;Policies tackling hatred (intersex);Сексуални карактеристике или интерсекс статус унајмљени су у националној стратегији која се бори против јaza и јаза речи као део рекурентног оквира који функционише код државних актера?;Da li bi se moralo u nacionalnom strategiji borbe protiv mrzljivih kriminala i mrzljive riječi uključiti spolne karakteristike ili status međupola, kao dio recurennog okvira koji koriste državni djelatnici?;Da li bi morale seksualne karakteristike ili status međuseksualnosti izuzeti iz nacionalnog strategije borbe protiv mržnje i mržnine, kao deo stalnog okvira koji koriste državni aktori?
Legal gender recognition;No legal framework making legal gender recognition impossible;Postoji li neki zakonski ili ograničavanje što sprečava pristup priznavanju legalnog pola?;Da li treba da ne postoji ništa što bi sprečavalo pristup zakonskoj potvrđivanju spolnog identiteta?;Da li bi trebalo da postoje zabrana ili zakonska ograničenja koja sprečavaju pristup priznavanju legale polne identitete?
Legal gender recognition;Existence of legal measures;Postoje li zakonski merovi u-placeholder za priznavanje spolnog izraza?;Da li treba da postoje zakonski merovi za priznavanje spolnog identiteta?;Da li treba da postoji pravne mere za priznavanje zakonitog pola?
Legal gender recognition;Existence of administrative procedures;Postoje li procedure upravnog karaktera za priznavanje pravog pola?;Da li treba da postoje procedure za priznavanje zakonske spolnosti?;Da li treba da postoje upravne procedure za priznavanje zakonske spola?
Legal gender recognition;Name change;Postoji li zakonska regulativa koja omogućava promenu imena?;Da li treba da postoji zakonska regulativa koja omogućava promenu imena?;Da li bi trebalo da ne postoji zakonska regulativa koja omogućava promenu imena?
Legal gender recognition;No age restriction (Name change);Ne postoji nikakva eksplicitna ograničenja po dosze za maloletne da promene ime?;Da li treba da postoje izrične granice po članima za male bez imenovanja promjene imena?;Da li treba da postoji ograničenje po starosti za decu koji žele promeniti ime?
Legal gender recognition;Self-determination;Je li priznanje spolne identitete isključivo zasnovano na izraženoj želji osobe koja se tome suprotstavlja, bez zahtjeva sudjelovanja trećih osoba, i bez da se smatra protivindikativnim statusom interseksualnosti ili spolnim karakteristikama?;Da li treba da se priznanje spolnog pola osnovati isključivo na izraženoj želji osobe koja se tiče, bez zahtjevanja učešća trećih strana, i bez štova protivljenja statusu međupola ili spolnim osobinama?;Da li priznavanje zakonske spolne odluke ne treba da se osniva isključivo na izraženo želja osobe koja se tome odnosi, već da zahtjeva učešće treće strane, a interseksno stanje ili spolne osobine su protivindikacija?
Legal gender recognition;Non-binary recognition;Je li priznanje binarnog roda dostupno putem javne registra koji nudi više markera roda, dostupno samo na zahtjev s konstantnom procedurom i bez diskriminacije, ili putem nemoralnog snimanja markera roda svima u javnoj registru?;Treba li da se priznaje nebinarna spolna raba putem javne registra koji nudi više od dva znaka pola, i to na zahtjevanjem s konstantnim postupkom bez diskriminacije, ili putem nemoralnog snimanja znaka pola svima u javnoj registraru?;Da li bi trebalo da nebinarni rod nije dostupan, a svi individuali moraju zapisati binarni rodni oznak u javnom registru?
Legal gender recognition;No 'Gender Identity Disorder' diagnosis/psychological opinion required;Je li dijagnoza poređenja rodnog identiteta ili psihooglasno mišljenje potrebno za priznanje zakonskog spola?;Da li treba da se dijagnostika poređenjačkog identiteta ili psihološka mišljenja za priznavanje spolnog identiteta po zakonu?;Da li treba da se dijagnoza poređenja rodnosti ili psihološka mišljenja za priznanje spolne identiteta u zakonskom smislu?
