Category;Subcategory;Fact;Support;Opposition
Equality & non-discrimination;Constitution (sexual orientation);Дали Уставот забранува дискриминација врз основа на сексуалнатаориентација?;Дали Уставот да забранува дискриминација врз основа на сексуалната ориентација?;Ако Уставот не треба да забранува дискриминација врз основа на сексуалната ориентација?
Equality & non-discrimination;Employment (sexual orientation);Ајде сексуалната ориентација експлицитно е вклучена во законодавството за антидискриминација на работното место?;Да ли сексуалната неутврдност треба да биде експлицитно вклучена во законодавството за борба против дискриминацијата на работното место?;Дали сексуалната ориентација треба да се изостави во законодавството за антидискриминација на работните места?
Equality & non-discrimination;Goods & services (sexual orientation);Еси сексуалната ориентација јасно е вклучена во законодавството за антисемитска дискриминација на производи и услуги?;Дали сексуалната ориентација треба да биде експлицитно вклучена во законодавството за антидискриминација на добарта и услугите?;Дали сексуалната ориентација да биде изключена од законот за антидискриминација во погодо и услуги?
Equality & non-discrimination;Education (sexual orientation);Дискриминацијата на основа на сексуалната ориентација во полето на образованието е забранета според законот?;Дали треба да се забранува дискриминацијата поради хомосексуалното опредељување во областа на образованието со законодавство?;Дали било дозволено дискриминација на основа на сексуалната ориентација во рамките на образованието согласно законот?
Equality & non-discrimination;Health (sexual orientation);Дискриминацијата базирана на сексуалната ориентација во сферата на здравството е забранета ли според законодавството?;Дали треба да се забранува дискриминацијата на основа на хомосексуалната зафатеност во областите на здравството со законодавство?;Дали да се дозволи дискриминација на основа на сексуалната ориентација во областа на здравството според законодавството?
Equality & non-discrimination;Conversion practices ban (sexual orientation);Се постојат законодавство или политики кои забрануваат конверзија или репаративни пракси со цел да се промени полно определена на младине?;Дали законодавството или политиките што дозволуваат преобразба или практики на ремонт наменети за промена на сексуалната оријентација на малишник да биде забрането?;Дали законодавството или политиките би позвеле промена или репаративни практики со цел да се промени ориентацијата на младиот по половата својствено?
Equality & non-discrimination;Equality body mandate (sexual orientation);Сојузните институции за човекови права или тела за равенство експлицитно се овластуваат да ги обраќаат и систематски работат на прашањата поврзани со хомосексуалното истражување?;Соѓќните институти за човекови права или тела за еднакво достапност треба да биде експлицитно задолжени да се обраќаат и систематски работат на питањата поврзани со половите ориентации?;Дали националните институции за човeki права или тела за еднаква равенство не треба да се обврзуваат со адресување на прашањата поврзани со хомосексуалното определи?
Equality & non-discrimination;Equality action plan (sexual orientation);Има ли план за еднаква акција која експлицитно вклучува хомосексуална оријентација и конкретни мерки за напредок?;Ако постои план за еднаква трактирње што експлицитно вклучува сексуална оријентација и конкретни мерки за напредок?;Дали сексуалната орјентација да се извлезе од плановите за еднаква дејност?
Equality & non-discrimination;Constitution (gender identity);Дојде Конституцијата забранува дискриминација според идентитетот на полната група?;Ако Уставот да забранува дискриминација врз основа на идентитетот на полот?;Дали Уставот не треба да забранува дискриминација врз основа на родна идентитет?
Equality & non-discrimination;Employment (gender identity);Едените на полотени идентитет не се експlicitно вклучуваат во законодателството против дискриминација при вработувањето.;Дали идентитетот на полот поместен да биде отворено споменат во законодавството за анти-дискриминација на работа?;Дали да се исклучи полната идентитет во законодавството за анти-дискриминација на работните места?
Equality & non-discrimination;Goods & services (gender identity);Исходно гиендерното идентификацијо е експлицитно вклучено во законодавството за антидискриминација на доброто и услугите?;Дали идентитетот на полотро треба да биде изрично вклучен во законодавството за анти-дискриминација на стоки и услуги?;Дали родовата идентитет да биде исклучен во законодавството за антидискриминациска политика на добровољните услуги?
Equality & non-discrimination;Education (gender identity);Дискриминацијата на основа на идентитетот на полта во областа на образованието е забранета според законодавството?;Да се забранува дискриминацијата на основа на родното изразување во образованието, со законска мерка?;Дали да се дозволи дискриминација врз основа на родовата идентитет во областите за образование според законодавството?
Equality & non-discrimination;Health (gender identity);Дискриминацијата заснована на полната идентитет во здравствениот систем е забранета според законодавството?;Дали треба да се забранува дискриминација врз основа на идентитетот на полот и во областа на здравството со закон?;Дали треба да се дозволи дискриминација врз основа на полната идентитет во здравствениот домен преку законодавство?
Equality & non-discrimination;Conversion practices ban (gender identity);Се постојат законодавство и политики што забрануваат преобразување или репаративни праксиси коишто се стремат да промени полната идентитет на младинец.;Дали да се забрани законите и политики кои дозволуваат претворување или репаративни практици со цел да се промени полната идентитет на младина?;Да има ли законодавство и политики кои да овозможуваат промена или репаративни практички дејства кои се насочени кон промена на полната идентитет на момчето/девојката?
Equality & non-discrimination;Equality body mandate (gender identity);Саатните институции за човекови права или тела за равенство се конкретно наредуваат да ги обраќаат и систематски да работат на прашањата поврзани со идентитетот на полот?;Дали националните институции за човекови права или тела за равенство треба да се изрично обврзуваат да се занимаваат со прашања поврзани со идентитетот на полтата?;Дали националните институции за човекови права или тела за равенство не треба да се обврзуваат да ги решаваат питањата поврзано со идентитетот на полот?
Equality & non-discrimination;Equality action plan (gender identity);Има ли планс за еднаква акција којашто експлицитно вклучува идентитет на полот и конкретни мерки за напредок?;Ако да постои план за мерки за еднакво прифаќање, кој експлицитно вклучува идентитет на полот и конкретни мерки за напредок?;Дали идентитетот на полот да се избегне во планите за акција за еднаквост?
Equality & non-discrimination;Law (gender expression);Или се изразувањето на полтворно експлицитно е вклучено во законодавството за борба против дискриминација?;Да ли експлицитно да биде вклучено изразувањето на пол во законодавството за борба против дискриминацијата?;Дали гендерното изразување треба експлицитно да се исклучи во законодавството за противдискриминација?
Equality & non-discrimination;Constitution (sex characteristics);Дојде конstitutionто забранува дискриминација на основа на полски карактеристики?;Дали Уставот да забранува дискриминација врз основа на полските карактеристики?;"Ако Уставот не треба да забранува дискриминација врз основа на полови прилози?

(Ako Ustavot ne treba da zabranuva diskriminacija vrz osnova na polovi prilozi?)"
Equality & non-discrimination;Employment (sex characteristics);Сеатите на полот не се вклучуваат во законодавството за антидискриминација во врска со работа?;Дали сексуалните карактеристики треба да биде експлицитно вклучени во законодавството за анти-дискриминација на работа?;Дали сексуалните карактеристики да се исклучат во законодавството за анти-дискриминација на радот?
Equality & non-discrimination;Goods & services (sex characteristics);Сеатсите на полотворените одлики експлицитно се вклучени во законодавството за антидискриминација на стоки и услуги?;Дали спектарите на полот делуват да се вклучуваат отворено во законодавството за борба против дискриминација на добиени и услуги?;Дали полните карактеристики треба да се исклучат во законодавството за борба против дискриминација при нудениотите и услугите?
Equality & non-discrimination;Education (sex characteristics);Дискриминацијата на основа на полните карактеристики во областа на образованието е забранета со законодавството ли?;Да ли треба да се забранува дискриминацијата на основа на полските карактеристики во областа на образованието со законодавство?;Дали било дозволено со законодавство да се практикува дискриминација врз основа на полните карактеристики во областа на образованието?
Equality & non-discrimination;Health (sex characteristics);Дискриминацијата на основа на полските карактеристики во областа за здравството е забранета според законодавството?;Дали законот да ги забрани дискриминациите засновани на половите карактеристики во здравственото работе?;Дали да се дозволи дискриминација врз основа полски карактеристики во здравствениот систем преку законодавство?
Equality & non-discrimination;Equality body mandate (sex characteristics);Са институциите за национални човечки права или еднаквости не е експлицитно мандатирани да се обраќаат и систематски да работат на прашањата поврзани со полските карактеристики?;Дајат ли националните институции за човекови права или тела за равенство да се конкретно уполномостени да се обраќаат на прашањата поврзани со полските карактеристики?;Да ли институциите за национални човекови права или еднаквост треба да се обврзуваат да ги решаваат прашањата врз основа на полските карактеристики?
Equality & non-discrimination;Equality action plan (sex characteristics);Ама постоји план за акција на рамноправност која експлицитно вклучува полни одлики и конкретни мерки за напредок?;Да има план за еднаквост со експлицитно вклучување на идентитетот на полот и конкретни мерки за напредок?;Дали сеќетстните одлики да се изостават во акциските планови за рамноправност?
Equality & non-discrimination;Blood donations;Донирок крв или биолошки ткина од било која вид на физичко телесно растојание за ЛГБТИ луѓе поврзани со нивната полна ориентација или идентитет на полот се слободни од законодавска или административна забрана?;Да ли доброволно дадување крв или било кој вид на ткива од лешта за ЛГБТИ лица врз основа на нивната сексуална ориентација или идентитет на полот врзед без законодавство или административно забрана?;Да се ли дарувањето на крв или било кој вид на ткива на телото за ЛГБТИ лица врз основа на нивната половна ориентација или идентитет на полот не треба да биде предмет на законодавна или административна забрана?
Family;Marriage equality;Секоја спојување ист пол не може да се венча со истиот степен на права како што се венчаваат различните полови парови?;Да се истата-истакуваат спонски парови да се оженија со истиот степен на права како што се оженија разликувани-полни спонски парови?;Да ли истите сексуални парови не би требале да имаат иста степен на права како што се доделува на браковите различен пол?
Family;Registered partnership (similar rights to marriage);Секоја заемна пара може да влезе во регистриран партнерство/цивилен брак и да добие исто ниво на права како ако би се венчале.;Да им да добијат исто право како ако биле соенети.;Да ли истите пари не би требело да можат да влезат во зделка/цивилен брак и да добиваат истата степен на права како ако бија се омажиле?
Family;Registered partnership (limited rights);Семејствата со истполно ли сме способни да влезат во звање на партнерство/цивилен брак со различни и значително слаби права од оние кои ги понудува бракот?;Да ли истите споени парови треба да можат да влезат во регистриран сојуз/граждански сојуз со различни и значитно слаби права од оние кои се понудуваат со бракот?;Што се не би да истите спонauerки не можат да влезат во регистриран брак/цивилен брак со различни и значитно слаби права од оние кои се нудат со бракот?
Family;Cohabitation;Сосема сеќетни парови вклучени се во законодавството или легалните мерки за заедничка живеење?;Дали истите спојени парови да се вклучат во законодавството или правни мерки за живеење заедно?;Дали истите сексуални парови да биде исклучени од законодавството или правните мерки за сојување?
Family;No constitutional limitation on marriage;Не постои конститутивна дефиниција за брак како само сојаже помеѓу маж и жена?;Ако нема конститутивна дефиниција за брак како сојаж е само меѓу маж и жена?;Дали треба да има конститутивна дефиниција за брак како само сојуз меѓу еден човек и една жена?
Family;Joint adoption;Можат ли истите пари од иста спојница легално да се пријават за заедно усвојување?;Да ли истите спортски пари би требало да има можност да се пријават за заедно усвојување легално?;Да ли истите сексуални парови не би требало да има право да пријават заедно усвојување легално?
Family;Second-parent adoption;Чистите спојувни парови може да се пријават за второ родителско усвојување легално?;Да ли истите сексуални парови треба да можат да се пријават за разгледување на посвојувањето като втор родител?;Да ли истите сексуални парови не треба да можат да се пријавуваат за адуција на втор родител?
Family;Automatic co-parent recognition;Се деца се раѓаат кај парови, без разлика од сексуалната ориентација или полот на партнерите, да бидат легално признати од раѓањето во врска со обете членки на парот без препреки?;Детите родени од парови, без разлика дали се работи за мажи, жени или лица со друго сексуално изразување или идентитет на полотвор, да бидат легално признати од раѓањето во врска со обата члена на парот без препреки?;Да деца родени од парови не треба да биде легално признати од раѓањето според обата членови на парот врз основа на ориентацијата или идентитетот на парот по полот или сексуалната ориентација?
Family;Medically assisted insemination (couples);Сопствата (без разлика на сексуалното опредеање и/или идентитетот на партнерите) не се соочуваат со никакви легални бариери за да добијат тракции за плодност?;Што паровите да не се соочуваат со никаква правна бариера при добивањето на ферилизна помош, без разлика дали партнерите имаат исто или друго родно определие и/или пол?;Дали парите да се суочат со правни бариери за добивање третман на стерилитет поради ориентацијата и/или полната идентитет на партнерите?
