criterion_id;Fact;Support;Opposition
65;Jesu li javni događaji LGBTI osoba zaštićeni od strane javnih vlasti koje osiguravaju njihovo nesmetano odvijanje, uključujući zaštitu od ometanja ili napada?;Trebaju li javni događaji LGBTI osoba biti zaštićeni od strane javnih vlasti koje osiguravaju njihovo nesmetano odvijanje, uključujući zaštitu od ometanja ili napada?;Ne bi li javne LGBTI događaje trebale štititi javne vlasti koje osiguravaju njihov nesmetan tijek, uključujući zaštitu od ometanja ili napada?
66;Postoje li pravna i administrativna ograničenja u funkcioniranju LGBTI organizacija ili publikacija?;treba li postojati pravna i administrativna ograničenja u funkcioniranju lgbti organizacija ili publikacija?;treba li postojati pravna i administrativna ograničenja u funkcioniranju lgbti organizacija ili publikacija?
67;Zar lgbti branitelji ljudskih prava nisu zastrašeni i kriminalizirani zbog svog rada?;Zar branitelji ljudskih prava LGBT osoba ne bi trebali biti zastrašivani i kriminalizirani zbog svog rada?;Trebaju li branitelji ljudskih prava LGBT osoba biti zastrašivani i kriminalizirani zbog svog rada?
68;Zar ne postoje izričiti vladini propisi koji zabranjuju organizacijama primanje sredstava?;Zar ne bi trebalo postojati izričito vladino zakonodavstvo koje zabranjuje organizacijama primanje sredstava?;Trebaju li postojati izričiti vladini propisi kojima se organizacijama zabranjuje primanje sredstava?
69;Ne postoji li zakonodavstvo na nacionalnoj ili lokalnoj razini koje ograničava slobodu izražavanja o LGBTI pitanjima?;treba li na nacionalnoj ili lokalnoj razini postojati zakonodavstvo koje ograničava slobodu izražavanja o lgbti pitanjima?;treba li na nacionalnoj ili lokalnoj razini postojati zakonodavstvo koje ograničava slobodu izražavanja o lgbti pitanjima?
70;Je li seksualna orijentacija izričito uključena u zakon o azilu kao kvalifikacijski kriterij?;Treb li seksualna orijentacija izričito biti uključena u zakon o azilu kao kvalifikacijski kriterij?;Treb li seksualna orijentacija biti isključena iz zakona o azilu kao kvalifikacijski kriterij?
71;Postoje li nacionalne politike ili pravne ili nepravne mjere vezane uz azil koje se posebno bave potrebama gej, lezbijskih i biseksualnih izbjeglica ili tražitelja azila?;Trebaju li postojati nacionalne politike ili pravne ili nepravne mjere u vezi s azilom koje se posebno bave potrebama gej, lezbijskih i biseksualnih izbjeglica ili tražitelja azila?;ne bi li trebalo postojati nacionalne politike ili pravne ili nepravne mjere u vezi s azilom koje se posebno bave potrebama gej, lezbijskih i biseksualnih izbjeglica ili tražitelja azila?
72;Je li rodni identitet izričito uključen u zakon o azilu kao kvalifikacijski kriterij?;Trebalo li bi rodni identitet izričito uključiti u azilno pravo kao kvalifikacijski kriterij?;Trebalo li bi rodni identitet izuzeti iz zakona o azilu kao kvalifikacijski kriterij?
73;Postoje li nacionalne politike ili pravne ili nepravne mjere vezane uz azil koje se posebno bave potrebama trans i nebinarnim izbjeglicama ili tražiteljima azila?;trebaju li postojati nacionalne politike ili pravne ili nepravne mjere u vezi s azilom koje se posebno bave potrebama trans i nebinarnim izbjeglicama ili tražiteljima azila?;ne bi li trebalo postojati nacionalne politike ili pravne ili nepravne mjere u vezi s azilom koje se posebno bave potrebama trans i nebinarnih izbjeglica ili tražitelja azila?
74;Je li interseks status ili spolne karakteristike izričito uključeni u zakon o azilu kao kriterij za stjecanje statusa?;Trebaju li interseksni status ili spolne karakteristike biti izričito uključeni u zakon o azilu kao kriterij za stjecanje statusa?;Trebaju li interseks status ili spolne karakteristike biti isključeni iz zakona o azilu kao kriterij za stjecanje statusa?
75;Postoje li nacionalne politike ili pravne ili nepravne mjere vezane uz azil koje se posebno bave potrebama interseks izbjeglica ili tražitelja azila?;trebaju li postojati nacionalne politike ili pravne ili nepravne mjere u vezi s azilom koje se posebno bave potrebama interseks izbjeglica ili tražitelja azila?;ne bi li trebalo postojati nacionalne politike ili pravne ili nepravne mjere u vezi s azilom koje se posebno bave potrebama interseks izbjeglica ili tražitelja azila?
