Category;Subcategory;Fact;Support;Opposition
Intersex bodily integrity;Access to justice for victims and reparations;Рыбоходит запрет медицинских вмешательств на интерсексуальные несовершеннолетние включает механизмы, признающие прошлые вредные последствия, обеспечивая компенсацию или возмещение, гарантируя доступ к правосудию и право на истину?;Если запрет медицинских вмешательств на минорах с интерсекс-развитием включает механизмы, признающие прошлые вредные последствия, обеспечивающие компенсацию или компенсацию, обеспечивая доступ к правосудию и право на истины?;Если запрет на медицинские вмешательства у интерсекс-minor исключает механизмы, которые признают прошлые вредные последствия, обеспечивают компенсацию или возмещение, гарантируют доступ к правосудию и право на истину?
Civil society space;Public event held, no state obstruction of freedom of assembly (last 3 years);Законодательство, политики и практика допускают полное осуществление права на свободу собрания, включая общественные события ЛГБТИ?;Должны ли законы, политики и практики обеспечивать полное осуществление права на свободное собрание, включая общественные события ЛГБТИ?;Должны ли законы, политики и практики не допускать полного осуществления права на свободу собрания, включая общественные события ЛГБТИ?
Civil society space;Public event held, there is enough protection (last 3 years);ЛГБИТИ общественные события защищены государственными органами, которые обеспечивают их нормальное проведение, включая защиту от помешканий или нападок?;Должны ли публичные события ЛГБТИ получать защиту со стороны общественных властей, которые обеспечивают их нормальное проведение, включая защиту от помешек или нападок?;Если публичные события ЛГБИТИ не защищены государственными органами, обеспечившими их нормальное проведение, включая защиту от помешек или нападений?
Civil society space;Associations operate, no state obstruction of freedom association (last 3 years);Нет ли законных и административных ограничений функционирования организаций или изданий ЛГБТИ?;Должны ли быть ограничения юридического и административного характера на функционирование организаций или изданий ЛГБТИ?;Должны ли быть юридическими и административными ограничениями на функционирование организаций или изданий ЛГБТИ?
Civil society space;LGBTI human rights defenders are not at risk;ЛГБТИ-дефендеры прав человека не устраиваемы и не криминализуются за их работу?;Вроде не должно быть под угрозой и криминализовано за их деятельность тех, кто защищает права ЛГБТИ-людей?;Должны ли защитники прав ЛГБТИ быть запугиваемыми и криминализованными за свою работу?
Civil society space;No laws limiting external funding;Нет ли явных правительственных регулировок, запрещающих организациям получать финансирование?;Должны ли не быть экспlicitными правительственными регулямией запрещающими организациям получать финансирование?;Должны ли быть явными государственными регулямиями, запрещающими организациям получать финансирование?
Civil society space;No laws limiting freedom of expression (national/local);Нет законодательства, ограничивающего свободу выражения по вопросам ЛГБТИ, ни на национальном, ни на местном уровне?;Быть ли законодательством, ограничивающим свободу слова по вопросам ЛГБТИ, как на национальном, так и на местном уровне?;Должны ли быть законодательными ограничениями свободы выражения по вопросам ЛГБТИ?
Asylum;Asylum law (sexual orientation);И сексуальное направление открыто включено в закон о политическом убежище как критерий квалификации?;Должны ли сексуальная ориентация быть включенной в закон об убежище как критерий квалификации?;Должны ли половая ориентация быть исключена из закона об убежище как критерий квалификации?
Asylum;Other positive measures (sexual orientation);Существуют ли национальные политики или юридические и неюридические меры в отношении убежища, которые напрямую адресуют потребности беглых гомосексуалов, лесбиянок и бисексуалов или претендентов на убежище?;Должны быть национальными политиками или юридическими или не юридическими меры, связанные с убежищем, которые специально адресуют нужды беглых гомосексуальных, лесбийских и бисексуальных лиц в статусе беженцев или ищущих убежища?;Должны ли не быть национальными политиками или юридическими и не юридическими мерами в связи с убежищем, которые конкретно учитывают нужды беженцев и ищущих убежища лесбиянок, гомосексуалов и бисексуалов?
Asylum;Asylum law (gender identity);Есть ли половая идентичность включена в закон о убежище как квалификационный критерий?;Должна ли гендерная идентичность быть открыто выраженной в законе о приёме убежища как квалификационным критерием?;Должен ли гендерная идентичность исключаться как квалификационный критерий в законах о убежище?
Asylum;Other positive measures (gender identity);Существуют ли национальные политики или юридические и неюридические меры, связанные с убежищем, которые конкретно отвечают на потребности беженцев и просителей убежища, трансгендерных и небинарных, в их нуждах?;Должны ли быть национальными политиками или юридическими и не юридическими мерами, связанными с убежищем, которые конкретно учитывают нужды трансгендерных и небинарных беженцев или лица, ищащущие убежище?;Должны ли не быть национальными политиками или юридическими или нерегулируемыми мерами в отношении убежища, которые конкретно учитывают потребности беженцев и просителей убежища, трансгендерных и небинарных?
Asylum;Asylum law (intersex);Истинский статус или признаки пола экспрессно включены в закон о политическом убежище как квалификационный критерий?;Должны ли статус интерсекса или характеристики пола быть включены в качестве критерия квалификации в законе о политическом убежище?;Должны ли статус интерсекса или признаки пола исключаться в законе об убежище как критерий квалификации?
Asylum;Other positive measures (intersex);Существуют ли национальные политики или юридические и неюридические меры, связанные с убежищем, которые конкретно адресуют нужды интерсекс-уходящих беженцев или претендентов на убежище?;Должны ли быть национальными политиками или юридическими или неюридическими мерами, связанными с пристанищем, которые конкретно учитывают нужды интерсексуальных беженцев или просителей убежища?;Должны ли не быть национальными политиками или правовыми и неправовыми мерами, связанными с убежищем, которые бы конкретно учитывали нужды интерсекс-беглецов или лиц, ищущих убежище?
