Category;Subcategory;Fact;Support;Opposition
Civil society space;Public event held, no state obstruction of freedom of assembly (last 3 years);До законодавството, политиките и практиките дозволуваат за целосно вршување на правото на слободен собир, вклучувајќи јавни догнации на ЛГБТИ?;Дали закони, политики и практики дозволуваат полен извршувач на правото на слободно собирание, вклучувајќи јавни настани на ЛГБТИ?;Дали законите, политиките и практиките не дозволуваат за целосно вежбање на правото на слободно собирање, вклучувајќи ги јавните настани на ЛГБТИ?
Civil society space;Public event held, there is enough protection (last 3 years);Се јавни ЛГБТИ настани се заштитени од страна на јавните власти кои ги обезбецуваат нивното нормално текнење, вклучувајќи и заштита од прекршок или напад?;Дали ЛГБТИ обществени настани да биде заштитени од страна на јавните власти кои ги гарантираат нивното нормално трајање, вклучувајќи и заштита од прекршок или напад?;Ако лГБТИ публичните настани не се заштитуваат од јавните власти кои го обезбежуваат нивното регуларно текнење, вклучувајќи заштита од прекинување или напади?
Civil society space;Associations operate, no state obstruction of freedom association (last 3 years);Арти не постојат никакви правни и административни ограничувања на функционирањето на организациите или објавувањата на ЛГБТИ организации?;Дали да постои без ограничувања на легални и административни забрани на функционирањето на организациите или изданијата на ЛГБТИ?;Дали треба да има легални и административни ограничувања за функционирањето на организациите или издавнините на ЛГБТИ?
Civil society space;LGBTI human rights defenders are not at risk;Сите ЛГБТИ борците за човекови права не се плашат и криминализирани заради нивното работа?;Да ли правозащитниците од ЛГБТИ зафатените не треба да се загрозуваат и криминализираат поради нивното работно време?;Да ли лГБТИ активистите за човекови права треба да се интимираат и криминализираат заради нивната работа?
Civil society space;No laws limiting external funding;Не постојат ли изразumni Регуларни одлуки на Владата кои забрануваат на организациите да добиваат финансиска помош?;Да не треба да постојат експlicitни владини регули за забрана на финансиското поддршка кон организациите?;"Ако постојат да биде забранети владино регулативни актови за организациите од примање на фондова?

(Note: This is a literal translation, and the sentence may not be a perfect natural equivalent in Macedonian.)"
Civil society space;No laws limiting freedom of expression (national/local);Дали нема законодавство што ограниCUва слободата на изразување на ЛГБТИ вprašка, ни на национално ниво и ни на локално?;Ако не постои закон за ограничување на слободата на изразување врз основа на ЛГБТИ прашања, и на национално и локално ниво?;Дали треба да постои законодавство која го ограничува слободото на изразување кога се обработуваат питањата на ЛГБТИ лице?
Asylum;Asylum law (sexual orientation);Сексуоротата на идентитетот не е експресивно вклучена како квалификациска критерија во законот за азил.;Дали сексуалната ориентација треба да биде изрично вклучена како квалитативен критериум во законот за убежиште како јавно критериум?;Дали сексуалното опредељување да биде исклучено како квалификациска критеријум во законот за азил?
Asylum;Other positive measures (sexual orientation);Се постојат ли национални политики или правни или неправни мерки поврзани со азил кои дирекно се обраќаат на потребите на гомосексуалните, лесбийските и бисексуалните рефугирани или побараоци за азил?;Дали треба да постојат национални политики или правни или неправни мерки поврзани со азил кои конкретно ги обраќаат потребите на глеи, лесбиските и бисексуалните избегали или трагачи за азил?;Ако не постои национални политики или законодавски или немрежни мерки поврзани со азил кои конкретно се обраќаат на потребите на гаштени, лесбийки и бисексуални избегали или зајмувачи?
Asylum;Asylum law (gender identity);Есќ ли се еденливиот пол изразно вклучен како квалификациско критериум во законот за азил?;Да ли сексуалната идентитет да биде изрично вклучен како квалификациски критериум во законот за азил?;Дали се изврши исклучување на идентитетот на полтото како кriterium за квалификување во законот за азил?
Asylum;Other positive measures (gender identity);Се постојат ли национални политики или закони или мерки без законски статус кои директно се обраќаат на потребите на трансовите и не-бинарните бегалци или барањата за азил?;Да постојат национални политики или правни или неправни мерки поврзани со азил што конкретно се обраќаат на потребите на трансови и не-бинарни рефугирања или барања за азил.;Да не постои национални политики или легални или нелегални мерки поврзани со азил што конкретно се обраќаат на потребите на транс и небинарни бегалци или побунувалци?
Asylum;Asylum law (intersex);Дали статусот на интерсекс или карактеристиките на полотво директно се вклучуваат во законот за азил како квалитативен кriterij?;Дали интерсексуалното статус или полните карактеристики треба да се изрично вклучат како квалификациска критерија во законот за азил?;Дали интерсексуалното статус или карактеристиките на пол да се исклучат како квалификациско критериум во законодавството за азил?
Asylum;Other positive measures (intersex);Се постојат ли национални политики или законски или не-законски мерки поврзани со азил што специфично се обраќаат на потребите на интерсексуалните бегалци или побарувачи на азил?;Да се има национални политики или законодавски или нејзаконски мерки поврзано со азил што специјално ги обраќаат потребите на интерсексуалните избегали или тие кои бараат азил?;Дали не постои национални политики или правни или неправни мерки поврзани со азил кои експлицитно се обраќаат на потребите на интерсексуалните бегинци или бегинките?
