Category;Subcategory;Value;Description;Support;Opposition;Fact-Check
Equality & non-discrimination;Constitution (sexual orientation);0.16;"Constitution (sexual orientation) covers constitutional (or similar) anti-discrimination provisions. To comply with this criterion, the country should fall under one of the following categories:
- The Constitution contains an anti-discrimination article which explicitly includes sexual orientation in the list of prohibited grounds of discrimination.
- The Constitution contains a general or ambiguous anti-discrimination article, but discrimination based on sexual orientation is effectively prohibited by this article. This must be demonstrated in the Constitutions preparatory work, legislative history, or in case law from the highest judicial bodies (e.g. Constitutional Court, Supreme Court, etc.).
- The Constitution indirectly prohibits discrimination based on sexual orientation, e.g. by declaring that the European Convention on Human Rights is part of the Constitution or has a constitutional status (declarations that have been implemented consistently by the courts)";The Constitution should explicitly prohibit discrimination based on sexual orientation.;The Constitution should not prohibit discrimination based on sexual orientation.;The Constitution contains an article that prohibit discrimination based on sexual orientation.
Equality & non-discrimination;Employment (sexual orientation);1.1;Employment (sexual orientation) covers employment anti-discrimination legislation. Only express mention of sexual orientation should be counted.;Employment laws should prohibit discrimination based on sexual orientation in employment.;Employment laws should not prohibit discrimination based on sexual orientation in employment.;Employment laws include sexual orientation as grounds of discrimination.
Equality & non-discrimination;Goods & services (sexual orientation);1.1;Employment laws should explicitly prohibit discrimination based on sexual orientation.;Laws should prohibit discrimination based on sexual orientation in access to goods and services.;Laws should not prohibit discrimination based on sexual orientation in access to goods and services.;Laws prohibit discrimination based on sexual orientation in access to goods and services.
Equality & non-discrimination;Education (sexual orientation);1.1;Laws should explicitly prohibit discrimination based on sexual orientation in the field of education.;Laws should prohibit discrimination based on sexual orientation in education.;Laws should not prohibit discrimination based on sexual orientation in education.;Laws prohibit discrimination based on sexual orientation in the field of education.
Equality & non-discrimination;Health (sexual orientation);1.1;Health (sexual orientation) covers legislation prohibiting discrimination in the field of health. Only express mention of sexual orientation only should be counted.;Laws should prohibit discrimination based on sexual orientation in healthcare.;Laws should not prohibit discrimination based on sexual orientation in healthcare.;Laws prohibit discrimination based on sexual orientation in the field of healthcare.
Equality & non-discrimination;Conversion practices ban (sexual orientation);0.8;Conversion practices ban (sexual orientation) for minors covers legislation and policies prohibiting reparative or conversion practices which are based upon the assumption that homosexuality/bisexuality per se is a mental disorder or based upon the a priori assumption that a patient should change their sexual orientation.;Laws should prohibit conversion or reparative practices aimed at changing a minor's sexual orientation.;Laws should allow conversion or reparative practices aimed at changing a minor's sexual orientation.;Laws prohibit conversion or reparative practices aimed at changing a minors sexual orientation.
Equality & non-discrimination;Equality body mandate (sexual orientation);0.78;Equality body mandate (sexual orientation) covers when a national human rights institution / equality body is explicitly mandated to work on sexual orientation in its law/founding documents, and where the national human rights institution / equality body is systematically working on issues covering sexual orientation.;Human rights institution or equality body should be explicitly mandated and active in addressing issues related to sexual orientation.;An equality body should not be involved in addressing issues related to sexual orientation.;National human rights institutions or equality bodies are actively engaged in addressing issues related to sexual orientation.
Equality & non-discrimination;Equality action plan (sexual orientation);0.88;"Equality action plan (sexual orientation) covers action plans which expressly include sexual orientation, and include specific measures for progress. In addition, we only take into account when the action plan either entails or is followed up with the following measures:
- Detailed projects or initiatives within the time span
- Allocation of resources (financial or human resources)
- Clear responsibilities for proper implementation
- Setup of monitoring procedure";National equality action plans should include sexual orientation and contain concrete implementation measures, monitoring, resources, and responsibilities.;National equality action plans should not include or address sexual orientation.;National equality action plans include sexual orientation and contain concrete implementation measures such as monitoring, resources, and responsibilities.
Equality & non-discrimination;Constitution (gender identity);0.16;"Constitution (gender identity) covers constitutional (or similar) anti-discrimination provisions. To comply with this criterion, the country should fall under one of the following categories:
- The Constitution contains an anti-discrimination article which explicitly includes gender identity in the list of prohibited grounds of discrimination.
- The Constitution contains a general or ambiguous anti-discrimination article, but discrimination based on gender identity is effectively prohibited by this article. This must be demonstrated in the Constitutions preparatory work, legislative history, or in case law from the highest judicial bodies (e.g. Constitutional Court, Supreme Court, etc.).
- The Constitution indirectly prohibits discrimination based on gender identity, e.g. by declaring that the European Convention on Human Rights is part of the Constitution or has a constitutional status (declarations that have been implemented consistently by the courts)";The Constitution should explicitly prohibit discrimination based on gender identity.;The Constitution should not prohibit discrimination based on gender identity.;The Constitution contains an article that prohibit discrimination based on gender identity.
Equality & non-discrimination;Employment (gender identity);1.1;Employment (gender identity) covers employment anti-discrimination legislation. Only express mention of gender identity should be counted.;Employment laws should prohibit discrimination based on gender identity in employment.;Employment laws should not prohibit discrimination based on gender identity in employment.;Employment laws include gender identity as grounds of discrimination.
Equality & non-discrimination;Goods & services (gender identity);1.1;Employment laws should explicitly prohibit discrimination based on gender identity.;Laws should prohibit discrimination based on gender identity in access to goods and services.;Laws should not prohibit discrimination based on gender identity in access to goods and services.;Laws prohibit discrimination based on gender identity in access to goods and services.
Equality & non-discrimination;Education (gender identity);1.1;Laws should explicitly prohibit discrimination based on gender identity in the field of education.;Laws should prohibit discrimination based on gender identity in education.;Laws should not prohibit discrimination based on gender identity in education.;Laws prohibit discrimination based on gender identity in the field of education.
Equality & non-discrimination;Health (gender identity);1.1;Health (gender identity) covers legislation prohibiting discrimination in the field of health. Only express mention of gender identity only should be counted.;Laws should prohibit discrimination based on gender identity in healthcare.;Laws should not prohibit discrimination based on gender identity in healthcare.;Laws prohibit discrimination based on gender identity in the field of healthcare.
Equality & non-discrimination;Conversion practices ban (gender identity);0.8;Conversion practices ban (gender identity) for minors covers legislation and policies prohibiting reparative or conversion practices which are based upon the assumption that homosexuality/bisexuality per se is a mental disorder or based upon the a priori assumption that a patient should change their gender identity.;Laws should prohibit conversion or reparative practices aimed at changing a minor's gender identity.;Laws should allow conversion or reparative practices aimed at changing a minor's gender identity.;Laws prohibit conversion or reparative practices aimed at changing a minors gender identity.
Equality & non-discrimination;Equality body mandate (gender identity);0.78;Equality body mandate (gender identity) covers when a national human rights institution / equality body is explicitly mandated to work on gender identity in its law/founding documents, and where the national human rights institution / equality body is systematically working on issues covering gender identity.;Human rights institution or equality body should be explicitly mandated and active in addressing issues related to gender identity.;Human rights institution or equality body should not be involved in addressing issues related to gender identity.;National human rights institutions or equality bodies are actively engaged in addressing issues related to gender identity.
Equality & non-discrimination;Equality action plan (gender identity);0.88;"Equality action plan (gender identity) covers action plans which expressly include gender identity, and include specific measures for progress. In addition, we only take into account when the action plan either entails or is followed up with the following measures:
- Detailed projects or initiatives within the time span
- Allocation of resources (financial or human resources)
- Clear responsibilities for proper implementation
- Setup of monitoring procedure";National equality action plans should include gender identity and contain concrete implementation measures, monitoring, resources, and responsibilities.;National equality action plans should not include or address gender identity.;National equality action plans include gender identity and contain concrete implementation measures such as monitoring, resources, and responsibilities.
Equality & non-discrimination;Law (gender expression);1.83;Law (gender expression) covers anti-discrimination legislation which expressly includes gender expression.;Laws should explicitly prohibit discrimination based on gender expression.;Laws should not prohibit discrimination based on gender expression.;Laws prohibit discrimination based on gender expression.
Equality & non-discrimination;Constitution (sex characteristics);0.16;"Constitution (sex characteristics) covers constitutional (or similar) anti-discrimination provisions. To comply with this criterion, the country should fall under one of the following categories:
- The Constitution contains an anti-discrimination article which explicitly includes sex characteristic in the list of prohibited grounds of discrimination.
- The Constitution contains a general or ambiguous anti-discrimination article, but discrimination based on sex characteristic is effectively prohibited by this article. This must be demonstrated in the Constitutions preparatory work, legislative history, or in case law from the highest judicial bodies (e.g. Constitutional Court, Supreme Court, etc.).
- The Constitution indirectly prohibits discrimination based on sex characteristic, e.g. by declaring that the European Convention on Human Rights is part of the Constitution or has a constitutional status (declarations that have been implemented consistently by the courts)";The Constitution should explicitly prohibit discrimination based on sexual characteristics.;The Constitution should not prohibit discrimination based on sexual characteristics.;The Constitution contains an article that prohibit discrimination based on sexual characteristics.
Equality & non-discrimination;Employment (sex characteristics);1.1;Employment (sex characteristics) covers employment anti-discrimination legislation. Only express mention of sex characteristic should be counted.;Employment laws should prohibit discrimination based on sexual characteristics in employment.;Employment laws should not prohibit discrimination based on sexual characteristics in employment.;Employment laws include sexual characteristics as grounds of discrimination.
Equality & non-discrimination;Goods & services (sex characteristics);1.1;Employment laws should explicitly prohibit discrimination based on sex characteristic.;Laws should prohibit discrimination based on sexual characteristics in access to goods and services.;Laws should not prohibit discrimination based on sexual characteristics in access to goods and services.;Laws prohibit discrimination based on sexual characteristics in access to goods and services.
Equality & non-discrimination;Education (sex characteristics);1.1;Laws should explicitly prohibit discrimination based on sex characteristic in the field of education.;Laws should prohibit discrimination based on sexual characteristics in education.;Laws should not prohibit discrimination based on sexual characteristics in education.;Laws prohibit discrimination based on sexual characteristics in the field of education.
Equality & non-discrimination;Health (sex characteristics);1.1;Health (sex characteristics) covers legislation prohibiting discrimination in the field of health. Only express mention of sex characteristic only should be counted.;Laws should prohibit discrimination based on sexual characteristics in healthcare.;Laws should not prohibit discrimination based on sexual characteristics in healthcare.;Laws prohibit discrimination based on sexual characteristics in the field of healthcare.
Equality & non-discrimination;Conversion practices ban (sex characteristics);0.8;Conversion practices ban (sex characteristics) for minors covers legislation and policies prohibiting reparative or conversion practices which are based upon the assumption that homosexuality/bisexuality per se is a mental disorder or based upon the a priori assumption that a patient should change their sex characteristic.;Laws should prohibit conversion or reparative practices aimed at changing a minor's sexual characteristics.;Laws should allow conversion or reparative practices aimed at changing a minor's sexual characteristics.;Law prohibit conversion or reparative practices aimed at changing a minors sexual characteristics.
Equality & non-discrimination;Equality body mandate (sex characteristics);0.78;Equality body mandate (sex characteristics) covers when a national human rights institution / equality body is explicitly mandated to work on sex characteristic in its law/founding documents, and where the national human rights institution / equality body is systematically working on issues covering sex characteristic.;Human rights institution or equality body should be explicitly mandated and active in addressing issues related to sexual characteristics.;An equality body should not be involved in addressing issues related to sexual characteristics.;National human rights institutions or equality bodies are actively engaged in addressing issues related to sexual characteristics.
Equality & non-discrimination;Equality action plan (sex characteristics);0.88;"Equality action plan (sex characteristics) covers action plans which expressly include sex characteristic, and include specific measures for progress. In addition, we only take into account when the action plan either entails or is followed up with the following measures:
- Detailed projects or initiatives within the time span
- Allocation of resources (financial or human resources)
- Clear responsibilities for proper implementation
- Setup of monitoring procedure";National equality action plans should include sexual characteristics and contain concrete implementation measures, monitoring, resources, and responsibilities.;National equality action plans should not include or address sexual characteristics.;National equality action plans include sexual characteristics and contain concrete implementation measures such as monitoring, resources, and responsibilities.
Equality & non-discrimination;Blood donations;0.91;"Blood donation covers when there is no full legislative or administrative ban on donating blood or on any kind of bodily tissues for LGBTI people based on their sexual orientation or gender identity. Any deferral periods need to be reasonable and justified. This also includes when health authorities and practitioners make sure that:
- Decisions on time restrictions are taken on individual basis and based on risks assessments related to sexual behaviours of candidates, not on their sexual orientation or gender identity.
- The sexual history of candidates to blood/tissue donations are treated in a non-judgmental manner.
- All relevant documents are exempt from use of discriminatory formulations towards men who have sex with men and trans people.";Laws and administrations should allow blood and tissue donation for LGBTI people regardless of sexual orientation or gender identity.;Laws and administrations should ban blood and tissue donation for LGBTI people based on sexual orientation or gender identity.;There is no full legislative or administrative ban on donating blood or on any kind of bodily tissues for LGBTI people based on their sexual orientation or gender identity.
Family;Marriage equality;3.75;Marriage equality covers when same-sex couples can marry, with the same level of rights as married different-sex couples.;Laws should allow same-sex couples marriage with the same level of rights as married different-sex couples.;Laws should ban same-sex couples marriage.;Same-sex couples marriage is allowed by law, with the same level of rights as married different-sex couples.
Family;Registered partnership (similar rights to marriage);3.0;Registered partnership (similar rights to marriage) covers when same-sex couples can enter a registered partnership/civil partnership and obtain the same level of rights as they would if they were married;Laws should allow same-sex couples to enter a registered partnership/civil partnership and obtain the same level of rights as they would if they were married.;Laws should ban same-sex couples to enter a registered partnership/civil partnership and obtain the same level of rights as they would if they were married.;Same-sex couples are allowed by law to enter a registered partnership/civil partnership and obtain the same level of rights as they would if they were married.
Family;Registered partnership (limited rights);2.0;Registered partnership (limited rights) covers when same-sex couples can enter a registered partnership/civil partnership, but where the level of rights is different to, and is significantly weaker than the rights offered by marriage.;Laws should allow same-sex couples to enter a registered partnership/civil partnership, but with weaker rights than the ones offered by marriage.;Laws should ban same-sex couples to enter a registered partnership/civil partnership, even when it entails weaker rights than the ones offered by marriage..;Laws allow same-sex couples to enter a registered partnership/civil partnership, but with weaker rights than the ones offered by marriage.
Family;Cohabitation;1.0;Cohabitation covers when same-sex couples are included in legislation or legal measures on cohabitation.;Laws should include measures on cohabitation for same-sex couples.;Laws should not include measures on cohabitation for same-sex couples.;Laws include measures on cohabitation for same-sex couples.
Family;No constitutional limitation on marriage;0.75;No constitutional limitation on marriage covers when a constitutional definition (or similar) of marriage as being only a union between a man and a woman does not exist.;Constitution should not include a definition of marriage as being only a union between a man and a woman.;Constitution should define marriage as being only a union between a man and a woman.;Constitution do not include a definition of marriage as being only a union between a man and a woman.
Family;Joint adoption;3.0;Joint adoption covers when same-sex couples can legally apply for joint adoption.;Same-sex couples should be able to legally apply for joint adoption.;Same-sex couples should not be allowed to legally apply for joint adoption.;Same-sex couples can legally apply for joint adoption.
Family;Second-parent adoption;1.75;Second parent adoption covers when same-sex couples can legally apply for second parent adoption.;Same-sex couples should be able to legally apply for second parent adoption.;Same-sex couples should not be allowed to legally apply for second parent adoption.;Same-sex couples can legally apply for second parent adoption.
Family;Automatic co-parent recognition;1.75;Automatic co-parent recognition covers when children born to couples (regardless the partners’ sexual orientation and/or gender identity) are not facing any barriers in order to be recognised legally from birth to their parents.;Couples (regardless the partners’ sexual orientation and/or gender identity) should be legally and automatically recognised as co-parent from birth to childres.;Children born to couples (regardless the partners’ sexual orientation and/or gender identity) should not be legally recognised from birth to both members of the couple.;
Family;Medically assisted insemination (couples);2.0;Medically assisted insemination (couples) covers when couples (regardless the partners’ sexual orientation and/or gender identity) are not facing any legal barriers in order to get fertility treatment.;There should not be any legal barriers for couples (regardless the partners’ sexual orientation and/or gender identity) in accessing fertility treatment or assisted insemination.;There should be legal barriers for couples (based on the partners’ sexual orientation and/or gender identity) in accessing fertility treatment or assisted insemination.;There are no legal barriers for couples (regardless the partners’ sexual orientation and/or gender identity) in accessing fertility treatment or assisted insemination.
Family;Medically assisted insemination (singles);2.0;Medically assisted insemination (singles) covers when fertility treatment for individuals (regardless their sexual orientation and/or gender identity) is legally possible.;There should not be any legal barriers for singles (regardless their sexual orientation and/or gender identity) in accessing fertility treatment or assisted insemination as individual.;There should be legal barriers for singles (based on their sexual orientation and/or gender identity) in accessing fertility treatment or assisted insemination as individual.;There are no legal barriers for singles (based on their sexual orientation and/or gender identity) in accessing fertility treatment or assisted insemination as individual.
Family;Recognition of trans parenthood;2.5;"Recognition of trans parenthood covers when: 
-Parent’s legal gender identity is recognized in the documentation of kinship (e.g. birth certificate of child respects name, gender marker, gendered denomination “mother”/ “father” (where applicable) according to the parent’s recognised gender identity) 
-Regulations regarding recognition of parenthood is aligned with available gender options where more than 2 gender markers are available, e.g. “mother” and “father” are not the only available options; all parents are recorded as “parent” etc.";Laws should recognise a parent's legal gender identity in documentation of kinship and ensure recognition regardless of available gender markers.;Laws should not recognise a parent's legal gender identity in documentation of kinship.;Laws recognise a parent's legal gender identity in documentation of kinship and ensure recognition regardless of available gender markers.
Hate crime & hate speech;Hate crime law (sexual orientation);2.2;Hate crime law (sexual orientation) covers when sexual orientation is expressly included in hate crime legislation as an aggravating factor.;;;
Hate crime & hate speech;Hate speech law (sexual orientation);2.2;Hate speech law (sexual orientation) covers when sexual orientation is expressly included in hate speech legislation as an aggravating factor;;;
Hate crime & hate speech;Policy tackling hatred (sexual orientation);1.93;Policy tackling hate crime and hate speech (sexual orientation) covers when sexual orientation is included in a national strategy tackling hatred. This only refers to actions based on a recurrent and continuing framework by state actors (ad hoc measures do not count).;;;
Hate crime & hate speech;Hate crime law (gender identity);2.2;Hate crime law (gender identity) covers when gender identity is expressly included in hate crime legislation as an aggravating factor.;;;
Hate crime & hate speech;Hate speech law (gender identity);2.2;Hate speech law (gender identity) covers when sexual orientation is expressly included in hate speech legislation as an aggravating factor.;;;
