Category;Subcategory;Value;Description;Support;Opposition;Fact-Check
Hate crime & hate speech;Policy tackling hatred (gender identity);1.93;Policy tackling hate crime and hate speech (gender identity) covers when gender identity is included in a national strategy tackling hatred. This only refers to actions based on a recurrent and continuing framework by state actors (ad hoc measures do not count).;;;
Hate crime & hate speech;Hate crime law (intersex);2.2;Hate crime law (intersex) covers when bias based on the victim’s (perceived) sex characteristics or intersex status is expressly included in hate crime legislation as an aggravating factor.;;;
Hate crime & hate speech;Hate speech law (sex characteristics);2.2;Hate speech law (sex characteristics) covers when sex characteristics or intersex status is expressly included in hate speech legislation as an aggravating factor.;;;
Hate crime & hate speech;Policies tackling hatred (intersex);1.93;Policy tackling hate crime and hate speech (sex characteristics) covers when sex characteristics or intersex status is included in a national strategy tackling hatred. This only refers to actions based on a recurrent and continuing framework by state actors (ad hoc measures do not count).;;;
Legal gender recognition;No legal framework making legal gender recognition impossible;0.75;No legal framework making legal gender recognition impossible covers when there is no explicit ban or other kind of legal limitation which serves to make legal gender recognition practically impossible. This point can be awarded when legal gender recognition procedures are onerous, difficult, or when there is no set pathway, so long as there is not an explicit mechanism in place blocking legal gender recognition entirely.;;;
Legal gender recognition;Existence of legal measures;1.5;Existence of legal measures covers legislation for legal gender recognition. This can include court decisions, as long as there is a procedure that provides consistent results.;;;
Legal gender recognition;Existence of administrative procedures;1.0;Existence of administrative procedures covers procedures for legal gender recognition which are not written in law. This includes change of gender on official documents to reflect the preferred gender. Administrative procedures are only taken into account when consistent implementation with no obstacle has been documented.;;;
Legal gender recognition;Name change;1.0;Name change covers existence of legislation which makes name change possible without any obstacles. This includes deed poll.;;;
Legal gender recognition;No age restriction (Name change);0.15;No age restriction, Name change covers when there is no explicit age restriction for minor to change their name.;;;
Legal gender recognition;Self-determination;2.0;"Self-determination covers when 
-Legal gender recognition is based exclusively on the expressed wish of the person concerned e.g. by declaration 
-Does not require third party involvement, e.g. judge, medical expert, intercessor 
-Intersex status and/ or sex characteristics are not a contraindication";;;
Legal gender recognition;Non-binary recognition;1.0;"Non-binary gender recognition is awarded if: 
-More than two gender marker options (“X”, “NB”, “other”, or other option(s)) are available in the public registry (e.g. Register of Births, etc.); and 
-Available only on request; not applied to anyone without their personal consent; and 
-There is a procedure which provides consistent results; and 
-Available to anyone who seeks it without discrimination. 
-–OR– 
-No mandatory recording of gender marker in the public registry (ability to opt out from recording of gender marker available to all, not only trans/intersex people).";;;
Legal gender recognition;No 'Gender Identity Disorder' diagnosis/psychological opinion required;1.75;No ‘Gender Identity Disorder’ diagnosis/psychological opinion required covers when a GID diagnosis is not a requirement for legal gender recognition.;;;
Legal gender recognition;No compulsory medical intervention required;1.15;No compulsory medical intervention required covers when medical interventions are not a requirement for legal gender recognition. This only refers to non-surgical medical interventions. This criteria only applies when consistent implementation with no obstacle has been documented.;;;
Legal gender recognition;No compulsory surgical intervention required;1.15;No compulsory surgical intervention required covers when any kind of surgical interventions are not a requirement for legal gender recognition. This criteria only applies when consistent implementation with no obstacle has been documented.;;;
Legal gender recognition;No compulsory sterilisation required;1.7;No compulsory sterilisation required covers when sterilisation or proof of infertility is not a requirement for legal gender recognition.;;;
Legal gender recognition;No compulsory divorce required;1.05;No compulsory divorce required covers when divorce or single status is not a requirement for legal gender recognition.;;;
Legal gender recognition;No age restriction;1.0;"No age restriction covers when existing legal measures for legal gender recognition do not include an explicit minimum or maximum age restrictions; individuals of any age use the same process; when the minor does not have full legal capacity, a legal representative can be obliged to make the procedures on their behalf.";;;
Legal gender recognition;Legal gender recognition procedures exist for minors;0.3;Legal gender recognition procedures exist for minors, covers when a legal measure for accessing legal gender recognition is available for minors and provides consistent results.;;;
Legal gender recognition;Depathologisation;2.0;"Depathologisation covers when: 
-No mental health diagnosis relating to trans identities in national clinical classification standards or equivalent; neither for adults/ adolescents nor for pre-puberty children 
-Access to and cost coverage for trans-specific healthcare (TSHC) for adults/ adolescents is possible without requiring a mental health assessment or diagnosis. 
-Access to and cost coverage for support services for pre-puberty trans and gender variant children is ensured without requesting a diagnosis of “Gender Incongruence in Childhood” (ICD11) or equivalent.";;;
Intersex bodily integrity;Prohibition of medical intervention without informed consent (intersex);2.5;Prohibition of medical intervention before child is able to give informed consent (intersex) covers when medical practitioners or other professionals are prohibited by law from conducting any kind of surgical or medical intervention on an intersex minor when the intervention has no medical necessity and can be avoided or postponed until the person can provide informed consent.;;;
Intersex bodily integrity;Universality of prohibition of medical interventions;0.5;"Universality of prohibition of medical interventions covers when bodily integrity protections are universal to all persons, not based on specific variations or diagnoses or intersex terms; and medical practitioners or other professionals are prohibited by law from conducting any kind of surgical or medical intervention on anybody without their personal consent except in the case of vital reasons. This point can only be awarded when “Prohibition of medical intervention before child is able to give informed consent” is also awarded.";;;
Intersex bodily integrity;Existence of effective monitoring mechanism;1.0;"Existence of effective monitoring mechanism covers when: 
-A monitoring mechanism for the prohibition of medical intervention on an intersex minor has been established. 
-The monitoring mechanism is an independent entity from the medical establishment.-
There are clear responsibilities for monitoring and reporting of the mechanism. 
-This point can only be awarded when “Prohibition of medical intervention before child is able to give informed consent” is also awarded.";;;
Intersex bodily integrity;Access to justice for victims and reparations;1.0;Access to justice for victims and reparations covers when prohibition of medical interventions on intersex minor provides adequate acknowledgement of the suffering and injustice caused to intersex people in the past and provides adequate redress, reparation, access to justice and the right to truth with clear and effective mechanisms.;;;
Civil society space;Public event held, no state obstruction of freedom of assembly (last 3 years);1.5;Public event held, no state obstruction of freedom of assembly (last 3 years) covers when laws, policies and practices allow for full exercise of the right to free assembly, so LGBTI public events are held without obstruction.;;;
Civil society space;Public event held, there is enough protection (last 3 years);1.5;Public event held, there is enough protection (last 3 years) covers when LGBTI public events are sufficiently protected by public authorities (e.g. police) who ensure their due course, including protection from disruption or attacks.;;;
Civil society space;Associations operate, no state obstruction of freedom association (last 3 years);1.5;Associations operate, no state obstruction of freedom association (last 3 years) covers when there are no legal and administrative restrictions on the functioning of LGBTI organisations or publications, including state registration, cooperation with authorities, access to national funding, etc.;;;
Civil society space;LGBTI human rights defenders are not at risk;1.5;LGBTI human rights defenders are not at risk covers when LGBTI human rights defenders are not intimidated and criminalised for their work (e.g. no LGBTI HRDs arrested, in jail or harassed by public authorities in relation to their human rights work and activism).;;;
Civil society space;No laws limiting external funding;1.5;No laws limiting receipt of funding covers when there are no explicit government regulations banning organisations from receiving funding (national, foreign and/or private) (e.g. ‘foreign agent’ laws).;;;
Civil society space;No laws limiting freedom of expression (national/local);1.5;No laws limiting expression (national/local) covers when there is no legislation limiting freedom of expression on LGBTI issues (e.g. anti-propaganda laws, censorship laws etc.) either at national or local level.;;;
Asylum;Asylum law (sexual orientation);1.5;Asylum law (sexual orientation) covers when sexual orientation is expressly included in asylum law as a qualification criteria.;;;
Asylum;Other positive measures (sexual orientation);1.5;Legislation/policy/other positive measures (sexual orientation) covers national policies and/or other legal or non-legal positive measures related to asylum that have specific provisions addressing the needs and rights of gay, lesbian and bisexual refugees and/or asylum seekers. This pertains solely to actions undertaken within a persistent and ongoing framework by governmental entities (isolated or ad hoc measures are not considered). Examples are consistent training framework for caseworkers, publicly available guidelines of the national agency for asylum prepared in partnership with LGBTI organisations, safe reception centres and accommodation options for LGBTI people, and other measures can be taken into account.;;;
Asylum;Asylum law (gender identity);1.5;Law (gender identity) covers when gender identity is expressly included in asylum law as a qualification criteria.;;;
Asylum;Other positive measures (gender identity);1.5;"Legislation/policy/other positive measures (gender identity) covers national policies and/or other legal or non-legal positive measures related to asylum that have specific provisions addressing the needs and rights of trans and non-binary refugees and/or asylum seekers. 
This pertains solely to actions undertaken within a persistent and ongoing framework by governmental entities (isolated or ad hoc measures are not considered). Examples are consistent training framework for caseworkers, access to legal gender recognition for trans and non-binary refugees, publicly available guidelines of the national agency for asylum prepared in partnership with LGBTI organisations, safe reception centres and accommodation options for trans and non-binary people, and other measures can be taken into account.";;;
Asylum;Asylum law (intersex);1.5;Law (intersex) covers when intersex status or sex characteristics is expressly included in law as a qualification criterion.;;;
Asylum;Other positive measures (intersex);1.5;"Legislation/policy/other positive measures (sex characteristics) covers national policies and/or other legal or non-legal positive measures related to asylum that have specific provisions addressing the needs and rights of intersex refugees and/or asylum seekers. 
This pertains solely to actions undertaken within a persistent and ongoing framework by governmental entities (isolated or ad hoc measures are not considered). Examples are consistent training framework for caseworkers, access to legal gender recognition for intersex refugees, publicly available guidelines of the national agency for asylum prepared in partnership with LGBTI organisations, safe reception centres and accommodation options for LGBTI people, and other measures can be taken into account.";;;